2023-11-23 22:34:51.694998 IP 172.16.10.9.54044 > 172.16.20.9.5004: UDP, length 1328
2023-11-23 22:34:51.696741 IP 172.16.10.9.54044 > 172.16.20.9.5004: UDP, length 1328
2023-11-23 22:34:51.697287 IP 172.16.10.9.54044 > 172.16.20.9.5004: UDP, length 1328
2023-11-23 22:34:51.697289 IP 172.16.10.9.54044 > 172.16.20.9.5004: UDP, length 1328
2023-11-23 22:34:51.697292 IP 172.16.10.9.54044 > 172.16.20.9.5004: UDP, length 1328
2023-11-23 22:34:51.697293 IP 172.16.10.9.54044 > 172.16.20.9.5004: UDP, length 1328
2023-11-23 22:34:51.697296 IP 172.16.10.9.54044 > 172.16.20.9.5004: UDP, length 1328
2023-11-23 22:34:51.697304 IP 172.16.10.9.54044 > 172.16.20.9.5004: UDP, length 1328
2023-11-23 22:34:51.697305 IP 172.16.10.9.54044 > 172.16.20.9.5004: UDP, length 1328
2023-11-23 22:34:51.697307 IP 172.16.10.9.54044 > 172.16.20.9.5004: UDP, length 1328
2023-11-23 22:34:51.698375 IP 172.16.10.9.54044 > 172.16.20.9.5004: UDP, length 1328
2023-11-23 22:34:51.702625 IP 172.16.10.9.54044 > 172.16.20.9.5004: UDP, length 1328
2023-11-23 22:34:51.702627 IP 172.16.10.9.54044 > 172.16.20.9.5004: UDP, length 1328
2023-11-23 22:34:51.702863 IP 172.16.10.9.54044 > 172.16.20.9.5004: UDP, length 1328
2023-11-23 22:34:51.702870 IP 172.16.10.9.54044 > 172.16.20.9.5004: UDP, length 1328
2023-11-23 22:34:51.702872 IP 172.16.10.9.54044 > 172.16.20.9.5004: UDP, length 1328
2023-11-23 22:34:51.702873 IP 172.16.10.9.54044 > 172.16.20.9.5004: UDP, length 1328
2023-11-23 22:34:51.702874 IP 172.16.10.9.54044 > 172.16.20.9.5004: UDP, length 1328
2023-11-23 22:34:51.702936 IP 172.16.10.9.54044 > 172.16.20.9.5004: UDP, length 1328
2023-11-23 22:34:51.704746 IP 172.16.10.9.54044 > 172.16.20.9.5004: UDP, length 1328
2023-11-23 22:34:51.704757 IP 172.16.10.9.54044 > 172.16.20.9.5004: UDP, length 1328
2023-11-23 22:34:51.704763 IP 172.16.10.9.54044 > 172.16.20.9.5004: UDP, length 1328
2023-11-23 22:34:51.704764 IP 172.16.10.9.54044 > 172.16.20.9.5004: UDP, length 1328
2023-11-23 22:34:51.705664 IP 172.16.10.9.54044 > 172.16.20.9.5004: UDP, length 1328
2023-11-23 22:34:51.705688 IP 172.16.10.9.54044 > 172.16.20.9.5004: UDP, length 1328
2023-11-23 22:34:51.705872 IP 172.16.10.9.54044 > 172.16.20.9.5004: UDP, length 1328
2023-11-23 22:34:51.705875 IP 172.16.10.9.54044 > 172.16.20.9.5004: UDP, length 1328
2023-11-23 22:34:51.707296 IP 172.16.10.9.54044 > 172.16.20.9.5004: UDP, length 1328
2023-11-23 22:34:51.707433 IP 172.16.10.9.54044 > 172.16.20.9.5004: UDP, length 1328
2023-11-23 22:34:51.707435 IP 172.16.10.9.54044 > 172.16.20.9.5004: UDP, length 1328
2023-11-23 22:34:51.707439 IP 172.16.10.9.54044 > 172.16.20.9.5004: UDP, length 1328
2023-11-23 22:34:51.708958 IP 172.16.10.9.54044 > 172.16.20.9.5004: UDP, length 1328
2023-11-23 22:34:51.708971 IP 172.16.10.9.54044 > 172.16.20.9.5004: UDP, length 1328
2023-11-23 22:34:51.708977 IP 172.16.10.9.54044 > 172.16.20.9.5004: UDP, length 1328
2023-11-23 22:34:51.708979 IP 172.16.10.9.54044 > 172.16.20.9.5004: UDP, length 1328
2023-11-23 22:34:51.711195 IP 172.16.10.9.54044 > 172.16.20.9.5004: UDP, length 1328
2023-11-23 22:34:51.711214 IP 172.16.10.9.54044 > 172.16.20.9.5004: UDP, length 1328
2023-11-23 22:34:51.711241 IP 172.16.10.9.54044 > 172.16.20.9.5004: UDP, length 1328
2023-11-23 22:34:51.711242 IP 172.16.10.9.54044 > 172.16.20.9.5004: UDP, length 1328
2023-11-23 22:34:51.711783 IP 172.16.10.9.54044 > 172.16.20.9.5004: UDP, length 1328
2023-11-23 22:34:51.711851 IP 172.16.10.9.54044 > 172.16.20.9.5004: UDP, length 1328
2023-11-23 22:34:51.711854 IP 172.16.10.9.54044 > 172.16.20.9.5004: UDP, length 1328
2023-11-23 22:34:51.712957 IP 172.16.10.9.54044 > 172.16.20.9.5004: UDP, length 1328
2023-11-23 22:34:51.714274 IP 172.16.10.9.54044 > 172.16.20.9.5004: UDP, length 1328
2023-11-23 22:34:51.714279 IP 172.16.10.9.54044 > 172.16.20.9.5004: UDP, length 1328
2023-11-23 22:34:51.714302 IP 172.16.10.9.54044 > 172.16.20.9.5004: UDP, length 1328
2023-11-23 22:34:51.714305 IP 172.16.10.9.54044 > 172.16.20.9.5004: UDP, length 1328
2023-11-23 22:34:51.714926 IP 172.16.10.9.54044 > 172.16.20.9.5004: UDP, length 1328
2023-11-23 22:34:51.714998 IP 172.16.10.9.54044 > 172.16.20.9.5004: UDP, length 1328
2023-11-23 22:34:51.715000 IP 172.16.10.9.54044 > 172.16.20.9.5004: UDP, length 1328
2023-11-23 22:34:51.715759 IP 172.16.10.9.54044 > 172.16.20.9.5004: UDP, length 1328
2023-11-23 22:34:51.718514 IP 172.16.10.9.54044 > 172.16.20.9.5004: UDP, length 1328
2023-11-23 22:34:51.718516 IP 172.16.10.9.54044 > 172.16.20.9.5004: UDP, length 1328
2023-11-23 22:34:51.718625 IP 172.16.10.9.54044 > 172.16.20.9.5004: UDP, length 1328
2023-11-23 22:34:51.718632 IP 172.16.10.9.54044 > 172.16.20.9.5004: UDP, length 1328
2023-11-23 22:34:51.718633 IP 172.16.10.9.54044 > 172.16.20.9.5004: UDP, length 1328
2023-11-23 22:34:51.718637 IP 172.16.10.9.54044 > 172.16.20.9.5004: UDP, length 1328
2023-11-23 22:34:51.718638 IP 172.16.10.9.54044 > 172.16.20.9.5004: UDP, length 1328
2023-11-23 22:34:51.718671 IP 172.16.10.9.54044 > 172.16.20.9.5004: UDP, length 1328
2023-11-23 22:34:51.725887 IP 172.16.10.9.54044 > 172.16.20.9.5004: UDP, length 1328
2023-11-23 22:34:51.725893 IP 172.16.10.9.54044 > 172.16.20.9.5004: UDP, length 1328
2023-11-23 22:34:51.726213 IP 172.16.10.9.54044 > 172.16.20.9.5004: UDP, length 1328
2023-11-23 22:34:51.726712 IP 172.16.10.9.54044 > 172.16.20.9.5004: UDP, length 1328
2023-11-23 22:34:51.726714 IP 172.16.10.9.54044 > 172.16.20.9.5004: UDP, length 1328
2023-11-23 22:34:51.726725 IP 172.16.10.9.54044 > 172.16.20.9.5004: UDP, length 1328
2023-11-23 22:34:51.726726 IP 172.16.10.9.54044 > 172.16.20.9.5004: UDP, length 1328
2023-11-23 22:34:51.727315 IP 172.16.10.9.54044 > 172.16.20.9.5004: UDP, length 1328
2023-11-23 22:34:51.727319 IP 172.16.10.9.54044 > 172.16.20.9.5004: UDP, length 1328
2023-11-23 22:34:51.727871 IP 172.16.10.9.54044 > 172.16.20.9.5004: UDP, length 1328
2023-11-23 22:34:51.728180 IP 172.16.10.9.54044 > 172.16.20.9.5004: UDP, length 1328
2023-11-23 22:34:51.728514 IP 172.16.10.9.54044 > 172.16.20.9.5004: UDP, length 1328
2023-11-23 22:34:51.729121 IP 172.16.10.9.54044 > 172.16.20.9.5004: UDP, length 1328
2023-11-23 22:34:51.729124 IP 172.16.10.9.54044 > 172.16.20.9.5004: UDP, length 1328
2023-11-23 22:34:51.729202 IP 172.16.10.9.54044 > 172.16.20.9.5004: UDP, length 1328
2023-11-23 22:34:51.729778 IP 172.16.10.9.54044 > 172.16.20.9.5004: UDP, length 1328
2023-11-23 22:34:51.730611 IP 172.16.10.9.54044 > 172.16.20.9.5004: UDP, length 1328
2023-11-23 22:34:51.730613 IP 172.16.10.9.54044 > 172.16.20.9.5004: UDP, length 1328
2023-11-23 22:34:51.731667 IP 172.16.10.9.54044 > 172.16.20.9.5004: UDP, length 1328
2023-11-23 22:34:51.731668 IP 172.16.10.9.54044 > 172.16.20.9.5004: UDP, length 1328
2023-11-23 22:34:51.732014 IP 172.16.10.9.54044 > 172.16.20.9.5004: UDP, length 1328
2023-11-23 22:34:51.732016 IP 172.16.10.9.54044 > 172.16.20.9.5004: UDP, length 1328
2023-11-23 22:34:51.732533 IP 172.16.10.9.54044 > 172.16.20.9.5004: UDP, length 1328
2023-11-23 22:34:51.733005 IP 172.16.10.9.54044 > 172.16.20.9.5004: UDP, length 1328
2023-11-23 22:34:51.733648 IP 172.16.10.9.54044 > 172.16.20.9.5004: UDP, length 1328
2023-11-23 22:34:51.733651 IP 172.16.10.9.54044 > 172.16.20.9.5004: UDP, length 1328
2023-11-23 22:34:51.734392 IP 172.16.10.9.54044 > 172.16.20.9.5004: UDP, length 1328
2023-11-23 22:34:51.735469 IP 172.16.10.9.54044 > 172.16.20.9.5004: UDP, length 1328
2023-11-23 22:34:51.735634 IP 172.16.10.9.54044 > 172.16.20.9.5004: UDP, length 1328
2023-11-23 22:34:51.735637 IP 172.16.10.9.54044 > 172.16.20.9.5004: UDP, length 1328
2023-11-23 22:34:51.736200 IP 172.16.10.9.54044 > 172.16.20.9.5004: UDP, length 1328
2023-11-23 22:34:51.737113 IP 172.16.10.9.54044 > 172.16.20.9.5004: UDP, length 1328
2023-11-23 22:34:51.737120 IP 172.16.10.9.54044 > 172.16.20.9.5004: UDP, length 1328
2023-11-23 22:34:51.737196 IP 172.16.10.9.54044 > 172.16.20.9.5004: UDP, length 1328
2023-11-23 22:34:51.737584 IP 172.16.10.9.54044 > 172.16.20.9.5004: UDP, length 1328
2023-11-23 22:34:51.738201 IP 172.16.10.9.54044 > 172.16.20.9.5004: UDP, length 1328
2023-11-23 22:34:51.738255 IP 172.16.10.9.54044 > 172.16.20.9.5004: UDP, length 1328
2023-11-23 22:34:51.738367 IP 172.16.10.9.54044 > 172.16.20.9.5004: UDP, length 1328
2023-11-23 22:34:51.738911 IP 172.16.10.9.54044 > 172.16.20.9.5004: UDP, length 1328
2023-11-23 22:34:51.739232 IP 172.16.10.9.54044 > 172.16.20.9.5004: UDP, length 1328
2023-11-23 22:34:51.739973 IP 172.16.10.9.54044 > 172.16.20.9.5004: UDP, length 1328
2023-11-23 22:34:51.739975 IP 172.16.10.9.54044 > 172.16.20.9.5004: UDP, length 1328
2023-11-23 22:34:51.745337 IP 172.16.10.9.54044 > 172.16.20.9.5004: UDP, length 1328
2023-11-23 22:34:51.745341 IP 172.16.10.9.54044 > 172.16.20.9.5004: UDP, length 1328
2023-11-23 22:34:51.745468 IP 172.16.10.9.54044 > 172.16.20.9.5004: UDP, length 1328
2023-11-23 22:34:51.745477 IP 172.16.10.9.54044 > 172.16.20.9.5004: UDP, length 1328
2023-11-23 22:34:51.745514 IP 172.16.10.9.54044 > 172.16.20.9.5004: UDP, length 1328
2023-11-23 22:34:51.745518 IP 172.16.10.9.54044 > 172.16.20.9.5004: UDP, length 1328
2023-11-23 22:34:51.745549 IP 172.16.10.9.54044 > 172.16.20.9.5004: UDP, length 1328
2023-11-23 22:34:51.746077 IP 172.16.10.9.54044 > 172.16.20.9.5004: UDP, length 1328
2023-11-23 22:34:51.746926 IP 172.16.10.9.54044 > 172.16.20.9.5004: UDP, length 1328
2023-11-23 22:34:51.746928 IP 172.16.10.9.54044 > 172.16.20.9.5004: UDP, length 1328
2023-11-23 22:34:51.747032 IP 172.16.10.9.54044 > 172.16.20.9.5004: UDP, length 1328
2023-11-23 22:34:51.747108 IP 172.16.10.9.54044 > 172.16.20.9.5004: UDP, length 1328
2023-11-23 22:34:51.748532 IP 172.16.10.9.54044 > 172.16.20.9.5004: UDP, length 1328
2023-11-23 22:34:51.748539 IP 172.16.10.9.54044 > 172.16.20.9.5004: UDP, length 1328
2023-11-23 22:34:51.748541 IP 172.16.10.9.54044 > 172.16.20.9.5004: UDP, length 1328
2023-11-23 22:34:51.748835 IP 172.16.10.9.54044 > 172.16.20.9.5004: UDP, length 1328
2023-11-23 22:34:51.750274 IP 172.16.10.9.54044 > 172.16.20.9.5004: UDP, length 1328
2023-11-23 22:34:51.750277 IP 172.16.10.9.54044 > 172.16.20.9.5004: UDP, length 1328
2023-11-23 22:34:51.751557 IP 172.16.10.9.54044 > 172.16.20.9.5004: UDP, length 1328
2023-11-23 22:34:51.751566 IP 172.16.10.9.54044 > 172.16.20.9.5004: UDP, length 1328
2023-11-23 22:34:51.751568 IP 172.16.10.9.54044 > 172.16.20.9.5004: UDP, length 1328
2023-11-23 22:34:51.751587 IP 172.16.10.9.54044 > 172.16.20.9.5004: UDP, length 1328
2023-11-23 22:34:51.751593 IP 172.16.10.9.54044 > 172.16.20.9.5004: UDP, length 1328
2023-11-23 22:34:51.751632 IP 172.16.10.9.54044 > 172.16.20.9.5004: UDP, length 1328
2023-11-23 22:34:51.753031 IP 172.16.10.9.54044 > 172.16.20.9.5004: UDP, length 1328
2023-11-23 22:34:51.753034 IP 172.16.10.9.54044 > 172.16.20.9.5004: UDP, length 1328
2023-11-23 22:34:51.753438 IP 172.16.10.9.54044 > 172.16.20.9.5004: UDP, length 1328
2023-11-23 22:34:51.753496 IP 172.16.10.9.54044 > 172.16.20.9.5004: UDP, length 1328
2023-11-23 22:34:51.755143 IP 172.16.10.9.54044 > 172.16.20.9.5004: UDP, length 1328
2023-11-23 22:34:51.755146 IP 172.16.10.9.54044 > 172.16.20.9.5004: UDP, length 1328
2023-11-23 22:34:51.755163 IP 172.16.10.9.54044 > 172.16.20.9.5004: UDP, length 1328
2023-11-23 22:34:51.755379 IP 172.16.10.9.54044 > 172.16.20.9.5004: UDP, length 1328
2023-11-23 22:34:51.756837 IP 172.16.10.9.54044 > 172.16.20.9.5004: UDP, length 1328
2023-11-23 22:34:51.756841 IP 172.16.10.9.54044 > 172.16.20.9.5004: UDP, length 1328
2023-11-23 22:34:51.756867 IP 172.16.10.9.54044 > 172.16.20.9.5004: UDP, length 1328
2023-11-23 22:34:51.757573 IP 172.16.10.9.54044 > 172.16.20.9.5004: UDP, length 1328
2023-11-23 22:34:51.758439 IP 172.16.10.9.54044 > 172.16.20.9.5004: UDP, length 1328
2023-11-23 22:34:51.758442 IP 172.16.10.9.54044 > 172.16.20.9.5004: UDP, length 1328
2023-11-23 22:34:51.760902 IP 172.16.10.9.54044 > 172.16.20.9.5004: UDP, length 1328
2023-11-23 22:34:51.761031 IP 172.16.10.9.54044 > 172.16.20.9.5004: UDP, length 1328
2023-11-23 22:34:51.761036 IP 172.16.10.9.54044 > 172.16.20.9.5004: UDP, length 1328
2023-11-23 22:34:51.761044 IP 172.16.10.9.54044 > 172.16.20.9.5004: UDP, length 1328
2023-11-23 22:34:51.761412 IP 172.16.10.9.54044 > 172.16.20.9.5004: UDP, length 1328
2023-11-23 22:34:51.761423 IP 172.16.10.9.54044 > 172.16.20.9.5004: UDP, length 1328
2023-11-23 22:34:51.761489 IP 172.16.10.9.54044 > 172.16.20.9.5004: UDP, length 1328
2023-11-23 22:34:51.761493 IP 172.16.10.9.54044 > 172.16.20.9.5004: UDP, length 1328
2023-11-23 22:34:51.761493 IP 172.16.10.9.54044 > 172.16.20.9.5004: UDP, length 1328
2023-11-23 22:34:51.762461 IP 172.16.10.9.54044 > 172.16.20.9.5004: UDP, length 1328
2023-11-23 22:34:51.763771 IP 172.16.10.9.54044 > 172.16.20.9.5004: UDP, length 1328
2023-11-23 22:34:51.763778 IP 172.16.10.9.54044 > 172.16.20.9.5004: UDP, length 1328
2023-11-23 22:34:51.763780 IP 172.16.10.9.54044 > 172.16.20.9.5004: UDP, length 1328
2023-11-23 22:34:51.764054 IP 172.16.10.9.54044 > 172.16.20.9.5004: UDP, length 1328
2023-11-23 22:34:51.766139 IP 172.16.10.9.54044 > 172.16.20.9.5004: UDP, length 1328
2023-11-23 22:34:51.766154 IP 172.16.10.9.54044 > 172.16.20.9.5004: UDP, length 1328
2023-11-23 22:34:51.766155 IP 172.16.10.9.54044 > 172.16.20.9.5004: UDP, length 1328
2023-11-23 22:34:51.766158 IP 172.16.10.9.54044 > 172.16.20.9.5004: UDP, length 1328
2023-11-23 22:34:51.767764 IP 172.16.10.9.54044 > 172.16.20.9.5004: UDP, length 1328
2023-11-23 22:34:51.767769 IP 172.16.10.9.54044 > 172.16.20.9.5004: UDP, length 1328
2023-11-23 22:34:51.767771 IP 172.16.10.9.54044 > 172.16.20.9.5004: UDP, length 1328
2023-11-23 22:34:51.767773 IP 172.16.10.9.54044 > 172.16.20.9.5004: UDP, length 1328
2023-11-23 22:34:51.778309 IP 172.16.10.9.54044 > 172.16.20.9.5004: UDP, length 1328
2023-11-23 22:34:51.778317 IP 172.16.10.9.54044 > 172.16.20.9.5004: UDP, length 1328
2023-11-23 22:34:51.778318 IP 172.16.10.9.54044 > 172.16.20.9.5004: UDP, length 1328
2023-11-23 22:34:51.778321 IP 172.16.10.9.54044 > 172.16.20.9.5004: UDP, length 1328
2023-11-23 22:34:51.778955 IP 172.16.10.9.54044 > 172.16.20.9.5004: UDP, length 1328
2023-11-23 22:34:51.778959 IP 172.16.10.9.54044 > 172.16.20.9.5004: UDP, length 1328
2023-11-23 22:34:51.778960 IP 172.16.10.9.54044 > 172.16.20.9.5004: UDP, length 1328
2023-11-23 22:34:51.779265 IP 172.16.10.9.54044 > 172.16.20.9.5004: UDP, length 1328
2023-11-23 22:34:51.779655 IP 172.16.10.9.54044 > 172.16.20.9.5004: UDP, length 1328
2023-11-23 22:34:51.779658 IP 172.16.10.9.54044 > 172.16.20.9.5004: UDP, length 1328
2023-11-23 22:34:51.779659 IP 172.16.10.9.54044 > 172.16.20.9.5004: UDP, length 1328
2023-11-23 22:34:51.779661 IP 172.16.10.9.54044 > 172.16.20.9.5004: UDP, length 1328
2023-11-23 22:34:51.781254 IP 172.16.10.9.54044 > 172.16.20.9.5004: UDP, length 1328
2023-11-23 22:34:51.781260 IP 172.16.10.9.54044 > 172.16.20.9.5004: UDP, length 1328
2023-11-23 22:34:51.781261 IP 172.16.10.9.54044 > 172.16.20.9.5004: UDP, length 1328
2023-11-23 22:34:51.781263 IP 172.16.10.9.54044 > 172.16.20.9.5004: UDP, length 1328
2023-11-23 22:34:51.782981 IP 172.16.10.9.54044 > 172.16.20.9.5004: UDP, length 1328
2023-11-23 22:34:51.782986 IP 172.16.10.9.54044 > 172.16.20.9.5004: UDP, length 1328
2023-11-23 22:34:51.782993 IP 172.16.10.9.54044 > 172.16.20.9.5004: UDP, length 1328
2023-11-23 22:34:51.782996 IP 172.16.10.9.54044 > 172.16.20.9.5004: UDP, length 1328
2023-11-23 22:34:51.785027 IP 172.16.10.9.54044 > 172.16.20.9.5004: UDP, length 1328
2023-11-23 22:34:51.785034 IP 172.16.10.9.54044 > 172.16.20.9.5004: UDP, length 1328
2023-11-23 22:34:51.785036 IP 172.16.10.9.54044 > 172.16.20.9.5004: UDP, length 1328
2023-11-23 22:34:51.785038 IP 172.16.10.9.54044 > 172.16.20.9.5004: UDP, length 1328
2023-11-23 22:34:51.786599 IP 172.16.10.9.54044 > 172.16.20.9.5004: UDP, length 1328
2023-11-23 22:34:51.786618 IP 172.16.10.9.54044 > 172.16.20.9.5004: UDP, length 1328
2023-11-23 22:34:51.786619 IP 172.16.10.9.54044 > 172.16.20.9.5004: UDP, length 1328
2023-11-23 22:34:51.786626 IP 172.16.10.9.54044 > 172.16.20.9.5004: UDP, length 1328
2023-11-23 22:34:51.787718 IP 172.16.10.9.54044 > 172.16.20.9.5004: UDP, length 1328
2023-11-23 22:34:51.787722 IP 172.16.10.9.54044 > 172.16.20.9.5004: UDP, length 1328
2023-11-23 22:34:51.787723 IP 172.16.10.9.54044 > 172.16.20.9.5004: UDP, length 1328
2023-11-23 22:34:51.787725 IP 172.16.10.9.54044 > 172.16.20.9.5004: UDP, length 1328
2023-11-23 22:34:51.790043 IP 172.16.10.9.54044 > 172.16.20.9.5004: UDP, length 1328
2023-11-23 22:34:51.790049 IP 172.16.10.9.54044 > 172.16.20.9.5004: UDP, length 1328
2023-11-23 22:34:51.790050 IP 172.16.10.9.54044 > 172.16.20.9.5004: UDP, length 1328
2023-11-23 22:34:51.790052 IP 172.16.10.9.54044 > 172.16.20.9.5004: UDP, length 1328
2023-11-23 22:34:51.790736 IP 172.16.10.9.54044 > 172.16.20.9.5004: UDP, length 1328
2023-11-23 22:34:51.790740 IP 172.16.10.9.54044 > 172.16.20.9.5004: UDP, length 1328
2023-11-23 22:34:51.790741 IP 172.16.10.9.54044 > 172.16.20.9.5004: UDP, length 1328
2023-11-23 22:34:51.790742 IP 172.16.10.9.54044 > 172.16.20.9.5004: UDP, length 1328
2023-11-23 22:34:51.794618 IP 172.16.10.9.54044 > 172.16.20.9.5004: UDP, length 1328
2023-11-23 22:34:51.794623 IP 172.16.10.9.54044 > 172.16.20.9.5004: UDP, length 1328
2023-11-23 22:34:51.794624 IP 172.16.10.9.54044 > 172.16.20.9.5004: UDP, length 1328
2023-11-23 22:34:51.794626 IP 172.16.10.9.54044 > 172.16.20.9.5004: UDP, length 1328
2023-11-23 22:34:51.799762 IP 172.16.10.9.54044 > 172.16.20.9.5004: UDP, length 1328
2023-11-23 22:34:51.799777 IP 172.16.10.9.54044 > 172.16.20.9.5004: UDP, length 1328
2023-11-23 22:34:51.799779 IP 172.16.10.9.54044 > 172.16.20.9.5004: UDP, length 1328
2023-11-23 22:34:51.799783 IP 172.16.10.9.54044 > 172.16.20.9.5004: UDP, length 1328
2023-11-23 22:34:51.804449 IP 172.16.10.9.54044 > 172.16.20.9.5004: UDP, length 1328
2023-11-23 22:34:51.804457 IP 172.16.10.9.54044 > 172.16.20.9.5004: UDP, length 1328
2023-11-23 22:34:51.804459 IP 172.16.10.9.54044 > 172.16.20.9.5004: UDP, length 1328
2023-11-23 22:34:51.804462 IP 172.16.10.9.54044 > 172.16.20.9.5004: UDP, length 1328
2023-11-23 22:34:51.808393 IP 172.16.10.9.54044 > 172.16.20.9.5004: UDP, length 1328
2023-11-23 22:34:51.808400 IP 172.16.10.9.54044 > 172.16.20.9.5004: UDP, length 1328
2023-11-23 22:34:51.808401 IP 172.16.10.9.54044 > 172.16.20.9.5004: UDP, length 1328
2023-11-23 22:34:51.808403 IP 172.16.10.9.54044 > 172.16.20.9.5004: UDP, length 1328
2023-11-23 22:34:51.813592 IP 172.16.10.9.54044 > 172.16.20.9.5004: UDP, length 1328
2023-11-23 22:34:51.813603 IP 172.16.10.9.54044 > 172.16.20.9.5004: UDP, length 1328
2023-11-23 22:34:51.813606 IP 172.16.10.9.54044 > 172.16.20.9.5004: UDP, length 1328
2023-11-23 22:34:51.813609 IP 172.16.10.9.54044 > 172.16.20.9.5004: UDP, length 1328
2023-11-23 22:34:51.825041 IP 172.16.10.9.54044 > 172.16.20.9.5004: UDP, length 1328
2023-11-23 22:34:51.825049 IP 172.16.10.9.54044 > 172.16.20.9.5004: UDP, length 1328
2023-11-23 22:34:51.825051 IP 172.16.10.9.54044 > 172.16.20.9.5004: UDP, length 1328
2023-11-23 22:34:51.825054 IP 172.16.10.9.54044 > 172.16.20.9.5004: UDP, length 1328
2023-11-23 22:34:51.825376 IP 172.16.10.9.54044 > 172.16.20.9.5004: UDP, length 1328
2023-11-23 22:34:51.825471 IP 172.16.10.9.54044 > 172.16.20.9.5004: UDP, length 1328
2023-11-23 22:34:51.825473 IP 172.16.10.9.54044 > 172.16.20.9.5004: UDP, length 1328
2023-11-23 22:34:51.825476 IP 172.16.10.9.54044 > 172.16.20.9.5004: UDP, length 1328
2023-11-23 22:34:51.826673 IP 172.16.10.9.54044 > 172.16.20.9.5004: UDP, length 1328
2023-11-23 22:34:51.826679 IP 172.16.10.9.54044 > 172.16.20.9.5004: UDP, length 1328
2023-11-23 22:34:51.826680 IP 172.16.10.9.54044 > 172.16.20.9.5004: UDP, length 1328
2023-11-23 22:34:51.826682 IP 172.16.10.9.54044 > 172.16.20.9.5004: UDP, length 1328
2023-11-23 22:34:51.835758 IP 172.16.10.9.54044 > 172.16.20.9.5004: UDP, length 1328
2023-11-23 22:34:51.835767 IP 172.16.10.9.54044 > 172.16.20.9.5004: UDP, length 1328
2023-11-23 22:34:51.835769 IP 172.16.10.9.54044 > 172.16.20.9.5004: UDP, length 1328
2023-11-23 22:34:51.835771 IP 172.16.10.9.54044 > 172.16.20.9.5004: UDP, length 1328
2023-11-23 22:34:51.836702 IP 172.16.10.9.54044 > 172.16.20.9.5004: UDP, length 1328
2023-11-23 22:34:51.836707 IP 172.16.10.9.54044 > 172.16.20.9.5004: UDP, length 1328
2023-11-23 22:34:51.836707 IP 172.16.10.9.54044 > 172.16.20.9.5004: UDP, length 1328
2023-11-23 22:34:51.836709 IP 172.16.10.9.54044 > 172.16.20.9.5004: UDP, length 1328
2023-11-23 22:34:51.840453 IP 172.16.10.9.54044 > 172.16.20.9.5004: UDP, length 1328
2023-11-23 22:34:51.840460 IP 172.16.10.9.54044 > 172.16.20.9.5004: UDP, length 1328
2023-11-23 22:34:51.840462 IP 172.16.10.9.54044 > 172.16.20.9.5004: UDP, length 1328
2023-11-23 22:34:51.840464 IP 172.16.10.9.54044 > 172.16.20.9.5004: UDP, length 1328
2023-11-23 22:34:51.844866 IP 172.16.10.9.54044 > 172.16.20.9.5004: UDP, length 1328
2023-11-23 22:34:51.844880 IP 172.16.10.9.54044 > 172.16.20.9.5004: UDP, length 1328
2023-11-23 22:34:51.844881 IP 172.16.10.9.54044 > 172.16.20.9.5004: UDP, length 1328
2023-11-23 22:34:51.844886 IP 172.16.10.9.54044 > 172.16.20.9.5004: UDP, length 1328
2023-11-23 22:34:51.850356 IP 172.16.10.9.54044 > 172.16.20.9.5004: UDP, length 1328
2023-11-23 22:34:51.850460 IP 172.16.10.9.54044 > 172.16.20.9.5004: UDP, length 1328
2023-11-23 22:34:51.850462 IP 172.16.10.9.54044 > 172.16.20.9.5004: UDP, length 1328
2023-11-23 22:34:51.850465 IP 172.16.10.9.54044 > 172.16.20.9.5004: UDP, length 1328
2023-11-23 22:34:51.854515 IP 172.16.10.9.54044 > 172.16.20.9.5004: UDP, length 1328
2023-11-23 22:34:51.854521 IP 172.16.10.9.54044 > 172.16.20.9.5004: UDP, length 1328
2023-11-23 22:34:51.854522 IP 172.16.10.9.54044 > 172.16.20.9.5004: UDP, length 1328
2023-11-23 22:34:51.854524 IP 172.16.10.9.54044 > 172.16.20.9.5004: UDP, length 1328
2023-11-23 22:34:51.859249 IP 172.16.10.9.54044 > 172.16.20.9.5004: UDP, length 1328
2023-11-23 22:34:51.859256 IP 172.16.10.9.54044 > 172.16.20.9.5004: UDP, length 1328
2023-11-23 22:34:51.859257 IP 172.16.10.9.54044 > 172.16.20.9.5004: UDP, length 1328
2023-11-23 22:34:51.859259 IP 172.16.10.9.54044 > 172.16.20.9.5004: UDP, length 1328
2023-11-23 22:34:51.874980 IP 172.16.10.9.54044 > 172.16.20.9.5004: UDP, length 1328
2023-11-23 22:34:51.874990 IP 172.16.10.9.54044 > 172.16.20.9.5004: UDP, length 1328
2023-11-23 22:34:51.874992 IP 172.16.10.9.54044 > 172.16.20.9.5004: UDP, length 1328
2023-11-23 22:34:51.874996 IP 172.16.10.9.54044 > 172.16.20.9.5004: UDP, length 1328
2023-11-23 22:34:51.877571 IP 172.16.10.9.54044 > 172.16.20.9.5004: UDP, length 1328
2023-11-23 22:34:51.877777 IP 172.16.10.9.54044 > 172.16.20.9.5004: UDP, length 1328
2023-11-23 22:34:51.877780 IP 172.16.10.9.54044 > 172.16.20.9.5004: UDP, length 1328
2023-11-23 22:34:51.877798 IP 172.16.10.9.54044 > 172.16.20.9.5004: UDP, length 1328
2023-11-23 22:34:51.878285 IP 172.16.10.9.54044 > 172.16.20.9.5004: UDP, length 1328
2023-11-23 22:34:51.878292 IP 172.16.10.9.54044 > 172.16.20.9.5004: UDP, length 1328
2023-11-23 22:34:51.878293 IP 172.16.10.9.54044 > 172.16.20.9.5004: UDP, length 1328
2023-11-23 22:34:51.878295 IP 172.16.10.9.54044 > 172.16.20.9.5004: UDP, length 1328
2023-11-23 22:34:51.878947 IP 172.16.10.9.54044 > 172.16.20.9.5004: UDP, length 1328
2023-11-23 22:34:51.879295 IP 172.16.10.9.54044 > 172.16.20.9.5004: UDP, length 1328
2023-11-23 22:34:51.879297 IP 172.16.10.9.54044 > 172.16.20.9.5004: UDP, length 1328
2023-11-23 22:34:51.879302 IP 172.16.10.9.54044 > 172.16.20.9.5004: UDP, length 1328
2023-11-23 22:34:51.881433 IP 172.16.10.9.54044 > 172.16.20.9.5004: UDP, length 1328
2023-11-23 22:34:51.881440 IP 172.16.10.9.54044 > 172.16.20.9.5004: UDP, length 1328
2023-11-23 22:34:51.881442 IP 172.16.10.9.54044 > 172.16.20.9.5004: UDP, length 1328
2023-11-23 22:34:51.881444 IP 172.16.10.9.54044 > 172.16.20.9.5004: UDP, length 1328
2023-11-23 22:34:51.887984 IP 172.16.10.9.54044 > 172.16.20.9.5004: UDP, length 1328
2023-11-23 22:34:51.887993 IP 172.16.10.9.54044 > 172.16.20.9.5004: UDP, length 1328
2023-11-23 22:34:51.887995 IP 172.16.10.9.54044 > 172.16.20.9.5004: UDP, length 1328
2023-11-23 22:34:51.888016 IP 172.16.10.9.54044 > 172.16.20.9.5004: UDP, length 1328
2023-11-23 22:34:51.890490 IP 172.16.10.9.54044 > 172.16.20.9.5004: UDP, length 1328
2023-11-23 22:34:51.890496 IP 172.16.10.9.54044 > 172.16.20.9.5004: UDP, length 1328
2023-11-23 22:34:51.890498 IP 172.16.10.9.54044 > 172.16.20.9.5004: UDP, length 1328
2023-11-23 22:34:51.890611 IP 172.16.10.9.54044 > 172.16.20.9.5004: UDP, length 1328
2023-11-23 22:34:51.895029 IP 172.16.10.9.54044 > 172.16.20.9.5004: UDP, length 1328
2023-11-23 22:34:51.895037 IP 172.16.10.9.54044 > 172.16.20.9.5004: UDP, length 1328
2023-11-23 22:34:51.895039 IP 172.16.10.9.54044 > 172.16.20.9.5004: UDP, length 1328
2023-11-23 22:34:51.895162 IP 172.16.10.9.54044 > 172.16.20.9.5004: UDP, length 1328
2023-11-23 22:34:51.899838 IP 172.16.10.9.54044 > 172.16.20.9.5004: UDP, length 1328
2023-11-23 22:34:51.899845 IP 172.16.10.9.54044 > 172.16.20.9.5004: UDP, length 1328
2023-11-23 22:34:51.899847 IP 172.16.10.9.54044 > 172.16.20.9.5004: UDP, length 1328
2023-11-23 22:34:51.899850 IP 172.16.10.9.54044 > 172.16.20.9.5004: UDP, length 1328
2023-11-23 22:34:51.909889 IP 172.16.10.9.54044 > 172.16.20.9.5004: UDP, length 1328
2023-11-23 22:34:51.909897 IP 172.16.10.9.54044 > 172.16.20.9.5004: UDP, length 1328
2023-11-23 22:34:51.909899 IP 172.16.10.9.54044 > 172.16.20.9.5004: UDP, length 1328
2023-11-23 22:34:51.909902 IP 172.16.10.9.54044 > 172.16.20.9.5004: UDP, length 1328
2023-11-23 22:34:51.910481 IP 172.16.10.9.54044 > 172.16.20.9.5004: UDP, length 1328
2023-11-23 22:34:51.910486 IP 172.16.10.9.54044 > 172.16.20.9.5004: UDP, length 1328
2023-11-23 22:34:51.910488 IP 172.16.10.9.54044 > 172.16.20.9.5004: UDP, length 1328
2023-11-23 22:34:51.910491 IP 172.16.10.9.54044 > 172.16.20.9.5004: UDP, length 1328
2023-11-23 22:34:51.913772 IP 172.16.10.9.54044 > 172.16.20.9.5004: UDP, length 1328
2023-11-23 22:34:51.913780 IP 172.16.10.9.54044 > 172.16.20.9.5004: UDP, length 1328
2023-11-23 22:34:51.913781 IP 172.16.10.9.54044 > 172.16.20.9.5004: UDP, length 1328
2023-11-23 22:34:51.913784 IP 172.16.10.9.54044 > 172.16.20.9.5004: UDP, length 1328
2023-11-23 22:34:51.918417 IP 172.16.10.9.54044 > 172.16.20.9.5004: UDP, length 1328
2023-11-23 22:34:51.918425 IP 172.16.10.9.54044 > 172.16.20.9.5004: UDP, length 1328
2023-11-23 22:34:51.918426 IP 172.16.10.9.54044 > 172.16.20.9.5004: UDP, length 1328
2023-11-23 22:34:51.918429 IP 172.16.10.9.54044 > 172.16.20.9.5004: UDP, length 1328
2023-11-23 22:34:51.922749 IP 172.16.10.9.54044 > 172.16.20.9.5004: UDP, length 1328
2023-11-23 22:34:51.922850 IP 172.16.10.9.54044 > 172.16.20.9.5004: UDP, length 1328
2023-11-23 22:34:51.922852 IP 172.16.10.9.54044 > 172.16.20.9.5004: UDP, length 1328
2023-11-23 22:34:51.922856 IP 172.16.10.9.54044 > 172.16.20.9.5004: UDP, length 1328
2023-11-23 22:34:51.927679 IP 172.16.10.9.54044 > 172.16.20.9.5004: UDP, length 1328
2023-11-23 22:34:51.927687 IP 172.16.10.9.54044 > 172.16.20.9.5004: UDP, length 1328
2023-11-23 22:34:51.927689 IP 172.16.10.9.54044 > 172.16.20.9.5004: UDP, length 1328
2023-11-23 22:34:51.927692 IP 172.16.10.9.54044 > 172.16.20.9.5004: UDP, length 1328
2023-11-23 22:34:51.932563 IP 172.16.10.9.54044 > 172.16.20.9.5004: UDP, length 1328
2023-11-23 22:34:51.932570 IP 172.16.10.9.54044 > 172.16.20.9.5004: UDP, length 1328
2023-11-23 22:34:51.932572 IP 172.16.10.9.54044 > 172.16.20.9.5004: UDP, length 1328
2023-11-23 22:34:51.932575 IP 172.16.10.9.54044 > 172.16.20.9.5004: UDP, length 1328
2023-11-23 22:34:51.936462 IP 172.16.10.9.54044 > 172.16.20.9.5004: UDP, length 1328
2023-11-23 22:34:51.936897 IP 172.16.10.9.54044 > 172.16.20.9.5004: UDP, length 1328
2023-11-23 22:34:51.936899 IP 172.16.10.9.54044 > 172.16.20.9.5004: UDP, length 1328
2023-11-23 22:34:51.937000 IP 172.16.10.9.54044 > 172.16.20.9.5004: UDP, length 1328
2023-11-23 22:34:51.941263 IP 172.16.10.9.54044 > 172.16.20.9.5004: UDP, length 1328
2023-11-23 22:34:51.941268 IP 172.16.10.9.54044 > 172.16.20.9.5004: UDP, length 1328
2023-11-23 22:34:51.941269 IP 172.16.10.9.54044 > 172.16.20.9.5004: UDP, length 1328
2023-11-23 22:34:51.941271 IP 172.16.10.9.54044 > 172.16.20.9.5004: UDP, length 1328
2023-11-23 22:34:51.945160 IP 172.16.10.9.54044 > 172.16.20.9.5004: UDP, length 1328
2023-11-23 22:34:51.945166 IP 172.16.10.9.54044 > 172.16.20.9.5004: UDP, length 1328
2023-11-23 22:34:51.945167 IP 172.16.10.9.54044 > 172.16.20.9.5004: UDP, length 1328
2023-11-23 22:34:51.945170 IP 172.16.10.9.54044 > 172.16.20.9.5004: UDP, length 1328
2023-11-23 22:34:51.952145 IP 172.16.10.9.54044 > 172.16.20.9.5004: UDP, length 1328
2023-11-23 22:34:51.952150 IP 172.16.10.9.54044 > 172.16.20.9.5004: UDP, length 1328
2023-11-23 22:34:51.952151 IP 172.16.10.9.54044 > 172.16.20.9.5004: UDP, length 1328
2023-11-23 22:34:51.952154 IP 172.16.10.9.54044 > 172.16.20.9.5004: UDP, length 1328
2023-11-23 22:34:51.956171 IP 172.16.10.9.54044 > 172.16.20.9.5004: UDP, length 1328
2023-11-23 22:34:51.956176 IP 172.16.10.9.54044 > 172.16.20.9.5004: UDP, length 1328
2023-11-23 22:34:51.956177 IP 172.16.10.9.54044 > 172.16.20.9.5004: UDP, length 1328
2023-11-23 22:34:51.956179 IP 172.16.10.9.54044 > 172.16.20.9.5004: UDP, length 1328
2023-11-23 22:34:51.958831 IP 172.16.10.9.54044 > 172.16.20.9.5004: UDP, length 1328
2023-11-23 22:34:51.958837 IP 172.16.10.9.54044 > 172.16.20.9.5004: UDP, length 1328
2023-11-23 22:34:51.958839 IP 172.16.10.9.54044 > 172.16.20.9.5004: UDP, length 1328
2023-11-23 22:34:51.958841 IP 172.16.10.9.54044 > 172.16.20.9.5004: UDP, length 1328
2023-11-23 22:34:51.963198 IP 172.16.10.9.54044 > 172.16.20.9.5004: UDP, length 1328
2023-11-23 22:34:51.963204 IP 172.16.10.9.54044 > 172.16.20.9.5004: UDP, length 1328
2023-11-23 22:34:51.963205 IP 172.16.10.9.54044 > 172.16.20.9.5004: UDP, length 1328
2023-11-23 22:34:51.963207 IP 172.16.10.9.54044 > 172.16.20.9.5004: UDP, length 1328
2023-11-23 22:34:51.968667 IP 172.16.10.9.54044 > 172.16.20.9.5004: UDP, length 1328
2023-11-23 22:34:51.968672 IP 172.16.10.9.54044 > 172.16.20.9.5004: UDP, length 1328
2023-11-23 22:34:51.968673 IP 172.16.10.9.54044 > 172.16.20.9.5004: UDP, length 1328
2023-11-23 22:34:51.968675 IP 172.16.10.9.54044 > 172.16.20.9.5004: UDP, length 1328
2023-11-23 22:34:51.972567 IP 172.16.10.9.54044 > 172.16.20.9.5004: UDP, length 1328
2023-11-23 22:34:51.972911 IP 172.16.10.9.54044 > 172.16.20.9.5004: UDP, length 1328
2023-11-23 22:34:51.972916 IP 172.16.10.9.54044 > 172.16.20.9.5004: UDP, length 1328
2023-11-23 22:34:51.972921 IP 172.16.10.9.54044 > 172.16.20.9.5004: UDP, length 1328
2023-11-23 22:34:51.977396 IP 172.16.10.9.54044 > 172.16.20.9.5004: UDP, length 1328
2023-11-23 22:34:51.977401 IP 172.16.10.9.54044 > 172.16.20.9.5004: UDP, length 1328
2023-11-23 22:34:51.977402 IP 172.16.10.9.54044 > 172.16.20.9.5004: UDP, length 1328
2023-11-23 22:34:51.977405 IP 172.16.10.9.54044 > 172.16.20.9.5004: UDP, length 1328
2023-11-23 22:34:51.982270 IP 172.16.10.9.54044 > 172.16.20.9.5004: UDP, length 1328
2023-11-23 22:34:51.982275 IP 172.16.10.9.54044 > 172.16.20.9.5004: UDP, length 1328
2023-11-23 22:34:51.982276 IP 172.16.10.9.54044 > 172.16.20.9.5004: UDP, length 1328
2023-11-23 22:34:51.982279 IP 172.16.10.9.54044 > 172.16.20.9.5004: UDP, length 1328
2023-11-23 22:34:51.994666 IP 172.16.10.9.54044 > 172.16.20.9.5004: UDP, length 1328
2023-11-23 22:34:51.994672 IP 172.16.10.9.54044 > 172.16.20.9.5004: UDP, length 1328
2023-11-23 22:34:51.994673 IP 172.16.10.9.54044 > 172.16.20.9.5004: UDP, length 1328
2023-11-23 22:34:51.994676 IP 172.16.10.9.54044 > 172.16.20.9.5004: UDP, length 1328
2023-11-23 22:34:51.997052 IP 172.16.10.9.54044 > 172.16.20.9.5004: UDP, length 1328
2023-11-23 22:34:51.997058 IP 172.16.10.9.54044 > 172.16.20.9.5004: UDP, length 1328
2023-11-23 22:34:51.997059 IP 172.16.10.9.54044 > 172.16.20.9.5004: UDP, length 1328
2023-11-23 22:34:51.997062 IP 172.16.10.9.54044 > 172.16.20.9.5004: UDP, length 1328
2023-11-23 22:34:51.997522 IP 172.16.10.9.54044 > 172.16.20.9.5004: UDP, length 1328
2023-11-23 22:34:51.997526 IP 172.16.10.9.54044 > 172.16.20.9.5004: UDP, length 1328
2023-11-23 22:34:51.997527 IP 172.16.10.9.54044 > 172.16.20.9.5004: UDP, length 1328
2023-11-23 22:34:51.997529 IP 172.16.10.9.54044 > 172.16.20.9.5004: UDP, length 1328
2023-11-23 22:34:52.000095 IP 172.16.10.9.54044 > 172.16.20.9.5004: UDP, length 1328
2023-11-23 22:34:52.000101 IP 172.16.10.9.54044 > 172.16.20.9.5004: UDP, length 1328
2023-11-23 22:34:52.000102 IP 172.16.10.9.54044 > 172.16.20.9.5004: UDP, length 1328
2023-11-23 22:34:52.000104 IP 172.16.10.9.54044 > 172.16.20.9.5004: UDP, length 1328
2023-11-23 22:34:52.005041 IP 172.16.10.9.54044 > 172.16.20.9.5004: UDP, length 1328
2023-11-23 22:34:52.005047 IP 172.16.10.9.54044 > 172.16.20.9.5004: UDP, length 1328
2023-11-23 22:34:52.005049 IP 172.16.10.9.54044 > 172.16.20.9.5004: UDP, length 1328
2023-11-23 22:34:52.005052 IP 172.16.10.9.54044 > 172.16.20.9.5004: UDP, length 1328
2023-11-23 22:34:52.009723 IP 172.16.10.9.54044 > 172.16.20.9.5004: UDP, length 1328
2023-11-23 22:34:52.009727 IP 172.16.10.9.54044 > 172.16.20.9.5004: UDP, length 1328
2023-11-23 22:34:52.009728 IP 172.16.10.9.54044 > 172.16.20.9.5004: UDP, length 1328
2023-11-23 22:34:52.009731 IP 172.16.10.9.54044 > 172.16.20.9.5004: UDP, length 1328
2023-11-23 22:34:52.015670 IP 172.16.10.9.54044 > 172.16.20.9.5004: UDP, length 1328
2023-11-23 22:34:52.015674 IP 172.16.10.9.54044 > 172.16.20.9.5004: UDP, length 1328
2023-11-23 22:34:52.015676 IP 172.16.10.9.54044 > 172.16.20.9.5004: UDP, length 1328
2023-11-23 22:34:52.015678 IP 172.16.10.9.54044 > 172.16.20.9.5004: UDP, length 1328
2023-11-23 22:34:52.020821 IP 172.16.10.9.54044 > 172.16.20.9.5004: UDP, length 1328
2023-11-23 22:34:52.020826 IP 172.16.10.9.54044 > 172.16.20.9.5004: UDP, length 1328
2023-11-23 22:34:52.020827 IP 172.16.10.9.54044 > 172.16.20.9.5004: UDP, length 1328
2023-11-23 22:34:52.020829 IP 172.16.10.9.54044 > 172.16.20.9.5004: UDP, length 1328
2023-11-23 22:34:52.025455 IP 172.16.10.9.54044 > 172.16.20.9.5004: UDP, length 1328
2023-11-23 22:34:52.025656 IP 172.16.10.9.54044 > 172.16.20.9.5004: UDP, length 1328
2023-11-23 22:34:52.025658 IP 172.16.10.9.54044 > 172.16.20.9.5004: UDP, length 1328
2023-11-23 22:34:52.025662 IP 172.16.10.9.54044 > 172.16.20.9.5004: UDP, length 1328
2023-11-23 22:34:52.035624 IP 172.16.10.9.54044 > 172.16.20.9.5004: UDP, length 1328
2023-11-23 22:34:52.035632 IP 172.16.10.9.54044 > 172.16.20.9.5004: UDP, length 1328
2023-11-23 22:34:52.035634 IP 172.16.10.9.54044 > 172.16.20.9.5004: UDP, length 1328
2023-11-23 22:34:52.035637 IP 172.16.10.9.54044 > 172.16.20.9.5004: UDP, length 1328
2023-11-23 22:34:52.035996 IP 172.16.10.9.54044 > 172.16.20.9.5004: UDP, length 1328
2023-11-23 22:34:52.035999 IP 172.16.10.9.54044 > 172.16.20.9.5004: UDP, length 1328
2023-11-23 22:34:52.036000 IP 172.16.10.9.54044 > 172.16.20.9.5004: UDP, length 1328
2023-11-23 22:34:52.036003 IP 172.16.10.9.54044 > 172.16.20.9.5004: UDP, length 1328
2023-11-23 22:34:52.040175 IP 172.16.10.9.54044 > 172.16.20.9.5004: UDP, length 1328
2023-11-23 22:34:52.040181 IP 172.16.10.9.54044 > 172.16.20.9.5004: UDP, length 1328
2023-11-23 22:34:52.040183 IP 172.16.10.9.54044 > 172.16.20.9.5004: UDP, length 1328
2023-11-23 22:34:52.040185 IP 172.16.10.9.54044 > 172.16.20.9.5004: UDP, length 1328
2023-11-23 22:34:52.046198 IP 172.16.10.9.54044 > 172.16.20.9.5004: UDP, length 1328
2023-11-23 22:34:52.046205 IP 172.16.10.9.54044 > 172.16.20.9.5004: UDP, length 1328
2023-11-23 22:34:52.046206 IP 172.16.10.9.54044 > 172.16.20.9.5004: UDP, length 1328
2023-11-23 22:34:52.046396 IP 172.16.10.9.54044 > 172.16.20.9.5004: UDP, length 1328
2023-11-23 22:34:52.049256 IP 172.16.10.9.54044 > 172.16.20.9.5004: UDP, length 1328
2023-11-23 22:34:52.049261 IP 172.16.10.9.54044 > 172.16.20.9.5004: UDP, length 1328
2023-11-23 22:34:52.049262 IP 172.16.10.9.54044 > 172.16.20.9.5004: UDP, length 1328
2023-11-23 22:34:52.049264 IP 172.16.10.9.54044 > 172.16.20.9.5004: UDP, length 1328
2023-11-23 22:34:52.054263 IP 172.16.10.9.54044 > 172.16.20.9.5004: UDP, length 1328
2023-11-23 22:34:52.054268 IP 172.16.10.9.54044 > 172.16.20.9.5004: UDP, length 1328
2023-11-23 22:34:52.054270 IP 172.16.10.9.54044 > 172.16.20.9.5004: UDP, length 1328
2023-11-23 22:34:52.054272 IP 172.16.10.9.54044 > 172.16.20.9.5004: UDP, length 1328
2023-11-23 22:34:52.060618 IP 172.16.10.9.54044 > 172.16.20.9.5004: UDP, length 1328
2023-11-23 22:34:52.060623 IP 172.16.10.9.54044 > 172.16.20.9.5004: UDP, length 1328
2023-11-23 22:34:52.060624 IP 172.16.10.9.54044 > 172.16.20.9.5004: UDP, length 1328
2023-11-23 22:34:52.060626 IP 172.16.10.9.54044 > 172.16.20.9.5004: UDP, length 1328
2023-11-23 22:34:52.064713 IP 172.16.10.9.54044 > 172.16.20.9.5004: UDP, length 1328
2023-11-23 22:34:52.064719 IP 172.16.10.9.54044 > 172.16.20.9.5004: UDP, length 1328
2023-11-23 22:34:52.064721 IP 172.16.10.9.54044 > 172.16.20.9.5004: UDP, length 1328
2023-11-23 22:34:52.064724 IP 172.16.10.9.54044 > 172.16.20.9.5004: UDP, length 1328
2023-11-23 22:34:52.075606 IP 172.16.10.9.54044 > 172.16.20.9.5004: UDP, length 1328
2023-11-23 22:34:52.075612 IP 172.16.10.9.54044 > 172.16.20.9.5004: UDP, length 1328
2023-11-23 22:34:52.075613 IP 172.16.10.9.54044 > 172.16.20.9.5004: UDP, length 1328
2023-11-23 22:34:52.075616 IP 172.16.10.9.54044 > 172.16.20.9.5004: UDP, length 1328
2023-11-23 22:34:52.075962 IP 172.16.10.9.54044 > 172.16.20.9.5004: UDP, length 1328
2023-11-23 22:34:52.075966 IP 172.16.10.9.54044 > 172.16.20.9.5004: UDP, length 1328
2023-11-23 22:34:52.075967 IP 172.16.10.9.54044 > 172.16.20.9.5004: UDP, length 1328
2023-11-23 22:34:52.075969 IP 172.16.10.9.54044 > 172.16.20.9.5004: UDP, length 1328
2023-11-23 22:34:52.081658 IP 172.16.10.9.54044 > 172.16.20.9.5004: UDP, length 1328
2023-11-23 22:34:52.081666 IP 172.16.10.9.54044 > 172.16.20.9.5004: UDP, length 1328
2023-11-23 22:34:52.081668 IP 172.16.10.9.54044 > 172.16.20.9.5004: UDP, length 1328
2023-11-23 22:34:52.081671 IP 172.16.10.9.54044 > 172.16.20.9.5004: UDP, length 1328
2023-11-23 22:34:52.084121 IP 172.16.10.9.54044 > 172.16.20.9.5004: UDP, length 1328
2023-11-23 22:34:52.084127 IP 172.16.10.9.54044 > 172.16.20.9.5004: UDP, length 1328
2023-11-23 22:34:52.084129 IP 172.16.10.9.54044 > 172.16.20.9.5004: UDP, length 1328
2023-11-23 22:34:52.084131 IP 172.16.10.9.54044 > 172.16.20.9.5004: UDP, length 1328
2023-11-23 22:34:52.089480 IP 172.16.10.9.54044 > 172.16.20.9.5004: UDP, length 1328
2023-11-23 22:34:52.089494 IP 172.16.10.9.54044 > 172.16.20.9.5004: UDP, length 1328
2023-11-23 22:34:52.089495 IP 172.16.10.9.54044 > 172.16.20.9.5004: UDP, length 1328
2023-11-23 22:34:52.089498 IP 172.16.10.9.54044 > 172.16.20.9.5004: UDP, length 1328
2023-11-23 22:34:52.094363 IP 172.16.10.9.54044 > 172.16.20.9.5004: UDP, length 1328
2023-11-23 22:34:52.094367 IP 172.16.10.9.54044 > 172.16.20.9.5004: UDP, length 1328
2023-11-23 22:34:52.094369 IP 172.16.10.9.54044 > 172.16.20.9.5004: UDP, length 1328
2023-11-23 22:34:52.094480 IP 172.16.10.9.54044 > 172.16.20.9.5004: UDP, length 1328
2023-11-23 22:34:52.098451 IP 172.16.10.9.54044 > 172.16.20.9.5004: UDP, length 1328
2023-11-23 22:34:52.098468 IP 172.16.10.9.54044 > 172.16.20.9.5004: UDP, length 1328
2023-11-23 22:34:52.098470 IP 172.16.10.9.54044 > 172.16.20.9.5004: UDP, length 1328
2023-11-23 22:34:52.098473 IP 172.16.10.9.54044 > 172.16.20.9.5004: UDP, length 1328
2023-11-23 22:34:52.103627 IP 172.16.10.9.54044 > 172.16.20.9.5004: UDP, length 1328
2023-11-23 22:34:52.103635 IP 172.16.10.9.54044 > 172.16.20.9.5004: UDP, length 1328
2023-11-23 22:34:52.103637 IP 172.16.10.9.54044 > 172.16.20.9.5004: UDP, length 1328
2023-11-23 22:34:52.103640 IP 172.16.10.9.54044 > 172.16.20.9.5004: UDP, length 1328
2023-11-23 22:34:52.108668 IP 172.16.10.9.54044 > 172.16.20.9.5004: UDP, length 1328
