"No.","Time","Source","Destination","Protocol","Length","Time delta from previous captured frame","Info"
"15","0.024131007","172.16.10.9","172.16.20.9","TCP","2962","0.001600760","5004  >  57968 [PSH, ACK] Seq=1 Ack=1 Win=85 Len=2896 TSval=2165895009 TSecr=3655876397 [TCP segment of a reassembled PDU]"
"31","0.067445202","172.16.10.9","172.16.20.9","TCP","2962","0.007516445","5004  >  57968 [PSH, ACK] Seq=2897 Ack=1 Win=85 Len=2896 TSval=2165895047 TSecr=3655876435 [TCP segment of a reassembled PDU]"
"66","0.121935748","172.16.10.9","172.16.20.9","TCP","2962","0.001739100","5004  >  57968 [PSH, ACK] Seq=5793 Ack=1 Win=85 Len=2896 TSval=2165895115 TSecr=3655876503 [TCP segment of a reassembled PDU]"
"81","0.161167973","172.16.10.9","172.16.20.9","TCP","2962","0.001190983","5004  >  57968 [PSH, ACK] Seq=8689 Ack=1 Win=85 Len=2896 TSval=2165895158 TSecr=3655876546 [TCP segment of a reassembled PDU]"
"117","0.232112290","172.16.10.9","172.16.20.9","TCP","2962","0.001749691","5004  >  57968 [PSH, ACK] Seq=11585 Ack=1 Win=85 Len=2896 TSval=2165895213 TSecr=3655876601 [TCP segment of a reassembled PDU]"
"132","0.256759729","172.16.10.9","172.16.20.9","TCP","2962","0.003974779","5004  >  57968 [PSH, ACK] Seq=14481 Ack=1 Win=85 Len=2896 TSval=2165895252 TSecr=3655876640 [TCP segment of a reassembled PDU]"
"168","0.317133824","172.16.10.9","172.16.20.9","TCP","2962","0.001194054","5004  >  57968 [PSH, ACK] Seq=17377 Ack=1 Win=85 Len=2896 TSval=2165895323 TSecr=3655876711 [TCP segment of a reassembled PDU]"
"183","0.343151425","172.16.10.9","172.16.20.9","TCP","2962","0.001584327","5004  >  57968 [PSH, ACK] Seq=20273 Ack=1 Win=85 Len=2896 TSval=2165895348 TSecr=3655876736 [TCP segment of a reassembled PDU]"
"219","0.407489843","172.16.10.9","172.16.20.9","TCP","2962","0.001149407","5004  >  57968 [PSH, ACK] Seq=23169 Ack=1 Win=85 Len=2896 TSval=2165895408 TSecr=3655876796 [TCP segment of a reassembled PDU]"
"234","0.433526766","172.16.10.9","172.16.20.9","TCP","2962","0.000000586","5004  >  57968 [PSH, ACK] Seq=26065 Ack=1 Win=85 Len=2896 TSval=2165895434 TSecr=3655876822 [TCP segment of a reassembled PDU]"
"270","0.491923827","172.16.10.9","172.16.20.9","TCP","2962","0.002095498","5004  >  57968 [PSH, ACK] Seq=28961 Ack=1 Win=85 Len=2896 TSval=2165895498 TSecr=3655876886 [TCP segment of a reassembled PDU]"
"284","0.517562882","172.16.10.9","172.16.20.9","TCP","2962","0.002746893","5004  >  57968 [PSH, ACK] Seq=31857 Ack=1 Win=85 Len=2896 TSval=2165895525 TSecr=3655876912 [TCP segment of a reassembled PDU]"
"321","0.594627042","172.16.10.9","172.16.20.9","TCP","2962","0.000864813","5004  >  57968 [PSH, ACK] Seq=34753 Ack=1 Win=85 Len=2896 TSval=2165895583 TSecr=3655876970 [TCP segment of a reassembled PDU]"
"335","0.625217924","172.16.10.9","172.16.20.9","TCP","2962","0.002774205","5004  >  57968 [PSH, ACK] Seq=37649 Ack=1 Win=85 Len=2896 TSval=2165895608 TSecr=3655876996 [TCP segment of a reassembled PDU]"
"371","0.682664920","172.16.10.9","172.16.20.9","TCP","2962","0.001349442","5004  >  57968 [PSH, ACK] Seq=40545 Ack=1 Win=85 Len=2896 TSval=2165895685 TSecr=3655877073 [TCP segment of a reassembled PDU]"
"386","0.705361857","172.16.10.9","172.16.20.9","TCP","2962","0.001916173","5004  >  57968 [PSH, ACK] Seq=43441 Ack=1 Win=85 Len=2896 TSval=2165895716 TSecr=3655877104 [TCP segment of a reassembled PDU]"
"422","0.761141647","172.16.10.9","172.16.20.9","TCP","2962","0.000000222","5004  >  57968 [PSH, ACK] Seq=46337 Ack=1 Win=85 Len=2896 TSval=2165895773 TSecr=3655877161 [TCP segment of a reassembled PDU]"
"437","0.793187345","172.16.10.9","172.16.20.9","TCP","2962","0.001821862","5004  >  57968 [PSH, ACK] Seq=49233 Ack=1 Win=85 Len=2896 TSval=2165895796 TSecr=3655877184 [TCP segment of a reassembled PDU]"
"472","0.856839079","172.16.10.9","172.16.20.9","TCP","2962","0.000766287","5004  >  57968 [PSH, ACK] Seq=52129 Ack=1 Win=85 Len=2896 TSval=2165895852 TSecr=3655877240 [TCP segment of a reassembled PDU]"
"488","0.884852086","172.16.10.9","172.16.20.9","TCP","2962","0.000000302","5004  >  57968 [PSH, ACK] Seq=55025 Ack=1 Win=85 Len=2896 TSval=2165895884 TSecr=3655877272 [TCP segment of a reassembled PDU]"
"523","0.937569250","172.16.10.9","172.16.20.9","TCP","2962","0.000769569","5004  >  57968 [PSH, ACK] Seq=57921 Ack=1 Win=85 Len=2896 TSval=2165895948 TSecr=3655877335 [TCP segment of a reassembled PDU]"
"539","0.961574166","172.16.10.9","172.16.20.9","TCP","2962","0.001365639","5004  >  57968 [PSH, ACK] Seq=60817 Ack=1 Win=85 Len=2896 TSval=2165895975 TSecr=3655877363 [TCP segment of a reassembled PDU]"
"574","1.019855677","172.16.10.9","172.16.20.9","TCP","2962","0.001434929","5004  >  57968 [PSH, ACK] Seq=63713 Ack=1 Win=85 Len=2896 TSval=2165896028 TSecr=3655877416 [TCP segment of a reassembled PDU]"
"590","1.053370684","172.16.10.9","172.16.20.9","TCP","2962","0.007705293","5004  >  57968 [PSH, ACK] Seq=66609 Ack=1 Win=85 Len=2896 TSval=2165896052 TSecr=3655877440 [TCP segment of a reassembled PDU]"
"625","1.120387595","172.16.10.9","172.16.20.9","TCP","2962","0.015660510","5004  >  57968 [PSH, ACK] Seq=69505 Ack=1 Win=85 Len=2896 TSval=2165896111 TSecr=3655877499 [TCP segment of a reassembled PDU]"
"639","1.158172757","172.16.10.9","172.16.20.9","TCP","2962","0.001327194","5004  >  57968 [PSH, ACK] Seq=72401 Ack=1 Win=85 Len=2896 TSval=2165896145 TSecr=3655877532 [TCP segment of a reassembled PDU]"
"676","1.229110430","172.16.10.9","172.16.20.9","TCP","2962","0.001361841","5004  >  57968 [PSH, ACK] Seq=75297 Ack=1 Win=85 Len=2896 TSval=2165896221 TSecr=3655877609 [TCP segment of a reassembled PDU]"
"690","1.265978493","172.16.10.9","172.16.20.9","TCP","2962","0.002013134","5004  >  57968 [PSH, ACK] Seq=78193 Ack=1 Win=85 Len=2896 TSval=2165896249 TSecr=3655877637 [TCP segment of a reassembled PDU]"
"727","1.325541425","172.16.10.9","172.16.20.9","TCP","2962","0.001336394","5004  >  57968 [PSH, ACK] Seq=81089 Ack=1 Win=85 Len=2896 TSval=2165896320 TSecr=3655877708 [TCP segment of a reassembled PDU]"
"741","1.356629734","172.16.10.9","172.16.20.9","TCP","2962","0.003890806","5004  >  57968 [PSH, ACK] Seq=83985 Ack=1 Win=85 Len=2896 TSval=2165896357 TSecr=3655877744 [TCP segment of a reassembled PDU]"
"778","1.415971582","172.16.10.9","172.16.20.9","TCP","2962","0.000697513","5004  >  57968 [PSH, ACK] Seq=86881 Ack=1 Win=85 Len=2896 TSval=2165896416 TSecr=3655877804 [TCP segment of a reassembled PDU]"
"792","1.441664942","172.16.10.9","172.16.20.9","TCP","2962","0.001981928","5004  >  57968 [PSH, ACK] Seq=89777 Ack=1 Win=85 Len=2896 TSval=2165896448 TSecr=3655877836 [TCP segment of a reassembled PDU]"
"829","1.503231483","172.16.10.9","172.16.20.9","TCP","2962","0.001571916","5004  >  57968 [PSH, ACK] Seq=92673 Ack=1 Win=85 Len=2896 TSval=2165896507 TSecr=3655877895 [TCP segment of a reassembled PDU]"
"843","1.527301788","172.16.10.9","172.16.20.9","TCP","2962","0.002422559","5004  >  57968 [PSH, ACK] Seq=95569 Ack=1 Win=85 Len=2896 TSval=2165896532 TSecr=3655877920 [TCP segment of a reassembled PDU]"
"880","1.607163022","172.16.10.9","172.16.20.9","TCP","2962","0.002570559","5004  >  57968 [PSH, ACK] Seq=98465 Ack=1 Win=85 Len=2896 TSval=2165896594 TSecr=3655877982 [TCP segment of a reassembled PDU]"
"894","1.628732463","172.16.10.9","172.16.20.9","TCP","2962","0.001582113","5004  >  57968 [PSH, ACK] Seq=101361 Ack=1 Win=85 Len=2896 TSval=2165896618 TSecr=3655878006 [TCP segment of a reassembled PDU]"
"931","1.701610411","172.16.10.9","172.16.20.9","TCP","2962","0.001645278","5004  >  57968 [PSH, ACK] Seq=104257 Ack=1 Win=85 Len=2896 TSval=2165896699 TSecr=3655878087 [TCP segment of a reassembled PDU]"
"945","1.723652305","172.16.10.9","172.16.20.9","TCP","2962","0.000000317","5004  >  57968 [PSH, ACK] Seq=107153 Ack=1 Win=85 Len=2896 TSval=2165896722 TSecr=3655878109 [TCP segment of a reassembled PDU]"
"982","1.784425287","172.16.10.9","172.16.20.9","TCP","2962","0.001814225","5004  >  57968 [PSH, ACK] Seq=110049 Ack=1 Win=85 Len=2896 TSval=2165896792 TSecr=3655878180 [TCP segment of a reassembled PDU]"
"995","1.817933585","172.16.10.9","172.16.20.9","TCP","2962","0.001822580","5004  >  57968 [PSH, ACK] Seq=112945 Ack=1 Win=85 Len=2896 TSval=2165896822 TSecr=3655878210 [TCP segment of a reassembled PDU]"
"1033","1.877229700","172.16.10.9","172.16.20.9","TCP","2962","0.002413001","5004  >  57968 [PSH, ACK] Seq=115841 Ack=1 Win=85 Len=2896 TSval=2165896875 TSecr=3655878263 [TCP segment of a reassembled PDU]"
"1046","1.898740447","172.16.10.9","172.16.20.9","TCP","2962","0.000000218","5004  >  57968 [PSH, ACK] Seq=118737 Ack=1 Win=85 Len=2896 TSval=2165896909 TSecr=3655878297 [TCP segment of a reassembled PDU]"
"1083","1.956975058","172.16.10.9","172.16.20.9","TCP","2962","0.001541468","5004  >  57968 [PSH, ACK] Seq=121633 Ack=1 Win=85 Len=2896 TSval=2165896968 TSecr=3655878356 [TCP segment of a reassembled PDU]"
"1096","2.002833820","172.16.10.9","172.16.20.9","TCP","2962","0.001254518","5004  >  57968 [PSH, ACK] Seq=124529 Ack=1 Win=85 Len=2896 TSval=2165896993 TSecr=3655878380 [TCP segment of a reassembled PDU]"
"1134","2.108537194","172.16.10.9","172.16.20.9","TCP","2962","0.019310076","5004  >  57968 [PSH, ACK] Seq=127425 Ack=1 Win=85 Len=2896 TSval=2165897048 TSecr=3655878435 [TCP segment of a reassembled PDU]"
"1147","2.140060231","172.16.10.9","172.16.20.9","TCP","2962","0.009731291","5004  >  57968 [PSH, ACK] Seq=130321 Ack=1 Win=85 Len=2896 TSval=2165897094 TSecr=3655878481 [TCP segment of a reassembled PDU]"
"1185","2.221869560","172.16.10.9","172.16.20.9","TCP","2962","0.000000285","5004  >  57968 [PSH, ACK] Seq=133217 Ack=1 Win=85 Len=2896 TSval=2165897199 TSecr=3655878587 [TCP segment of a reassembled PDU]"
"1198","2.243200684","172.16.10.9","172.16.20.9","TCP","2962","0.001314474","5004  >  57968 [PSH, ACK] Seq=136113 Ack=1 Win=85 Len=2896 TSval=2165897231 TSecr=3655878619 [TCP segment of a reassembled PDU]"
"1232","2.305792766","172.16.10.9","172.16.20.9","TCP","2962","0.001190016","5004  >  57968 [PSH, ACK] Seq=139009 Ack=1 Win=85 Len=2896 TSval=2165897313 TSecr=3655878701 [TCP segment of a reassembled PDU]"
"1249","2.335868123","172.16.10.9","172.16.20.9","TCP","2962","0.001899344","5004  >  57968 [PSH, ACK] Seq=141905 Ack=1 Win=85 Len=2896 TSval=2165897334 TSecr=3655878722 [TCP segment of a reassembled PDU]"
"1283","2.395285053","172.16.10.9","172.16.20.9","TCP","2962","0.000609225","5004  >  57968 [PSH, ACK] Seq=144801 Ack=1 Win=85 Len=2896 TSval=2165897397 TSecr=3655878785 [TCP segment of a reassembled PDU]"
"1300","2.427791034","172.16.10.9","172.16.20.9","TCP","2962","0.001585228","5004  >  57968 [PSH, ACK] Seq=147697 Ack=1 Win=85 Len=2896 TSval=2165897431 TSecr=3655878819 [TCP segment of a reassembled PDU]"
"1334","2.494487953","172.16.10.9","172.16.20.9","TCP","2962","0.001215377","5004  >  57968 [PSH, ACK] Seq=150593 Ack=1 Win=85 Len=2896 TSval=2165897486 TSecr=3655878874 [TCP segment of a reassembled PDU]"
"1351","2.521951114","172.16.10.9","172.16.20.9","TCP","2962","0.001351400","5004  >  57968 [PSH, ACK] Seq=153489 Ack=1 Win=85 Len=2896 TSval=2165897520 TSecr=3655878908 [TCP segment of a reassembled PDU]"
"1385","2.598346436","172.16.10.9","172.16.20.9","TCP","2962","0.001544358","5004  >  57968 [PSH, ACK] Seq=156385 Ack=1 Win=85 Len=2896 TSval=2165897585 TSecr=3655878973 [TCP segment of a reassembled PDU]"
"1402","2.626472514","172.16.10.9","172.16.20.9","TCP","2962","0.002020395","5004  >  57968 [PSH, ACK] Seq=159281 Ack=1 Win=85 Len=2896 TSval=2165897613 TSecr=3655879001 [TCP segment of a reassembled PDU]"
"1436","2.694107035","172.16.10.9","172.16.20.9","TCP","2962","0.000000262","5004  >  57968 [PSH, ACK] Seq=162177 Ack=1 Win=85 Len=2896 TSval=2165897689 TSecr=3655879077 [TCP segment of a reassembled PDU]"
"1453","2.725218175","172.16.10.9","172.16.20.9","TCP","2962","0.001279680","5004  >  57968 [PSH, ACK] Seq=165073 Ack=1 Win=85 Len=2896 TSval=2165897717 TSecr=3655879105 [TCP segment of a reassembled PDU]"
"1485","2.779511060","172.16.10.9","172.16.20.9","TCP","2962","0.001433779","5004  >  57968 [PSH, ACK] Seq=167969 Ack=1 Win=85 Len=2896 TSval=2165897785 TSecr=3655879173 [TCP segment of a reassembled PDU]"
"1504","2.859389219","172.16.10.9","172.16.20.9","TCP","2962","0.000000325","5004  >  57968 [PSH, ACK] Seq=170865 Ack=1 Win=85 Len=2896 TSval=2165897816 TSecr=3655879204 [TCP segment of a reassembled PDU]"
"1536","2.915253237","172.16.10.9","172.16.20.9","TCP","2962","0.002985524","5004  >  57968 [PSH, ACK] Seq=173761 Ack=1 Win=85 Len=2896 TSval=2165897870 TSecr=3655879258 [TCP segment of a reassembled PDU]"
"1554","2.942653530","172.16.10.9","172.16.20.9","TCP","2962","0.000075170","5004  >  57968 [PSH, ACK] Seq=176657 Ack=1 Win=85 Len=2896 TSval=2165897951 TSecr=3655879339 [TCP segment of a reassembled PDU]"
"1587","2.998699177","172.16.10.9","172.16.20.9","TCP","2962","0.001445983","5004  >  57968 [PSH, ACK] Seq=179553 Ack=1 Win=85 Len=2896 TSval=2165898006 TSecr=3655879394 [TCP segment of a reassembled PDU]"
"1605","3.031332841","172.16.10.9","172.16.20.9","TCP","2962","0.000000312","5004  >  57968 [PSH, ACK] Seq=182449 Ack=1 Win=85 Len=2896 TSval=2165898034 TSecr=3655879422 [TCP segment of a reassembled PDU]"
"1638","3.094361299","172.16.10.9","172.16.20.9","TCP","2962","0.002002898","5004  >  57968 [PSH, ACK] Seq=185345 Ack=1 Win=85 Len=2896 TSval=2165898089 TSecr=3655879477 [TCP segment of a reassembled PDU]"
"1655","3.127062060","172.16.10.9","172.16.20.9","TCP","2962","0.000318918","5004  >  57968 [PSH, ACK] Seq=188241 Ack=1 Win=85 Len=2896 TSval=2165898122 TSecr=3655879510 [TCP segment of a reassembled PDU]"
"1688","3.200674911","172.16.10.9","172.16.20.9","TCP","2962","0.002256222","5004  >  57968 [PSH, ACK] Seq=191137 Ack=1 Win=85 Len=2896 TSval=2165898185 TSecr=3655879573 [TCP segment of a reassembled PDU]"
"1705","3.230595045","172.16.10.9","172.16.20.9","TCP","2962","0.001411375","5004  >  57968 [PSH, ACK] Seq=194033 Ack=1 Win=85 Len=2896 TSval=2165898218 TSecr=3655879606 [TCP segment of a reassembled PDU]"
"1737","3.352732270","172.16.10.9","172.16.20.9","TCP","2962","0.001240134","5004  >  57968 [PSH, ACK] Seq=196929 Ack=1 Win=85 Len=2896 TSval=2165898291 TSecr=3655879679 [TCP segment of a reassembled PDU]"
"1755","3.392560236","172.16.10.9","172.16.20.9","TCP","2962","0.001247753","5004  >  57968 [PSH, ACK] Seq=199825 Ack=1 Win=85 Len=2896 TSval=2165898321 TSecr=3655879709 [TCP segment of a reassembled PDU]"
"1788","3.443814327","172.16.10.9","172.16.20.9","TCP","2962","0.001234203","5004  >  57968 [PSH, ACK] Seq=202721 Ack=1 Win=85 Len=2896 TSval=2165898444 TSecr=3655879832 [TCP segment of a reassembled PDU]"
"1806","3.473226835","172.16.10.9","172.16.20.9","TCP","2962","0.001602409","5004  >  57968 [PSH, ACK] Seq=205617 Ack=1 Win=85 Len=2896 TSval=2165898483 TSecr=3655879871 [TCP segment of a reassembled PDU]"
"1839","3.527844751","172.16.10.9","172.16.20.9","TCP","2962","0.001812379","5004  >  57968 [PSH, ACK] Seq=208513 Ack=1 Win=85 Len=2896 TSval=2165898534 TSecr=3655879922 [TCP segment of a reassembled PDU]"
"1857","3.559523490","172.16.10.9","172.16.20.9","TCP","2962","0.000806992","5004  >  57968 [PSH, ACK] Seq=211409 Ack=1 Win=85 Len=2896 TSval=2165898564 TSecr=3655879952 [TCP segment of a reassembled PDU]"
"1890","3.621401962","172.16.10.9","172.16.20.9","TCP","2962","0.004991856","5004  >  57968 [PSH, ACK] Seq=214305 Ack=1 Win=85 Len=2896 TSval=2165898618 TSecr=3655880006 [TCP segment of a reassembled PDU]"
"1907","3.650475421","172.16.10.9","172.16.20.9","TCP","2962","0.001600527","5004  >  57968 [PSH, ACK] Seq=217201 Ack=1 Win=85 Len=2896 TSval=2165898650 TSecr=3655880038 [TCP segment of a reassembled PDU]"
"1941","3.717423755","172.16.10.9","172.16.20.9","TCP","2962","0.002551467","5004  >  57968 [PSH, ACK] Seq=220097 Ack=1 Win=85 Len=2896 TSval=2165898712 TSecr=3655880100 [TCP segment of a reassembled PDU]"
"1958","3.744750099","172.16.10.9","172.16.20.9","TCP","2962","0.001395037","5004  >  57968 [PSH, ACK] Seq=222993 Ack=1 Win=85 Len=2896 TSval=2165898741 TSecr=3655880129 [TCP segment of a reassembled PDU]"
"1992","3.816713811","172.16.10.9","172.16.20.9","TCP","2962","0.001604461","5004  >  57968 [PSH, ACK] Seq=225889 Ack=1 Win=85 Len=2896 TSval=2165898808 TSecr=3655880196 [TCP segment of a reassembled PDU]"
"2009","3.872421691","172.16.10.9","172.16.20.9","TCP","2962","0.000937381","5004  >  57968 [PSH, ACK] Seq=228785 Ack=1 Win=85 Len=2896 TSval=2165898835 TSecr=3655880223 [TCP segment of a reassembled PDU]"
"2043","3.930110099","172.16.10.9","172.16.20.9","TCP","2962","0.001548166","5004  >  57968 [PSH, ACK] Seq=231681 Ack=1 Win=85 Len=2896 TSval=2165898907 TSecr=3655880295 [TCP segment of a reassembled PDU]"
"2060","3.955861054","172.16.10.9","172.16.20.9","TCP","2962","0.000915449","5004  >  57968 [PSH, ACK] Seq=234577 Ack=1 Win=85 Len=2896 TSval=2165898963 TSecr=3655880351 [TCP segment of a reassembled PDU]"
"2092","4.015437782","172.16.10.9","172.16.20.9","TCP","2962","0.009515835","5004  >  57968 [PSH, ACK] Seq=237473 Ack=1 Win=85 Len=2896 TSval=2165899021 TSecr=3655880409 [TCP segment of a reassembled PDU]"
"2110","4.041433596","172.16.10.9","172.16.20.9","TCP","2962","0.001998228","5004  >  57968 [PSH, ACK] Seq=240369 Ack=1 Win=85 Len=2896 TSval=2165899047 TSecr=3655880435 [TCP segment of a reassembled PDU]"
"2143","4.117538823","172.16.10.9","172.16.20.9","TCP","2962","0.001828485","5004  >  57968 [PSH, ACK] Seq=243265 Ack=1 Win=85 Len=2896 TSval=2165899107 TSecr=3655880494 [TCP segment of a reassembled PDU]"
"2161","4.144684726","172.16.10.9","172.16.20.9","TCP","2962","0.001245016","5004  >  57968 [PSH, ACK] Seq=246161 Ack=1 Win=85 Len=2896 TSval=2165899132 TSecr=3655880520 [TCP segment of a reassembled PDU]"
"2193","4.196022872","172.16.10.9","172.16.20.9","TCP","2962","0.001399836","5004  >  57968 [PSH, ACK] Seq=249057 Ack=1 Win=85 Len=2896 TSval=2165899208 TSecr=3655880596 [TCP segment of a reassembled PDU]"
"2212","4.240039579","172.16.10.9","172.16.20.9","TCP","2962","0.002123305","5004  >  57968 [PSH, ACK] Seq=251953 Ack=1 Win=85 Len=2896 TSval=2165899235 TSecr=3655880623 [TCP segment of a reassembled PDU]"
"2244","4.296318088","172.16.10.9","172.16.20.9","TCP","2962","0.001129425","5004  >  57968 [PSH, ACK] Seq=254849 Ack=1 Win=85 Len=2896 TSval=2165899287 TSecr=3655880675 [TCP segment of a reassembled PDU]"
"2263","4.332454759","172.16.10.9","172.16.20.9","TCP","2962","0.001555774","5004  >  57968 [PSH, ACK] Seq=257745 Ack=1 Win=85 Len=2896 TSval=2165899331 TSecr=3655880719 [TCP segment of a reassembled PDU]"
"2295","4.386657562","172.16.10.9","172.16.20.9","TCP","2962","0.002229086","5004  >  57968 [PSH, ACK] Seq=260641 Ack=1 Win=85 Len=2896 TSval=2165899395 TSecr=3655880782 [TCP segment of a reassembled PDU]"
"2314","4.420960709","172.16.10.9","172.16.20.9","TCP","2962","0.001466117","5004  >  57968 [PSH, ACK] Seq=263537 Ack=1 Win=85 Len=2896 TSval=2165899423 TSecr=3655880811 [TCP segment of a reassembled PDU]"
"2346","4.478440792","172.16.10.9","172.16.20.9","TCP","2962","0.002607074","5004  >  57968 [PSH, ACK] Seq=266433 Ack=1 Win=85 Len=2896 TSval=2165899478 TSecr=3655880865 [TCP segment of a reassembled PDU]"
"2365","4.508670742","172.16.10.9","172.16.20.9","TCP","2962","0.004525943","5004  >  57968 [PSH, ACK] Seq=269329 Ack=1 Win=85 Len=2896 TSval=2165899512 TSecr=3655880899 [TCP segment of a reassembled PDU]"
"2397","4.578794173","172.16.10.9","172.16.20.9","TCP","2962","0.001994743","5004  >  57968 [PSH, ACK] Seq=272225 Ack=1 Win=85 Len=2896 TSval=2165899569 TSecr=3655880957 [TCP segment of a reassembled PDU]"
"2416","4.611826797","172.16.10.9","172.16.20.9","TCP","2962","0.001549854","5004  >  57968 [PSH, ACK] Seq=275121 Ack=1 Win=85 Len=2896 TSval=2165899600 TSecr=3655880987 [TCP segment of a reassembled PDU]"
"2448","4.664715048","172.16.10.9","172.16.20.9","TCP","2962","0.000805868","5004  >  57968 [PSH, ACK] Seq=278017 Ack=1 Win=85 Len=2896 TSval=2165899669 TSecr=3655881057 [TCP segment of a reassembled PDU]"
"2467","4.701984641","172.16.10.9","172.16.20.9","TCP","2962","0.003248018","5004  >  57968 [PSH, ACK] Seq=280913 Ack=1 Win=85 Len=2896 TSval=2165899703 TSecr=3655881090 [TCP segment of a reassembled PDU]"
"2499","4.753574977","172.16.10.9","172.16.20.9","TCP","2962","0.000920559","5004  >  57968 [PSH, ACK] Seq=283809 Ack=1 Win=85 Len=2896 TSval=2165899756 TSecr=3655881144 [TCP segment of a reassembled PDU]"
"2518","4.791070333","172.16.10.9","172.16.20.9","TCP","2962","0.002507088","5004  >  57968 [PSH, ACK] Seq=286705 Ack=1 Win=85 Len=2896 TSval=2165899793 TSecr=3655881181 [TCP segment of a reassembled PDU]"
"2550","4.854105442","172.16.10.9","172.16.20.9","TCP","2962","0.001727092","5004  >  57968 [PSH, ACK] Seq=289601 Ack=1 Win=85 Len=2896 TSval=2165899844 TSecr=3655881232 [TCP segment of a reassembled PDU]"
"2569","4.893699883","172.16.10.9","172.16.20.9","TCP","2962","0.001809827","5004  >  57968 [PSH, ACK] Seq=292497 Ack=1 Win=85 Len=2896 TSval=2165899882 TSecr=3655881270 [TCP segment of a reassembled PDU]"
"2601","4.949065398","172.16.10.9","172.16.20.9","TCP","2962","0.002061515","5004  >  57968 [PSH, ACK] Seq=295393 Ack=1 Win=85 Len=2896 TSval=2165899945 TSecr=3655881333 [TCP segment of a reassembled PDU]"
"2619","5.002391867","172.16.10.9","172.16.20.9","TCP","2962","0.003422952","5004  >  57968 [PSH, ACK] Seq=298289 Ack=1 Win=85 Len=2896 TSval=2165899984 TSecr=3655881372 [TCP segment of a reassembled PDU]"
"2652","5.076982528","172.16.10.9","172.16.20.9","TCP","2962","0.002363445","5004  >  57968 [PSH, ACK] Seq=301185 Ack=1 Win=85 Len=2896 TSval=2165900040 TSecr=3655881428 [TCP segment of a reassembled PDU]"
"2670","5.115469133","172.16.10.9","172.16.20.9","TCP","2962","0.000894028","5004  >  57968 [PSH, ACK] Seq=304081 Ack=1 Win=85 Len=2896 TSval=2165900093 TSecr=3655881481 [TCP segment of a reassembled PDU]"
"2703","5.165603869","172.16.10.9","172.16.20.9","TCP","2962","0.001330224","5004  >  57968 [PSH, ACK] Seq=306977 Ack=1 Win=85 Len=2896 TSval=2165900168 TSecr=3655881556 [TCP segment of a reassembled PDU]"
"2721","5.198643215","172.16.10.9","172.16.20.9","TCP","2962","0.001117220","5004  >  57968 [PSH, ACK] Seq=309873 Ack=1 Win=85 Len=2896 TSval=2165900206 TSecr=3655881594 [TCP segment of a reassembled PDU]"
"2754","5.276503241","172.16.10.9","172.16.20.9","TCP","2962","0.002836494","5004  >  57968 [PSH, ACK] Seq=312769 Ack=1 Win=85 Len=2896 TSval=2165900256 TSecr=3655881644 [TCP segment of a reassembled PDU]"
"2772","5.319727157","172.16.10.9","172.16.20.9","TCP","2962","0.001086799","5004  >  57968 [PSH, ACK] Seq=315665 Ack=1 Win=85 Len=2896 TSval=2165900289 TSecr=3655881677 [TCP segment of a reassembled PDU]"
"2805","5.386692792","172.16.10.9","172.16.20.9","TCP","2962","0.000000506","5004  >  57968 [PSH, ACK] Seq=318561 Ack=1 Win=85 Len=2896 TSval=2165900367 TSecr=3655881755 [TCP segment of a reassembled PDU]"
"2823","5.414280219","172.16.10.9","172.16.20.9","TCP","2962","0.001990839","5004  >  57968 [PSH, ACK] Seq=321457 Ack=1 Win=85 Len=2896 TSval=2165900410 TSecr=3655881798 [TCP segment of a reassembled PDU]"
"2855","5.476531365","172.16.10.9","172.16.20.9","TCP","2962","0.002670624","5004  >  57968 [PSH, ACK] Seq=324353 Ack=1 Win=85 Len=2896 TSval=2165900477 TSecr=3655881865 [TCP segment of a reassembled PDU]"
"2874","5.513926149","172.16.10.9","172.16.20.9","TCP","2962","0.005255134","5004  >  57968 [PSH, ACK] Seq=327249 Ack=1 Win=85 Len=2896 TSval=2165900505 TSecr=3655881893 [TCP segment of a reassembled PDU]"
"2906","5.585173195","172.16.10.9","172.16.20.9","TCP","2962","0.002013166","5004  >  57968 [PSH, ACK] Seq=330145 Ack=1 Win=85 Len=2896 TSval=2165900567 TSecr=3655881955 [TCP segment of a reassembled PDU]"
"2925","5.618521891","172.16.10.9","172.16.20.9","TCP","2962","0.002400814","5004  >  57968 [PSH, ACK] Seq=333041 Ack=1 Win=85 Len=2896 TSval=2165900605 TSecr=3655881993 [TCP segment of a reassembled PDU]"
"2957","5.667535283","172.16.10.9","172.16.20.9","TCP","2962","0.001192405","5004  >  57968 [PSH, ACK] Seq=335937 Ack=1 Win=85 Len=2896 TSval=2165900676 TSecr=3655882064 [TCP segment of a reassembled PDU]"
"2976","5.698766179","172.16.10.9","172.16.20.9","TCP","2962","0.002320800","5004  >  57968 [PSH, ACK] Seq=338833 Ack=1 Win=85 Len=2896 TSval=2165900709 TSecr=3655882097 [TCP segment of a reassembled PDU]"
"3008","5.767430037","172.16.10.9","172.16.20.9","TCP","2962","0.002522946","5004  >  57968 [PSH, ACK] Seq=341729 Ack=1 Win=85 Len=2896 TSval=2165900758 TSecr=3655882146 [TCP segment of a reassembled PDU]"
"3027","5.803382292","172.16.10.9","172.16.20.9","TCP","2962","0.000000626","5004  >  57968 [PSH, ACK] Seq=344625 Ack=1 Win=85 Len=2896 TSval=2165900789 TSecr=3655882177 [TCP segment of a reassembled PDU]"
"3059","5.872314754","172.16.10.9","172.16.20.9","TCP","2962","0.001760064","5004  >  57968 [PSH, ACK] Seq=347521 Ack=1 Win=85 Len=2896 TSval=2165900858 TSecr=3655882246 [TCP segment of a reassembled PDU]"
"3077","5.907110708","172.16.10.9","172.16.20.9","TCP","2962","0.003773544","5004  >  57968 [PSH, ACK] Seq=350417 Ack=1 Win=85 Len=2896 TSval=2165900895 TSecr=3655882283 [TCP segment of a reassembled PDU]"
"3110","5.969024320","172.16.10.9","172.16.20.9","TCP","2962","0.007926308","5004  >  57968 [PSH, ACK] Seq=353313 Ack=1 Win=85 Len=2896 TSval=2165900963 TSecr=3655882351 [TCP segment of a reassembled PDU]"
"3128","5.994486864","172.16.10.9","172.16.20.9","TCP","2962","0.001127593","5004  >  57968 [PSH, ACK] Seq=356209 Ack=1 Win=85 Len=2896 TSval=2165900998 TSecr=3655882386 [TCP segment of a reassembled PDU]"
"3161","6.057088934","172.16.10.9","172.16.20.9","TCP","2962","0.000000363","5004  >  57968 [PSH, ACK] Seq=359105 Ack=1 Win=85 Len=2896 TSval=2165901060 TSecr=3655882448 [TCP segment of a reassembled PDU]"
"3179","6.087234914","172.16.10.9","172.16.20.9","TCP","2962","0.001113056","5004  >  57968 [PSH, ACK] Seq=362001 Ack=1 Win=85 Len=2896 TSval=2165901085 TSecr=3655882473 [TCP segment of a reassembled PDU]"
"3212","6.155581628","172.16.10.9","172.16.20.9","TCP","2962","0.001570428","5004  >  57968 [PSH, ACK] Seq=364897 Ack=1 Win=85 Len=2896 TSval=2165901149 TSecr=3655882537 [TCP segment of a reassembled PDU]"
"3230","6.184410180","172.16.10.9","172.16.20.9","TCP","2962","0.001114455","5004  >  57968 [PSH, ACK] Seq=367793 Ack=1 Win=85 Len=2896 TSval=2165901178 TSecr=3655882566 [TCP segment of a reassembled PDU]"
"3263","6.234562810","172.16.10.9","172.16.20.9","TCP","2962","0.001449410","5004  >  57968 [PSH, ACK] Seq=370689 Ack=1 Win=85 Len=2896 TSval=2165901248 TSecr=3655882635 [TCP segment of a reassembled PDU]"
"3281","6.264855418","172.16.10.9","172.16.20.9","TCP","2962","0.001738393","5004  >  57968 [PSH, ACK] Seq=373585 Ack=1 Win=85 Len=2896 TSval=2165901275 TSecr=3655882663 [TCP segment of a reassembled PDU]"
"3314","6.344770307","172.16.10.9","172.16.20.9","TCP","2962","0.006217656","5004  >  57968 [PSH, ACK] Seq=376481 Ack=1 Win=85 Len=2896 TSval=2165901325 TSecr=3655882713 [TCP segment of a reassembled PDU]"
"3332","6.370865738","172.16.10.9","172.16.20.9","TCP","2962","0.002005996","5004  >  57968 [PSH, ACK] Seq=379377 Ack=1 Win=85 Len=2896 TSval=2165901355 TSecr=3655882743 [TCP segment of a reassembled PDU]"
"3365","6.425573095","172.16.10.9","172.16.20.9","TCP","2962","0.006415723","5004  >  57968 [PSH, ACK] Seq=382273 Ack=1 Win=85 Len=2896 TSval=2165901435 TSecr=3655882823 [TCP segment of a reassembled PDU]"
"3383","6.456464232","172.16.10.9","172.16.20.9","TCP","2962","0.006729918","5004  >  57968 [PSH, ACK] Seq=385169 Ack=1 Win=85 Len=2896 TSval=2165901462 TSecr=3655882850 [TCP segment of a reassembled PDU]"
"3416","6.506275433","172.16.10.9","172.16.20.9","TCP","2962","0.000330800","5004  >  57968 [PSH, ACK] Seq=388065 Ack=1 Win=85 Len=2896 TSval=2165901516 TSecr=3655882904 [TCP segment of a reassembled PDU]"
"3433","6.532573398","172.16.10.9","172.16.20.9","TCP","2962","0.001902339","5004  >  57968 [PSH, ACK] Seq=390961 Ack=1 Win=85 Len=2896 TSval=2165901547 TSecr=3655882935 [TCP segment of a reassembled PDU]"
"3466","6.591379642","172.16.10.9","172.16.20.9","TCP","2962","0.000000298","5004  >  57968 [PSH, ACK] Seq=393857 Ack=1 Win=85 Len=2896 TSval=2165901597 TSecr=3655882985 [TCP segment of a reassembled PDU]"
"3484","6.621583403","172.16.10.9","172.16.20.9","TCP","2962","0.001301448","5004  >  57968 [PSH, ACK] Seq=396753 Ack=1 Win=85 Len=2896 TSval=2165901623 TSecr=3655883011 [TCP segment of a reassembled PDU]"
"3516","6.689888707","172.16.10.9","172.16.20.9","TCP","2962","0.000797927","5004  >  57968 [PSH, ACK] Seq=399649 Ack=1 Win=85 Len=2896 TSval=2165901682 TSecr=3655883070 [TCP segment of a reassembled PDU]"
"3535","6.728586554","172.16.10.9","172.16.20.9","TCP","2962","0.002040722","5004  >  57968 [PSH, ACK] Seq=402545 Ack=1 Win=85 Len=2896 TSval=2165901712 TSecr=3655883100 [TCP segment of a reassembled PDU]"
"3567","6.778376901","172.16.10.9","172.16.20.9","TCP","2962","0.001403981","5004  >  57968 [PSH, ACK] Seq=405441 Ack=1 Win=85 Len=2896 TSval=2165901781 TSecr=3655883168 [TCP segment of a reassembled PDU]"
"3586","6.817832879","172.16.10.9","172.16.20.9","TCP","2962","0.001650620","5004  >  57968 [PSH, ACK] Seq=408337 Ack=1 Win=85 Len=2896 TSval=2165901819 TSecr=3655883207 [TCP segment of a reassembled PDU]"
"3618","6.875991214","172.16.10.9","172.16.20.9","TCP","2962","0.001446172","5004  >  57968 [PSH, ACK] Seq=411233 Ack=1 Win=85 Len=2896 TSval=2165901869 TSecr=3655883257 [TCP segment of a reassembled PDU]"
"3635","6.906054050","172.16.10.9","172.16.20.9","TCP","2962","0.002163082","5004  >  57968 [PSH, ACK] Seq=414129 Ack=1 Win=85 Len=2896 TSval=2165901908 TSecr=3655883296 [TCP segment of a reassembled PDU]"
"3669","6.979245718","172.16.10.9","172.16.20.9","TCP","2962","0.007444119","5004  >  57968 [PSH, ACK] Seq=417025 Ack=1 Win=85 Len=2896 TSval=2165901967 TSecr=3655883355 [TCP segment of a reassembled PDU]"
"3686","7.010761616","172.16.10.9","172.16.20.9","TCP","2962","0.006796933","5004  >  57968 [PSH, ACK] Seq=419921 Ack=1 Win=85 Len=2896 TSval=2165901997 TSecr=3655883385 [TCP segment of a reassembled PDU]"
"3718","7.073545239","172.16.10.9","172.16.20.9","TCP","2962","0.002240457","5004  >  57968 [PSH, ACK] Seq=422817 Ack=1 Win=85 Len=2896 TSval=2165902071 TSecr=3655883459 [TCP segment of a reassembled PDU]"
"3737","7.106426289","172.16.10.9","172.16.20.9","TCP","2962","0.002760715","5004  >  57968 [PSH, ACK] Seq=425713 Ack=1 Win=85 Len=2896 TSval=2165902102 TSecr=3655883489 [TCP segment of a reassembled PDU]"
"3769","7.159900879","172.16.10.9","172.16.20.9","TCP","2962","0.001524533","5004  >  57968 [PSH, ACK] Seq=428609 Ack=1 Win=85 Len=2896 TSval=2165902164 TSecr=3655883552 [TCP segment of a reassembled PDU]"
"3787","7.201655025","172.16.10.9","172.16.20.9","TCP","2962","0.001431049","5004  >  57968 [PSH, ACK] Seq=431505 Ack=1 Win=85 Len=2896 TSval=2165902197 TSecr=3655883585 [TCP segment of a reassembled PDU]"
"3820","7.257191509","172.16.10.9","172.16.20.9","TCP","2962","0.000834974","5004  >  57968 [PSH, ACK] Seq=434401 Ack=1 Win=85 Len=2896 TSval=2165902250 TSecr=3655883638 [TCP segment of a reassembled PDU]"
"3838","7.286633868","172.16.10.9","172.16.20.9","TCP","2962","0.001191512","5004  >  57968 [PSH, ACK] Seq=437297 Ack=1 Win=85 Len=2896 TSval=2165902292 TSecr=3655883680 [TCP segment of a reassembled PDU]"
"3871","7.336933111","172.16.10.9","172.16.20.9","TCP","2962","0.000661417","5004  >  57968 [PSH, ACK] Seq=440193 Ack=1 Win=85 Len=2896 TSval=2165902348 TSecr=3655883736 [TCP segment of a reassembled PDU]"
"3889","7.378367400","172.16.10.9","172.16.20.9","TCP","2962","0.001441273","5004  >  57968 [PSH, ACK] Seq=443089 Ack=1 Win=85 Len=2896 TSval=2165902377 TSecr=3655883765 [TCP segment of a reassembled PDU]"
"3920","7.431251098","172.16.10.9","172.16.20.9","TCP","2962","0.001575393","5004  >  57968 [PSH, ACK] Seq=445985 Ack=1 Win=85 Len=2896 TSval=2165902428 TSecr=3655883815 [TCP segment of a reassembled PDU]"
"3940","7.461050321","172.16.10.9","172.16.20.9","TCP","2962","0.001328351","5004  >  57968 [PSH, ACK] Seq=448881 Ack=1 Win=85 Len=2896 TSval=2165902469 TSecr=3655883857 [TCP segment of a reassembled PDU]"
"3971","7.537602055","172.16.10.9","172.16.20.9","TCP","2962","0.013332389","5004  >  57968 [PSH, ACK] Seq=451777 Ack=1 Win=85 Len=2896 TSval=2165902522 TSecr=3655883910 [TCP segment of a reassembled PDU]"
"3991","7.571670929","172.16.10.9","172.16.20.9","TCP","2962","0.001287179","5004  >  57968 [PSH, ACK] Seq=454673 Ack=1 Win=85 Len=2896 TSval=2165902552 TSecr=3655883940 [TCP segment of a reassembled PDU]"
"4022","7.633078452","172.16.10.9","172.16.20.9","TCP","2962","0.000000212","5004  >  57968 [PSH, ACK] Seq=457569 Ack=1 Win=85 Len=2896 TSval=2165902629 TSecr=3655884017 [TCP segment of a reassembled PDU]"
"4042","7.665182886","172.16.10.9","172.16.20.9","TCP","2962","0.002985671","5004  >  57968 [PSH, ACK] Seq=460465 Ack=1 Win=85 Len=2896 TSval=2165902662 TSecr=3655884050 [TCP segment of a reassembled PDU]"
"4072","7.718724028","172.16.10.9","172.16.20.9","TCP","2962","0.005989225","5004  >  57968 [PSH, ACK] Seq=463361 Ack=1 Win=85 Len=2896 TSval=2165902724 TSecr=3655884112 [TCP segment of a reassembled PDU]"
"4093","7.751194946","172.16.10.9","172.16.20.9","TCP","2962","0.002051146","5004  >  57968 [PSH, ACK] Seq=466257 Ack=1 Win=85 Len=2896 TSval=2165902756 TSecr=3655884144 [TCP segment of a reassembled PDU]"
"4123","7.811197299","172.16.10.9","172.16.20.9","TCP","2962","0.000000742","5004  >  57968 [PSH, ACK] Seq=469153 Ack=1 Win=85 Len=2896 TSval=2165902809 TSecr=3655884197 [TCP segment of a reassembled PDU]"
"4144","7.862246069","172.16.10.9","172.16.20.9","TCP","2962","0.002279776","5004  >  57968 [PSH, ACK] Seq=472049 Ack=1 Win=85 Len=2896 TSval=2165902842 TSecr=3655884230 [TCP segment of a reassembled PDU]"
"4173","7.911078613","172.16.10.9","172.16.20.9","TCP","2962","0.002713504","5004  >  57968 [PSH, ACK] Seq=474945 Ack=1 Win=85 Len=2896 TSval=2165902903 TSecr=3655884291 [TCP segment of a reassembled PDU]"
"4195","7.949888592","172.16.10.9","172.16.20.9","TCP","2962","0.002365103","5004  >  57968 [PSH, ACK] Seq=477841 Ack=1 Win=85 Len=2896 TSval=2165902953 TSecr=3655884341 [TCP segment of a reassembled PDU]"
"4224","8.019713069","172.16.10.9","172.16.20.9","TCP","2962","0.000000242","5004  >  57968 [PSH, ACK] Seq=480737 Ack=1 Win=85 Len=2896 TSval=2165903002 TSecr=3655884390 [TCP segment of a reassembled PDU]"
"4246","8.112915476","172.16.10.9","172.16.20.9","TCP","2962","0.058701867","5004  >  57968 [PSH, ACK] Seq=483633 Ack=1 Win=85 Len=2896 TSval=2165903041 TSecr=3655884429 [TCP segment of a reassembled PDU]"
"4274","8.194365223","172.16.10.9","172.16.20.9","TCP","2962","0.001864139","5004  >  57968 [PSH, ACK] Seq=486529 Ack=1 Win=85 Len=2896 TSval=2165903112 TSecr=3655884500 [TCP segment of a reassembled PDU]"
"4298","8.233681642","172.16.10.9","172.16.20.9","TCP","2962","0.001473399","5004  >  57968 [PSH, ACK] Seq=489425 Ack=1 Win=85 Len=2896 TSval=2165903207 TSecr=3655884593 [TCP segment of a reassembled PDU]"
"4325","8.279351129","172.16.10.9","172.16.20.9","TCP","2962","0.001276463","5004  >  57968 [PSH, ACK] Seq=492321 Ack=1 Win=85 Len=2896 TSval=2165903285 TSecr=3655884673 [TCP segment of a reassembled PDU]"
"4349","8.332558705","172.16.10.9","172.16.20.9","TCP","2962","0.001347718","5004  >  57968 [PSH, ACK] Seq=495217 Ack=1 Win=85 Len=2896 TSval=2165903324 TSecr=3655884712 [TCP segment of a reassembled PDU]"
"4376","8.380749540","172.16.10.9","172.16.20.9","TCP","2962","0.001286801","5004  >  57968 [PSH, ACK] Seq=498113 Ack=1 Win=85 Len=2896 TSval=2165903370 TSecr=3655884758 [TCP segment of a reassembled PDU]"
"4400","8.427571673","172.16.10.9","172.16.20.9","TCP","2962","0.006000813","5004  >  57968 [PSH, ACK] Seq=501009 Ack=1 Win=85 Len=2896 TSval=2165903423 TSecr=3655884811 [TCP segment of a reassembled PDU]"
"4427","8.468490251","172.16.10.9","172.16.20.9","TCP","2962","0.001695688","5004  >  57968 [PSH, ACK] Seq=503905 Ack=1 Win=85 Len=2896 TSval=2165903471 TSecr=3655884859 [TCP segment of a reassembled PDU]"
"4451","8.504837953","172.16.10.9","172.16.20.9","TCP","2962","0.001134014","5004  >  57968 [PSH, ACK] Seq=506801 Ack=1 Win=85 Len=2896 TSval=2165903518 TSecr=3655884906 [TCP segment of a reassembled PDU]"
"4478","8.567135520","172.16.10.9","172.16.20.9","TCP","2962","0.001588160","5004  >  57968 [PSH, ACK] Seq=509697 Ack=1 Win=85 Len=2896 TSval=2165903560 TSecr=3655884947 [TCP segment of a reassembled PDU]"
"4502","8.633580926","172.16.10.9","172.16.20.9","TCP","2962","0.004004744","5004  >  57968 [PSH, ACK] Seq=512593 Ack=1 Win=85 Len=2896 TSval=2165903595 TSecr=3655884983 [TCP segment of a reassembled PDU]"
"4529","8.680735132","172.16.10.9","172.16.20.9","TCP","2962","0.002256599","5004  >  57968 [PSH, ACK] Seq=515489 Ack=1 Win=85 Len=2896 TSval=2165903658 TSecr=3655885046 [TCP segment of a reassembled PDU]"
"4553","8.721946562","172.16.10.9","172.16.20.9","TCP","2962","0.001653426","5004  >  57968 [PSH, ACK] Seq=518385 Ack=1 Win=85 Len=2896 TSval=2165903724 TSecr=3655885112 [TCP segment of a reassembled PDU]"
"4580","8.767192459","172.16.10.9","172.16.20.9","TCP","2962","0.001580294","5004  >  57968 [PSH, ACK] Seq=521281 Ack=1 Win=85 Len=2896 TSval=2165903772 TSecr=3655885160 [TCP segment of a reassembled PDU]"
"4604","8.814254992","172.16.10.9","172.16.20.9","TCP","2962","0.001271165","5004  >  57968 [PSH, ACK] Seq=524177 Ack=1 Win=85 Len=2896 TSval=2165903813 TSecr=3655885200 [TCP segment of a reassembled PDU]"
"4631","8.863432328","172.16.10.9","172.16.20.9","TCP","2962","0.001670227","5004  >  57968 [PSH, ACK] Seq=527073 Ack=1 Win=85 Len=2896 TSval=2165903858 TSecr=3655885246 [TCP segment of a reassembled PDU]"
"4655","8.904308834","172.16.10.9","172.16.20.9","TCP","2962","0.001590377","5004  >  57968 [PSH, ACK] Seq=529969 Ack=1 Win=85 Len=2896 TSval=2165903905 TSecr=3655885293 [TCP segment of a reassembled PDU]"
"4682","8.947113489","172.16.10.9","172.16.20.9","TCP","2962","0.000925288","5004  >  57968 [PSH, ACK] Seq=532865 Ack=1 Win=85 Len=2896 TSval=2165903954 TSecr=3655885342 [TCP segment of a reassembled PDU]"
"4706","8.993674171","172.16.10.9","172.16.20.9","TCP","2962","0.001304845","5004  >  57968 [PSH, ACK] Seq=535761 Ack=1 Win=85 Len=2896 TSval=2165903995 TSecr=3655885383 [TCP segment of a reassembled PDU]"
"4733","9.054767422","172.16.10.9","172.16.20.9","TCP","2962","0.000000274","5004  >  57968 [PSH, ACK] Seq=538657 Ack=1 Win=85 Len=2896 TSval=2165904038 TSecr=3655885426 [TCP segment of a reassembled PDU]"
"4757","9.101605503","172.16.10.9","172.16.20.9","TCP","2962","0.000000335","5004  >  57968 [PSH, ACK] Seq=541553 Ack=1 Win=85 Len=2896 TSval=2165904084 TSecr=3655885472 [TCP segment of a reassembled PDU]"
"4783","9.148126807","172.16.10.9","172.16.20.9","TCP","2962","0.000000289","5004  >  57968 [PSH, ACK] Seq=544449 Ack=1 Win=85 Len=2896 TSval=2165904145 TSecr=3655885533 [TCP segment of a reassembled PDU]"
"4807","9.218613264","172.16.10.9","172.16.20.9","TCP","2962","0.005979401","5004  >  57968 [PSH, ACK] Seq=547345 Ack=1 Win=85 Len=2896 TSval=2165904192 TSecr=3655885580 [TCP segment of a reassembled PDU]"
"4833","9.261212446","172.16.10.9","172.16.20.9","TCP","2962","0.005807605","5004  >  57968 [PSH, ACK] Seq=550241 Ack=1 Win=85 Len=2896 TSval=2165904239 TSecr=3655885627 [TCP segment of a reassembled PDU]"
"4858","9.311756146","172.16.10.9","172.16.20.9","TCP","2962","0.001648118","5004  >  57968 [PSH, ACK] Seq=553137 Ack=1 Win=85 Len=2896 TSval=2165904309 TSecr=3655885697 [TCP segment of a reassembled PDU]"
"4884","9.357403819","172.16.10.9","172.16.20.9","TCP","2962","0.001550059","5004  >  57968 [PSH, ACK] Seq=556033 Ack=1 Win=85 Len=2896 TSval=2165904352 TSecr=3655885740 [TCP segment of a reassembled PDU]"
"4907","9.396676837","172.16.10.9","172.16.20.9","TCP","2962","0.000595247","5004  >  57968 [PSH, ACK] Seq=558929 Ack=1 Win=85 Len=2896 TSval=2165904402 TSecr=3655885790 [TCP segment of a reassembled PDU]"
