"No.","Time","Source","Destination","Protocol","Length","Time delta from previous captured frame","Info"
"12","101.095725714","172.16.10.9","172.16.20.9","TCP","74","0.000508334","5004  >  39686 [SYN, ACK] Seq=0 Ack=1 Win=43440 Len=0 MSS=1460 SACK_PERM=1 TSval=2165669531 TSecr=3655650919 WS=512"
"15","101.095843663","172.16.10.9","172.16.20.9","TCP","66","0.000015609","5004  >  39686 [ACK] Seq=1 Ack=137 Win=43520 Len=0 TSval=2165669532 TSecr=3655650920"
"16","101.118206637","172.16.10.9","172.16.20.9","TCP","169","0.022362974","5004  >  39686 [PSH, ACK] Seq=1 Ack=137 Win=43520 Len=103 TSval=2165669554 TSecr=3655650920 [TCP segment of a reassembled PDU]"
"18","101.118404705","172.16.10.9","172.16.20.9","TCP","463","0.000168261","5004  >  39686 [PSH, ACK] Seq=104 Ack=137 Win=43520 Len=397 TSval=2165669554 TSecr=3655650942 [TCP segment of a reassembled PDU]"
"22","109.220461756","172.16.10.9","172.16.20.9","TCP","7306","2.943650956","5004  >  39686 [PSH, ACK] Seq=501 Ack=137 Win=43520 Len=7240 TSval=2165677656 TSecr=3655650942 [TCP segment of a reassembled PDU]"
"24","109.228991505","172.16.10.9","172.16.20.9","TCP","2826","0.008132452","5004  >  39686 [PSH, ACK] Seq=7741 Ack=137 Win=43520 Len=2760 TSval=2165677656 TSecr=3655650942 [TCP segment of a reassembled PDU]"
"26","109.231840174","172.16.10.9","172.16.20.9","TCP","8754","0.002823025","5004  >  39686 [PSH, ACK] Seq=10501 Ack=137 Win=43520 Len=8688 TSval=2165677657 TSecr=3655659044 [TCP segment of a reassembled PDU]"
"28","109.239604002","172.16.10.9","172.16.20.9","TCP","10202","0.007733617","5004  >  39686 [PSH, ACK] Seq=19189 Ack=137 Win=43520 Len=10136 TSval=2165677657 TSecr=3655659044 [TCP segment of a reassembled PDU]"
"30","109.250368028","172.16.10.9","172.16.20.9","TCP","5858","0.010733825","5004  >  39686 [PSH, ACK] Seq=29325 Ack=137 Win=43520 Len=5792 TSval=2165677665 TSecr=3655659053 [TCP segment of a reassembled PDU]"
"32","109.257312088","172.16.10.9","172.16.20.9","TCP","14546","0.006921318","5004  >  39686 [PSH, ACK] Seq=35117 Ack=137 Win=43520 Len=14480 TSval=2165677668 TSecr=3655659056 [TCP segment of a reassembled PDU]"
"34","109.271408695","172.16.10.9","172.16.20.9","TCP","18194","0.014072224","5004  >  39686 [PSH, ACK] Seq=49597 Ack=137 Win=43520 Len=18128 TSval=2165677676 TSecr=3655659063 [TCP segment of a reassembled PDU]"
"36","109.293997043","172.16.10.9","172.16.20.9","TCP","1514","0.022493562","5004  >  39686 [ACK] Seq=67725 Ack=137 Win=43520 Len=1448 TSval=2165677707 TSecr=3655659095 [TCP segment of a reassembled PDU]"
"38","109.294627217","172.16.10.9","172.16.20.9","TCP","762","0.000605174","5004  >  39686 [ACK] Seq=69173 Ack=137 Win=43520 Len=696 TSval=2165677707 TSecr=3655659095 [TCP segment of a reassembled PDU]"
"40","109.298519375","172.16.10.9","172.16.20.9","TCP","13098","0.003875657","5004  >  39686 [PSH, ACK] Seq=69869 Ack=137 Win=43520 Len=13032 TSval=2165677707 TSecr=3655659095 [TCP segment of a reassembled PDU]"
"42","109.310955409","172.16.10.9","172.16.20.9","TCP","7306","0.012411998","5004  >  39686 [PSH, ACK] Seq=82901 Ack=137 Win=43520 Len=7240 TSval=2165677730 TSecr=3655659118 [TCP segment of a reassembled PDU]"
"44","109.318291604","172.16.10.9","172.16.20.9","TCP","11650","0.007312584","5004  >  39686 [PSH, ACK] Seq=90141 Ack=137 Win=43520 Len=11584 TSval=2165677730 TSecr=3655659118 [TCP segment of a reassembled PDU]"
"46","109.334060619","172.16.10.9","172.16.20.9","TCP","8754","0.015744703","5004  >  39686 [PSH, ACK] Seq=101725 Ack=137 Win=43520 Len=8688 TSval=2165677747 TSecr=3655659135 [TCP segment of a reassembled PDU]"
"48","109.342299563","172.16.10.9","172.16.20.9","TCP","1514","0.008215217","5004  >  39686 [ACK] Seq=110413 Ack=137 Win=43520 Len=1448 TSval=2165677770 TSecr=3655659158 [TCP segment of a reassembled PDU]"
"50","109.345335237","172.16.10.9","172.16.20.9","TCP","1514","0.002815796","5004  >  39686 [ACK] Seq=111861 Ack=137 Win=43520 Len=1448 TSval=2165677770 TSecr=3655659158 [TCP segment of a reassembled PDU]"
"52","109.345826641","172.16.10.9","172.16.20.9","TCP","2420","0.000089326","5004  >  39686 [PSH, ACK] Seq=113309 Ack=137 Win=43520 Len=2354 TSval=2165677770 TSecr=3655659158 [TCP segment of a reassembled PDU]"
"54","109.462456240","172.16.10.9","172.16.20.9","TCP","1574","0.116622752","5004  >  39686 [PSH, ACK] Seq=115663 Ack=137 Win=43520 Len=1508 TSval=2165677898 TSecr=3655659170 [TCP segment of a reassembled PDU]"
"56","109.462659792","172.16.10.9","172.16.20.9","TCP","10066","0.000182999","5004  >  39686 [PSH, ACK] Seq=117171 Ack=137 Win=43520 Len=10000 TSval=2165677899 TSecr=3655659286 [TCP segment of a reassembled PDU]"
"58","109.473169993","172.16.10.9","172.16.20.9","TCP","10066","0.010503383","5004  >  39686 [PSH, ACK] Seq=127171 Ack=137 Win=43520 Len=10000 TSval=2165677899 TSecr=3655659287 [TCP segment of a reassembled PDU]"
"60","109.488335226","172.16.10.9","172.16.20.9","TCP","4742","0.015138503","5004  >  39686 [PSH, ACK] Seq=137171 Ack=137 Win=43520 Len=4676 TSval=2165677909 TSecr=3655659297 [TCP segment of a reassembled PDU]"
"62","109.509117490","172.16.10.9","172.16.20.9","TCP","10066","0.020759993","5004  >  39686 [PSH, ACK] Seq=141847 Ack=137 Win=43520 Len=10000 TSval=2165677945 TSecr=3655659312 [TCP segment of a reassembled PDU]"
"64","109.521774275","172.16.10.9","172.16.20.9","TCP","5858","0.011677427","5004  >  39686 [PSH, ACK] Seq=151847 Ack=137 Win=43520 Len=5792 TSval=2165677945 TSecr=3655659312 [TCP segment of a reassembled PDU]"
"66","109.526522740","172.16.10.9","172.16.20.9","TCP","462","0.004726440","5004  >  39686 [PSH, ACK] Seq=157639 Ack=137 Win=43520 Len=396 TSval=2165677946 TSecr=3655659334 [TCP segment of a reassembled PDU]"
"68","109.719411913","172.16.10.9","172.16.20.9","TCP","4906","0.192857882","5004  >  39686 [PSH, ACK] Seq=158035 Ack=137 Win=43520 Len=4840 TSval=2165678155 TSecr=3655659350 [TCP segment of a reassembled PDU]"
"70","109.781462713","172.16.10.9","172.16.20.9","TCP","6375","0.061831716","5004  >  39686 [PSH, ACK] Seq=162875 Ack=137 Win=43520 Len=6309 TSval=2165678217 TSecr=3655659543 [TCP segment of a reassembled PDU]"
"72","109.786868823","172.16.10.9","172.16.20.9","TCP","8754","0.005161830","5004  >  39686 [PSH, ACK] Seq=169184 Ack=137 Win=43520 Len=8688 TSval=2165678218 TSecr=3655659543 [TCP segment of a reassembled PDU]"
"74","109.796012378","172.16.10.9","172.16.20.9","TCP","8754","0.008926766","5004  >  39686 [PSH, ACK] Seq=177872 Ack=137 Win=43520 Len=8688 TSval=2165678218 TSecr=3655659543 [TCP segment of a reassembled PDU]"
"76","109.805840233","172.16.10.9","172.16.20.9","TCP","547","0.009799343","5004  >  39686 [PSH, ACK] Seq=186560 Ack=137 Win=43520 Len=481 TSval=2165678223 TSecr=3655659606 [TCP segment of a reassembled PDU]"
"78","109.962649046","172.16.10.9","172.16.20.9","TCP","10066","0.156561680","5004  >  39686 [PSH, ACK] Seq=187041 Ack=137 Win=43520 Len=10000 TSval=2165678398 TSecr=3655659630 [TCP segment of a reassembled PDU]"
"80","109.971942258","172.16.10.9","172.16.20.9","TCP","7306","0.009084212","5004  >  39686 [PSH, ACK] Seq=197041 Ack=137 Win=43520 Len=7240 TSval=2165678399 TSecr=3655659630 [TCP segment of a reassembled PDU]"
"82","109.981461876","172.16.10.9","172.16.20.9","TCP","510","0.009493448","5004  >  39686 [PSH, ACK] Seq=204281 Ack=137 Win=43520 Len=444 TSval=2165678399 TSecr=3655659787 [TCP segment of a reassembled PDU]"
"84","110.005673740","172.16.10.9","172.16.20.9","TCP","3161","0.023289911","5004  >  39686 [PSH, ACK] Seq=204725 Ack=137 Win=43520 Len=3095 TSval=2165678441 TSecr=3655659806 [TCP segment of a reassembled PDU]"
"86","110.007589710","172.16.10.9","172.16.20.9","TCP","8754","0.001142903","5004  >  39686 [PSH, ACK] Seq=207820 Ack=137 Win=43520 Len=8688 TSval=2165678442 TSecr=3655659806 [TCP segment of a reassembled PDU]"
"88","110.016898275","172.16.10.9","172.16.20.9","TCP","1378","0.009080787","5004  >  39686 [PSH, ACK] Seq=216508 Ack=137 Win=43520 Len=1312 TSval=2165678442 TSecr=3655659830 [TCP segment of a reassembled PDU]"
"90","110.018522089","172.16.10.9","172.16.20.9","TCP","2962","0.001378336","5004  >  39686 [PSH, ACK] Seq=217820 Ack=137 Win=43520 Len=2896 TSval=2165678444 TSecr=3655659830 [TCP segment of a reassembled PDU]"
"92","110.021562477","172.16.10.9","172.16.20.9","TCP","1105","0.002795414","5004  >  39686 [PSH, ACK] Seq=220716 Ack=137 Win=43520 Len=1039 TSval=2165678453 TSecr=3655659841 [TCP segment of a reassembled PDU]"
"94","110.218348512","172.16.10.9","172.16.20.9","TCP","5169","0.196745501","5004  >  39686 [PSH, ACK] Seq=221755 Ack=137 Win=43520 Len=5103 TSval=2165678654 TSecr=3655659845 [TCP segment of a reassembled PDU]"
"96","110.281929418","172.16.10.9","172.16.20.9","TCP","10066","0.063467782","5004  >  39686 [PSH, ACK] Seq=226858 Ack=137 Win=43520 Len=10000 TSval=2165678718 TSecr=3655660042 [TCP segment of a reassembled PDU]"
"98","110.294648871","172.16.10.9","172.16.20.9","TCP","7992","0.012620299","5004  >  39686 [PSH, ACK] Seq=236858 Ack=137 Win=43520 Len=7926 TSval=2165678718 TSecr=3655660106 [TCP segment of a reassembled PDU]"
"100","110.469518307","172.16.10.9","172.16.20.9","TCP","10066","0.174845863","5004  >  39686 [PSH, ACK] Seq=244784 Ack=137 Win=43520 Len=10000 TSval=2165678905 TSecr=3655660119 [TCP segment of a reassembled PDU]"
"102","110.481618850","172.16.10.9","172.16.20.9","TCP","7306","0.012011271","5004  >  39686 [PSH, ACK] Seq=254784 Ack=137 Win=43520 Len=7240 TSval=2165678905 TSecr=3655660119 [TCP segment of a reassembled PDU]"
"104","110.488557987","172.16.10.9","172.16.20.9","TCP","1302","0.006915293","5004  >  39686 [PSH, ACK] Seq=262024 Ack=137 Win=43520 Len=1236 TSval=2165678905 TSecr=3655660293 [TCP segment of a reassembled PDU]"
"106","110.534382274","172.16.10.9","172.16.20.9","TCP","1786","0.045756702","5004  >  39686 [PSH, ACK] Seq=263260 Ack=137 Win=43520 Len=1720 TSval=2165678970 TSecr=3655660312 [TCP segment of a reassembled PDU]"
"108","110.534822507","172.16.10.9","172.16.20.9","TCP","10066","0.000424819","5004  >  39686 [PSH, ACK] Seq=264980 Ack=137 Win=43520 Len=10000 TSval=2165678970 TSecr=3655660358 [TCP segment of a reassembled PDU]"
"110","110.548809958","172.16.10.9","172.16.20.9","TCP","4410","0.013845725","5004  >  39686 [PSH, ACK] Seq=274980 Ack=137 Win=43520 Len=4344 TSval=2165678971 TSecr=3655660358 [TCP segment of a reassembled PDU]"
"112","110.552499502","172.16.10.9","172.16.20.9","TCP","1133","0.003646270","5004  >  39686 [PSH, ACK] Seq=279324 Ack=137 Win=43520 Len=1067 TSval=2165678971 TSecr=3655660359 [TCP segment of a reassembled PDU]"
"114","110.714743608","172.16.10.9","172.16.20.9","TCP","3806","0.162223190","5004  >  39686 [PSH, ACK] Seq=280391 Ack=137 Win=43520 Len=3740 TSval=2165679150 TSecr=3655660376 [TCP segment of a reassembled PDU]"
"116","110.717784574","172.16.10.9","172.16.20.9","TCP","1318","0.002736011","5004  >  39686 [PSH, ACK] Seq=284131 Ack=137 Win=43520 Len=1252 TSval=2165679151 TSecr=3655660539 [TCP segment of a reassembled PDU]"
"118","110.780651478","172.16.10.9","172.16.20.9","TCP","10066","0.062828911","5004  >  39686 [PSH, ACK] Seq=285383 Ack=137 Win=43520 Len=10000 TSval=2165679216 TSecr=3655660542 [TCP segment of a reassembled PDU]"
"120","110.791082494","172.16.10.9","172.16.20.9","TCP","8754","0.010015191","5004  >  39686 [PSH, ACK] Seq=295383 Ack=137 Win=43520 Len=8688 TSval=2165679217 TSecr=3655660542 [TCP segment of a reassembled PDU]"
"122","110.799019062","172.16.10.9","172.16.20.9","TCP","3250","0.007911966","5004  >  39686 [PSH, ACK] Seq=304071 Ack=137 Win=43520 Len=3184 TSval=2165679217 TSecr=3655660605 [TCP segment of a reassembled PDU]"
"124","110.953860813","172.16.10.9","172.16.20.9","TCP","2281","0.154819688","5004  >  39686 [PSH, ACK] Seq=307255 Ack=137 Win=43520 Len=2215 TSval=2165679390 TSecr=3655660623 [TCP segment of a reassembled PDU]"
"126","110.957188424","172.16.10.9","172.16.20.9","TCP","10066","0.003313743","5004  >  39686 [PSH, ACK] Seq=309470 Ack=137 Win=43520 Len=10000 TSval=2165679390 TSecr=3655660778 [TCP segment of a reassembled PDU]"
"128","110.968404129","172.16.10.9","172.16.20.9","TCP","4410","0.010818595","5004  >  39686 [PSH, ACK] Seq=319470 Ack=137 Win=43520 Len=4344 TSval=2165679393 TSecr=3655660778 [TCP segment of a reassembled PDU]"
"130","110.971643715","172.16.10.9","172.16.20.9","TCP","410","0.003216251","5004  >  39686 [PSH, ACK] Seq=323814 Ack=137 Win=43520 Len=344 TSval=2165679394 TSecr=3655660781 [TCP segment of a reassembled PDU]"
"132","111.023278744","172.16.10.9","172.16.20.9","TCP","2963","0.051612197","5004  >  39686 [PSH, ACK] Seq=324158 Ack=137 Win=43520 Len=2897 TSval=2165679459 TSecr=3655660796 [TCP segment of a reassembled PDU]"
"134","111.067487598","172.16.10.9","172.16.20.9","TCP","10066","0.043693754","5004  >  39686 [PSH, ACK] Seq=327055 Ack=137 Win=43520 Len=10000 TSval=2165679503 TSecr=3655660848 [TCP segment of a reassembled PDU]"
"136","111.076673357","172.16.10.9","172.16.20.9","TCP","2962","0.008817558","5004  >  39686 [PSH, ACK] Seq=337055 Ack=137 Win=43520 Len=2896 TSval=2165679503 TSecr=3655660848 [TCP segment of a reassembled PDU]"
"138","111.079734655","172.16.10.9","172.16.20.9","TCP","621","0.003037636","5004  >  39686 [PSH, ACK] Seq=339951 Ack=137 Win=43520 Len=555 TSval=2165679504 TSecr=3655660892 [TCP segment of a reassembled PDU]"
"140","111.222450659","172.16.10.9","172.16.20.9","TCP","4638","0.142667436","5004  >  39686 [PSH, ACK] Seq=340506 Ack=137 Win=43520 Len=4572 TSval=2165679658 TSecr=3655660904 [TCP segment of a reassembled PDU]"
"142","111.333098860","172.16.10.9","172.16.20.9","TCP","10066","0.108376372","5004  >  39686 [PSH, ACK] Seq=345078 Ack=137 Win=43520 Len=10000 TSval=2165679769 TSecr=3655661049 [TCP segment of a reassembled PDU]"
"144","111.346774483","172.16.10.9","172.16.20.9","TCP","5858","0.008440038","5004  >  39686 [PSH, ACK] Seq=355078 Ack=137 Win=43520 Len=5792 TSval=2165679770 TSecr=3655661049 [TCP segment of a reassembled PDU]"
"146","111.351206812","172.16.10.9","172.16.20.9","TCP","1243","0.004398907","5004  >  39686 [PSH, ACK] Seq=360870 Ack=137 Win=43520 Len=1177 TSval=2165679774 TSecr=3655661162 [TCP segment of a reassembled PDU]"
"148","111.473879640","172.16.10.9","172.16.20.9","TCP","10066","0.122130646","5004  >  39686 [PSH, ACK] Seq=362047 Ack=137 Win=43520 Len=10000 TSval=2165679910 TSecr=3655661176 [TCP segment of a reassembled PDU]"
"150","111.483122022","172.16.10.9","172.16.20.9","TCP","10066","0.009192733","5004  >  39686 [PSH, ACK] Seq=372047 Ack=137 Win=43520 Len=10000 TSval=2165679910 TSecr=3655661298 [TCP segment of a reassembled PDU]"
"152","111.493944435","172.16.10.9","172.16.20.9","TCP","488","0.010784170","5004  >  39686 [PSH, ACK] Seq=382047 Ack=137 Win=43520 Len=422 TSval=2165679919 TSecr=3655661307 [TCP segment of a reassembled PDU]"
"154","111.578370739","172.16.10.9","172.16.20.9","TCP","10066","0.083612734","5004  >  39686 [PSH, ACK] Seq=382469 Ack=137 Win=43520 Len=10000 TSval=2165680014 TSecr=3655661319 [TCP segment of a reassembled PDU]"
"156","111.587507726","172.16.10.9","172.16.20.9","TCP","5564","0.009089472","5004  >  39686 [PSH, ACK] Seq=392469 Ack=137 Win=43520 Len=5498 TSval=2165680014 TSecr=3655661402 [TCP segment of a reassembled PDU]"
"158","111.713137732","172.16.10.9","172.16.20.9","TCP","3410","0.125606602","5004  >  39686 [PSH, ACK] Seq=397967 Ack=137 Win=43520 Len=3344 TSval=2165680149 TSecr=3655661411 [TCP segment of a reassembled PDU]"
"160","111.715482529","172.16.10.9","172.16.20.9","TCP","1315","0.002327039","5004  >  39686 [PSH, ACK] Seq=401311 Ack=137 Win=43520 Len=1249 TSval=2165680149 TSecr=3655661537 [TCP segment of a reassembled PDU]"
"162","111.797901457","172.16.10.9","172.16.20.9","TCP","10066","0.082373093","5004  >  39686 [PSH, ACK] Seq=402560 Ack=137 Win=43520 Len=10000 TSval=2165680234 TSecr=3655661539 [TCP segment of a reassembled PDU]"
"164","111.809694286","172.16.10.9","172.16.20.9","TCP","8754","0.011414924","5004  >  39686 [PSH, ACK] Seq=412560 Ack=137 Win=43520 Len=8688 TSval=2165680234 TSecr=3655661539 [TCP segment of a reassembled PDU]"
"166","111.817834551","172.16.10.9","172.16.20.9","TCP","3328","0.008116559","5004  >  39686 [PSH, ACK] Seq=421248 Ack=137 Win=43520 Len=3262 TSval=2165680234 TSecr=3655661622 [TCP segment of a reassembled PDU]"
"168","111.963382348","172.16.10.9","172.16.20.9","TCP","10066","0.145525088","5004  >  39686 [PSH, ACK] Seq=424510 Ack=137 Win=43520 Len=10000 TSval=2165680399 TSecr=3655661642 [TCP segment of a reassembled PDU]"
"170","111.972916071","172.16.10.9","172.16.20.9","TCP","9072","0.009471423","5004  >  39686 [PSH, ACK] Seq=434510 Ack=137 Win=43520 Len=9006 TSval=2165680399 TSecr=3655661787 [TCP segment of a reassembled PDU]"
"172","112.004543997","172.16.10.9","172.16.20.9","TCP","1314","0.031605749","5004  >  39686 [PSH, ACK] Seq=443516 Ack=137 Win=43520 Len=1248 TSval=2165680440 TSecr=3655661797 [TCP segment of a reassembled PDU]"
"174","112.048856818","172.16.10.9","172.16.20.9","TCP","10066","0.044032480","5004  >  39686 [PSH, ACK] Seq=444764 Ack=137 Win=43520 Len=10000 TSval=2165680485 TSecr=3655661829 [TCP segment of a reassembled PDU]"
"176","112.058028912","172.16.10.9","172.16.20.9","TCP","2962","0.008901479","5004  >  39686 [PSH, ACK] Seq=454764 Ack=137 Win=43520 Len=2896 TSval=2165680485 TSecr=3655661829 [TCP segment of a reassembled PDU]"
"178","112.061192902","172.16.10.9","172.16.20.9","TCP","801","0.003138615","5004  >  39686 [PSH, ACK] Seq=457660 Ack=137 Win=43520 Len=735 TSval=2165680485 TSecr=3655661873 [TCP segment of a reassembled PDU]"
"180","112.216645105","172.16.10.9","172.16.20.9","TCP","1538","0.154634206","5004  >  39686 [PSH, ACK] Seq=458395 Ack=137 Win=43520 Len=1472 TSval=2165680652 TSecr=3655661886 [TCP segment of a reassembled PDU]"
"181","112.216775999","172.16.10.9","172.16.20.9","TCP","2962","0.000130894","5004  >  39686 [PSH, ACK] Seq=459867 Ack=137 Win=43520 Len=2896 TSval=2165680653 TSecr=3655661886 [TCP segment of a reassembled PDU]"
"183","112.220255902","172.16.10.9","172.16.20.9","TCP","719","0.003167777","5004  >  39686 [PSH, ACK] Seq=462763 Ack=137 Win=43520 Len=653 TSval=2165680653 TSecr=3655662041 [TCP segment of a reassembled PDU]"
"185","112.301974602","172.16.10.9","172.16.20.9","TCP","10066","0.081668264","5004  >  39686 [PSH, ACK] Seq=463416 Ack=137 Win=43520 Len=10000 TSval=2165680738 TSecr=3655662044 [TCP segment of a reassembled PDU]"
"187","112.314491546","172.16.10.9","172.16.20.9","TCP","5858","0.012169256","5004  >  39686 [PSH, ACK] Seq=473416 Ack=137 Win=43520 Len=5792 TSval=2165680738 TSecr=3655662044 [TCP segment of a reassembled PDU]"
"189","112.322369231","172.16.10.9","172.16.20.9","TCP","922","0.007854055","5004  >  39686 [PSH, ACK] Seq=479208 Ack=137 Win=43520 Len=856 TSval=2165680738 TSecr=3655662126 [TCP segment of a reassembled PDU]"
"191","112.470377204","172.16.10.9","172.16.20.9","TCP","1890","0.147603761","5004  >  39686 [PSH, ACK] Seq=480064 Ack=137 Win=43520 Len=1824 TSval=2165680906 TSecr=3655662147 [TCP segment of a reassembled PDU]"
"192","112.472037032","172.16.10.9","172.16.20.9","TCP","8754","0.001659828","5004  >  39686 [PSH, ACK] Seq=481888 Ack=137 Win=43520 Len=8688 TSval=2165680906 TSecr=3655662147 [TCP segment of a reassembled PDU]"
"194","112.479948533","172.16.10.9","172.16.20.9","TCP","5858","0.002045700","5004  >  39686 [PSH, ACK] Seq=490576 Ack=137 Win=43520 Len=5792 TSval=2165680908 TSecr=3655662147 [TCP segment of a reassembled PDU]"
"196","112.486087601","172.16.10.9","172.16.20.9","TCP","327","0.006118145","5004  >  39686 [PSH, ACK] Seq=496368 Ack=137 Win=43520 Len=261 TSval=2165680914 TSecr=3655662301 [TCP segment of a reassembled PDU]"
"198","112.511149971","172.16.10.9","172.16.20.9","TCP","3226","0.025038531","5004  >  39686 [PSH, ACK] Seq=496629 Ack=137 Win=43520 Len=3160 TSval=2165680947 TSecr=3655662310 [TCP segment of a reassembled PDU]"
"200","112.603041308","172.16.10.9","172.16.20.9","TCP","10066","0.090546154","5004  >  39686 [PSH, ACK] Seq=499789 Ack=137 Win=43520 Len=10000 TSval=2165681039 TSecr=3655662336 [TCP segment of a reassembled PDU]"
"202","112.612625026","172.16.10.9","172.16.20.9","TCP","4410","0.009248111","5004  >  39686 [PSH, ACK] Seq=509789 Ack=137 Win=43520 Len=4344 TSval=2165681039 TSecr=3655662336 [TCP segment of a reassembled PDU]"
"204","112.616687174","172.16.10.9","172.16.20.9","TCP","705","0.004038864","5004  >  39686 [PSH, ACK] Seq=514133 Ack=137 Win=43520 Len=639 TSval=2165681039 TSecr=3655662427 [TCP segment of a reassembled PDU]"
"206","112.719194798","172.16.10.9","172.16.20.9","TCP","3255","0.102247410","5004  >  39686 [PSH, ACK] Seq=514772 Ack=137 Win=43520 Len=3189 TSval=2165681155 TSecr=3655662441 [TCP segment of a reassembled PDU]"
"208","112.726748961","172.16.10.9","172.16.20.9","TCP","1514","0.007300442","5004  >  39686 [ACK] Seq=517961 Ack=137 Win=43520 Len=1448 TSval=2165681155 TSecr=3655662441 [TCP segment of a reassembled PDU]"
"209","112.727367164","172.16.10.9","172.16.20.9","TCP","268","0.000618203","5004  >  39686 [PSH, ACK] Seq=519409 Ack=137 Win=43520 Len=202 TSval=2165681155 TSecr=3655662543 [TCP segment of a reassembled PDU]"
"211","112.862849339","172.16.10.9","172.16.20.9","TCP","10066","0.135468994","5004  >  39686 [PSH, ACK] Seq=519611 Ack=137 Win=43520 Len=10000 TSval=2165681299 TSecr=3655662551 [TCP segment of a reassembled PDU]"
"212","112.872322420","172.16.10.9","172.16.20.9","TCP","5858","0.009473081","5004  >  39686 [PSH, ACK] Seq=529611 Ack=137 Win=43520 Len=5792 TSval=2165681299 TSecr=3655662551 [TCP segment of a reassembled PDU]"
"214","112.877873340","172.16.10.9","172.16.20.9","TCP","1424","0.005414368","5004  >  39686 [PSH, ACK] Seq=535403 Ack=137 Win=43520 Len=1358 TSval=2165681308 TSecr=3655662696 [TCP segment of a reassembled PDU]"
"216","112.906121125","172.16.10.9","172.16.20.9","TCP","3779","0.028199277","5004  >  39686 [PSH, ACK] Seq=536761 Ack=137 Win=43520 Len=3713 TSval=2165681342 TSecr=3655662702 [TCP segment of a reassembled PDU]"
"218","112.949884483","172.16.10.9","172.16.20.9","TCP","1814","0.043448013","5004  >  39686 [PSH, ACK] Seq=540474 Ack=137 Win=43520 Len=1748 TSval=2165681386 TSecr=3655662730 [TCP segment of a reassembled PDU]"
"220","112.950365212","172.16.10.9","172.16.20.9","TCP","10066","0.000465618","5004  >  39686 [PSH, ACK] Seq=542222 Ack=137 Win=43520 Len=10000 TSval=2165681386 TSecr=3655662774 [TCP segment of a reassembled PDU]"
"222","112.961852523","172.16.10.9","172.16.20.9","TCP","1514","0.011070530","5004  >  39686 [ACK] Seq=552222 Ack=137 Win=43520 Len=1448 TSval=2165681386 TSecr=3655662774 [TCP segment of a reassembled PDU]"
"223","112.962928237","172.16.10.9","172.16.20.9","TCP","1410","0.001075714","5004  >  39686 [PSH, ACK] Seq=553670 Ack=137 Win=43520 Len=1344 TSval=2165681387 TSecr=3655662775 [TCP segment of a reassembled PDU]"
"225","112.993852044","172.16.10.9","172.16.20.9","TCP","4609","0.030905613","5004  >  39686 [PSH, ACK] Seq=555014 Ack=137 Win=43520 Len=4543 TSval=2165681430 TSecr=3655662787 [TCP segment of a reassembled PDU]"
"227","113.038990010","172.16.10.9","172.16.20.9","TCP","10066","0.044515329","5004  >  39686 [PSH, ACK] Seq=559557 Ack=137 Win=43520 Len=10000 TSval=2165681475 TSecr=3655662818 [TCP segment of a reassembled PDU]"
"229","113.050388452","172.16.10.9","172.16.20.9","TCP","3505","0.010827260","5004  >  39686 [PSH, ACK] Seq=569557 Ack=137 Win=43520 Len=3439 TSval=2165681476 TSecr=3655662863 [TCP segment of a reassembled PDU]"
"231","113.216926965","172.16.10.9","172.16.20.9","TCP","5067","0.166505299","5004  >  39686 [PSH, ACK] Seq=572996 Ack=137 Win=43520 Len=5001 TSval=2165681653 TSecr=3655662874 [TCP segment of a reassembled PDU]"
"233","113.298635419","172.16.10.9","172.16.20.9","TCP","10066","0.081654062","5004  >  39686 [PSH, ACK] Seq=577997 Ack=137 Win=43520 Len=10000 TSval=2165681734 TSecr=3655663041 [TCP segment of a reassembled PDU]"
"235","113.308028656","172.16.10.9","172.16.20.9","TCP","4410","0.009115162","5004  >  39686 [PSH, ACK] Seq=587997 Ack=137 Win=43520 Len=4344 TSval=2165681735 TSecr=3655663041 [TCP segment of a reassembled PDU]"
"237","113.316084374","172.16.10.9","172.16.20.9","TCP","419","0.008032249","5004  >  39686 [PSH, ACK] Seq=592341 Ack=137 Win=43520 Len=353 TSval=2165681735 TSecr=3655663123 [TCP segment of a reassembled PDU]"
"239","113.363933714","172.16.10.9","172.16.20.9","TCP","1827","0.047794866","5004  >  39686 [PSH, ACK] Seq=592694 Ack=137 Win=43520 Len=1761 TSval=2165681800 TSecr=3655663140 [TCP segment of a reassembled PDU]"
"241","113.468394982","172.16.10.9","172.16.20.9","TCP","10066","0.104405782","5004  >  39686 [PSH, ACK] Seq=594455 Ack=137 Win=43520 Len=10000 TSval=2165681904 TSecr=3655663188 [TCP segment of a reassembled PDU]"
"243","113.478114962","172.16.10.9","172.16.20.9","TCP","6174","0.009257641","5004  >  39686 [PSH, ACK] Seq=604455 Ack=137 Win=43520 Len=6108 TSval=2165681905 TSecr=3655663293 [TCP segment of a reassembled PDU]"
"245","113.510060505","172.16.10.9","172.16.20.9","TCP","3611","0.031923796","5004  >  39686 [PSH, ACK] Seq=610563 Ack=137 Win=43520 Len=3545 TSval=2165681946 TSecr=3655663302 [TCP segment of a reassembled PDU]"
"247","113.554114762","172.16.10.9","172.16.20.9","TCP","10066","0.044033333","5004  >  39686 [PSH, ACK] Seq=614108 Ack=137 Win=43520 Len=10000 TSval=2165681990 TSecr=3655663334 [TCP segment of a reassembled PDU]"
"249","113.566372332","172.16.10.9","172.16.20.9","TCP","2962","0.012005274","5004  >  39686 [PSH, ACK] Seq=624108 Ack=137 Win=43520 Len=2896 TSval=2165681990 TSecr=3655663334 [TCP segment of a reassembled PDU]"
"251","113.569863221","172.16.10.9","172.16.20.9","TCP","915","0.003465436","5004  >  39686 [PSH, ACK] Seq=627004 Ack=137 Win=43520 Len=849 TSval=2165681990 TSecr=3655663378 [TCP segment of a reassembled PDU]"
"253","113.706249683","172.16.10.9","172.16.20.9","TCP","2061","0.136093067","5004  >  39686 [PSH, ACK] Seq=627853 Ack=137 Win=43520 Len=1995 TSval=2165682142 TSecr=3655663394 [TCP segment of a reassembled PDU]"
"255","113.708291892","172.16.10.9","172.16.20.9","TCP","2962","0.001992634","5004  >  39686 [PSH, ACK] Seq=629848 Ack=137 Win=43520 Len=2896 TSval=2165682142 TSecr=3655663394 [TCP segment of a reassembled PDU]"
"257","113.710044624","172.16.10.9","172.16.20.9","TCP","182","0.001582293","5004  >  39686 [PSH, ACK] Seq=632744 Ack=137 Win=43520 Len=116 TSval=2165682142 TSecr=3655663530 [TCP segment of a reassembled PDU]"
"259","113.815330509","172.16.10.9","172.16.20.9","TCP","10066","0.105129314","5004  >  39686 [PSH, ACK] Seq=632860 Ack=137 Win=43520 Len=10000 TSval=2165682251 TSecr=3655663534 [TCP segment of a reassembled PDU]"
"261","113.830101958","172.16.10.9","172.16.20.9","TCP","8754","0.014675554","5004  >  39686 [PSH, ACK] Seq=642860 Ack=137 Win=43520 Len=8688 TSval=2165682251 TSecr=3655663534 [TCP segment of a reassembled PDU]"
"263","113.838289174","172.16.10.9","172.16.20.9","TCP","2455","0.008169110","5004  >  39686 [PSH, ACK] Seq=651548 Ack=137 Win=43520 Len=2389 TSval=2165682251 TSecr=3655663639 [TCP segment of a reassembled PDU]"
"265","113.951002149","172.16.10.9","172.16.20.9","TCP","1431","0.112680597","5004  >  39686 [PSH, ACK] Seq=653937 Ack=137 Win=43520 Len=1365 TSval=2165682387 TSecr=3655663662 [TCP segment of a reassembled PDU]"
"266","113.951137236","172.16.10.9","172.16.20.9","TCP","8754","0.000135087","5004  >  39686 [PSH, ACK] Seq=655302 Ack=137 Win=43520 Len=8688 TSval=2165682387 TSecr=3655663662 [TCP segment of a reassembled PDU]"
"268","113.964462007","172.16.10.9","172.16.20.9","TCP","4410","0.009683806","5004  >  39686 [PSH, ACK] Seq=663990 Ack=137 Win=43520 Len=4344 TSval=2165682387 TSecr=3655663662 [TCP segment of a reassembled PDU]"
"270","113.967712779","172.16.10.9","172.16.20.9","TCP","1355","0.003219348","5004  >  39686 [PSH, ACK] Seq=668334 Ack=137 Win=43520 Len=1289 TSval=2165682391 TSecr=3655663778 [TCP segment of a reassembled PDU]"
"272","113.993424234","172.16.10.9","172.16.20.9","TCP","2994","0.025211893","5004  >  39686 [PSH, ACK] Seq=669623 Ack=137 Win=43520 Len=2928 TSval=2165682429 TSecr=3655663792 [TCP segment of a reassembled PDU]"
"274","114.036424645","172.16.10.9","172.16.20.9","TCP","10066","0.042766358","5004  >  39686 [PSH, ACK] Seq=672551 Ack=137 Win=43520 Len=10000 TSval=2165682472 TSecr=3655663818 [TCP segment of a reassembled PDU]"
"276","114.046405483","172.16.10.9","172.16.20.9","TCP","1514","0.009490562","5004  >  39686 [ACK] Seq=682551 Ack=137 Win=43520 Len=1448 TSval=2165682472 TSecr=3655663818 [TCP segment of a reassembled PDU]"
"277","114.048259349","172.16.10.9","172.16.20.9","TCP","465","0.001853866","5004  >  39686 [PSH, ACK] Seq=683999 Ack=137 Win=43520 Len=399 TSval=2165682473 TSecr=3655663861 [TCP segment of a reassembled PDU]"
"279","114.208753424","172.16.10.9","172.16.20.9","TCP","4951","0.160470584","5004  >  39686 [PSH, ACK] Seq=684398 Ack=137 Win=43520 Len=4885 TSval=2165682645 TSecr=3655663872 [TCP segment of a reassembled PDU]"
"281","114.278120486","172.16.10.9","172.16.20.9","TCP","10066","0.068923513","5004  >  39686 [PSH, ACK] Seq=689283 Ack=137 Win=43520 Len=10000 TSval=2165682714 TSecr=3655664033 [TCP segment of a reassembled PDU]"
"283","114.299001222","172.16.10.9","172.16.20.9","TCP","4410","0.020577879","5004  >  39686 [PSH, ACK] Seq=699283 Ack=137 Win=43520 Len=4344 TSval=2165682714 TSecr=3655664033 [TCP segment of a reassembled PDU]"
"285","114.312535523","172.16.10.9","172.16.20.9","TCP","1440","0.013510726","5004  >  39686 [PSH, ACK] Seq=703627 Ack=137 Win=43520 Len=1374 TSval=2165682714 TSecr=3655664102 [TCP segment of a reassembled PDU]"
"287","114.461954552","172.16.10.9","172.16.20.9","TCP","7306","0.147784854","5004  >  39686 [PSH, ACK] Seq=705001 Ack=137 Win=43520 Len=7240 TSval=2165682898 TSecr=3655664138 [TCP segment of a reassembled PDU]"
"289","114.468761984","172.16.10.9","172.16.20.9","TCP","2826","0.006526066","5004  >  39686 [PSH, ACK] Seq=712241 Ack=137 Win=43520 Len=2760 TSval=2165682898 TSecr=3655664138 [TCP segment of a reassembled PDU]"
"291","114.472721308","172.16.10.9","172.16.20.9","TCP","7306","0.003935638","5004  >  39686 [PSH, ACK] Seq=715001 Ack=137 Win=43520 Len=7240 TSval=2165682898 TSecr=3655664138 [TCP segment of a reassembled PDU]"
"293","114.481220182","172.16.10.9","172.16.20.9","TCP","315","0.007976010","5004  >  39686 [PSH, ACK] Seq=722241 Ack=137 Win=43520 Len=249 TSval=2165682905 TSecr=3655664293 [TCP segment of a reassembled PDU]"
"295","114.502626960","172.16.10.9","172.16.20.9","TCP","1811","0.021383875","5004  >  39686 [PSH, ACK] Seq=722490 Ack=137 Win=43520 Len=1745 TSval=2165682938 TSecr=3655664305 [TCP segment of a reassembled PDU]"
"297","114.550768853","172.16.10.9","172.16.20.9","TCP","10066","0.047504242","5004  >  39686 [PSH, ACK] Seq=724235 Ack=137 Win=43520 Len=10000 TSval=2165682987 TSecr=3655664327 [TCP segment of a reassembled PDU]"
"299","114.563332218","172.16.10.9","172.16.20.9","TCP","4410","0.012118963","5004  >  39686 [PSH, ACK] Seq=734235 Ack=137 Win=43520 Len=4344 TSval=2165682987 TSecr=3655664327 [TCP segment of a reassembled PDU]"
"301","114.572076780","172.16.10.9","172.16.20.9","TCP","334","0.008725457","5004  >  39686 [PSH, ACK] Seq=738579 Ack=137 Win=43520 Len=268 TSval=2165682987 TSecr=3655664375 [TCP segment of a reassembled PDU]"
"303","114.706199675","172.16.10.9","172.16.20.9","TCP","2173","0.133745873","5004  >  39686 [PSH, ACK] Seq=738847 Ack=137 Win=43520 Len=2107 TSval=2165683142 TSecr=3655664396 [TCP segment of a reassembled PDU]"
"305","114.706950427","172.16.10.9","172.16.20.9","TCP","2962","0.000354895","5004  >  39686 [PSH, ACK] Seq=740954 Ack=137 Win=43520 Len=2896 TSval=2165683142 TSecr=3655664396 [TCP segment of a reassembled PDU]"
"307","114.710490882","172.16.10.9","172.16.20.9","TCP","168","0.003442108","5004  >  39686 [PSH, ACK] Seq=743850 Ack=137 Win=43520 Len=102 TSval=2165683142 TSecr=3655664530 [TCP segment of a reassembled PDU]"
"309","114.793380458","172.16.10.9","172.16.20.9","TCP","10066","0.082690901","5004  >  39686 [PSH, ACK] Seq=743952 Ack=137 Win=43520 Len=10000 TSval=2165683229 TSecr=3655664535 [TCP segment of a reassembled PDU]"
"311","114.802430547","172.16.10.9","172.16.20.9","TCP","8754","0.008503013","5004  >  39686 [PSH, ACK] Seq=753952 Ack=137 Win=43520 Len=8688 TSval=2165683229 TSecr=3655664535 [TCP segment of a reassembled PDU]"
"313","114.812499274","172.16.10.9","172.16.20.9","TCP","2596","0.010045493","5004  >  39686 [PSH, ACK] Seq=762640 Ack=137 Win=43520 Len=2530 TSval=2165683230 TSecr=3655664618 [TCP segment of a reassembled PDU]"
"315","114.974614576","172.16.10.9","172.16.20.9","TCP","10066","0.162085803","5004  >  39686 [PSH, ACK] Seq=765170 Ack=137 Win=43520 Len=10000 TSval=2165683410 TSecr=3655664636 [TCP segment of a reassembled PDU]"
"317","114.983580339","172.16.10.9","172.16.20.9","TCP","9859","0.008916658","5004  >  39686 [PSH, ACK] Seq=775170 Ack=137 Win=43520 Len=9793 TSval=2165683412 TSecr=3655664799 [TCP segment of a reassembled PDU]"
"319","115.037064359","172.16.10.9","172.16.20.9","TCP","10066","0.053449747","5004  >  39686 [PSH, ACK] Seq=784963 Ack=137 Win=43520 Len=10000 TSval=2165683473 TSecr=3655664807 [TCP segment of a reassembled PDU]"
"321","115.050345523","172.16.10.9","172.16.20.9","TCP","3568","0.012864203","5004  >  39686 [PSH, ACK] Seq=794963 Ack=137 Win=43520 Len=3502 TSval=2165683474 TSecr=3655664861 [TCP segment of a reassembled PDU]"
"323","115.216712442","172.16.10.9","172.16.20.9","TCP","4905","0.166345786","5004  >  39686 [PSH, ACK] Seq=798465 Ack=137 Win=43520 Len=4839 TSval=2165683653 TSecr=3655664874 [TCP segment of a reassembled PDU]"
"325","115.277575685","172.16.10.9","172.16.20.9","TCP","10066","0.059958392","5004  >  39686 [PSH, ACK] Seq=803304 Ack=137 Win=43520 Len=10000 TSval=2165683713 TSecr=3655665041 [TCP segment of a reassembled PDU]"
"327","115.286833685","172.16.10.9","172.16.20.9","TCP","5858","0.007304800","5004  >  39686 [PSH, ACK] Seq=813304 Ack=137 Win=43520 Len=5792 TSval=2165683714 TSecr=3655665041 [TCP segment of a reassembled PDU]"
"329","115.292743843","172.16.10.9","172.16.20.9","TCP","259","0.005879132","5004  >  39686 [PSH, ACK] Seq=819096 Ack=137 Win=43520 Len=193 TSval=2165683715 TSecr=3655665103 [TCP segment of a reassembled PDU]"
"331","115.480451610","172.16.10.9","172.16.20.9","TCP","10066","0.187687179","5004  >  39686 [PSH, ACK] Seq=819289 Ack=137 Win=43520 Len=10000 TSval=2165683916 TSecr=3655665117 [TCP segment of a reassembled PDU]"
"333","115.490166033","172.16.10.9","172.16.20.9","TCP","7306","0.000108368","5004  >  39686 [PSH, ACK] Seq=829289 Ack=137 Win=43520 Len=7240 TSval=2165683916 TSecr=3655665117 [TCP segment of a reassembled PDU]"
"335","115.499412207","172.16.10.9","172.16.20.9","TCP","1081","0.009003784","5004  >  39686 [PSH, ACK] Seq=836529 Ack=137 Win=43520 Len=1015 TSval=2165683926 TSecr=3655665314 [TCP segment of a reassembled PDU]"
"337","115.529349760","172.16.10.9","172.16.20.9","TCP","10066","0.029878546","5004  >  39686 [PSH, ACK] Seq=837544 Ack=137 Win=43520 Len=10000 TSval=2165683965 TSecr=3655665323 [TCP segment of a reassembled PDU]"
"339","115.543470177","172.16.10.9","172.16.20.9","TCP","2962","0.013667806","5004  >  39686 [PSH, ACK] Seq=847544 Ack=137 Win=43520 Len=2896 TSval=2165683965 TSecr=3655665323 [TCP segment of a reassembled PDU]"
"341","115.545037966","172.16.10.9","172.16.20.9","TCP","209","0.001544185","5004  >  39686 [PSH, ACK] Seq=850440 Ack=137 Win=43520 Len=143 TSval=2165683966 TSecr=3655665354 [TCP segment of a reassembled PDU]"
"343","115.739651105","172.16.10.9","172.16.20.9","TCP","4205","0.194602834","5004  >  39686 [PSH, ACK] Seq=850583 Ack=137 Win=43520 Len=4139 TSval=2165684175 TSecr=3655665369 [TCP segment of a reassembled PDU]"
"345","115.782346748","172.16.10.9","172.16.20.9","TCP","10066","0.042649605","5004  >  39686 [PSH, ACK] Seq=854722 Ack=137 Win=43520 Len=10000 TSval=2165684218 TSecr=3655665564 [TCP segment of a reassembled PDU]"
"347","115.797840143","172.16.10.9","172.16.20.9","TCP","10066","0.015444432","5004  >  39686 [PSH, ACK] Seq=864722 Ack=137 Win=43520 Len=10000 TSval=2165684218 TSecr=3655665606 [TCP segment of a reassembled PDU]"
"349","115.808987690","172.16.10.9","172.16.20.9","TCP","286","0.011125317","5004  >  39686 [PSH, ACK] Seq=874722 Ack=137 Win=43520 Len=220 TSval=2165684234 TSecr=3655665622 [TCP segment of a reassembled PDU]"
"351","115.962826100","172.16.10.9","172.16.20.9","TCP","10066","0.153782576","5004  >  39686 [PSH, ACK] Seq=874942 Ack=137 Win=43520 Len=10000 TSval=2165684399 TSecr=3655665633 [TCP segment of a reassembled PDU]"
"353","115.972349157","172.16.10.9","172.16.20.9","TCP","6221","0.009468131","5004  >  39686 [PSH, ACK] Seq=884942 Ack=137 Win=43520 Len=6155 TSval=2165684399 TSecr=3655665787 [TCP segment of a reassembled PDU]"
"355","116.011289711","172.16.10.9","172.16.20.9","TCP","1245","0.038913942","5004  >  39686 [PSH, ACK] Seq=891097 Ack=137 Win=43520 Len=1179 TSval=2165684447 TSecr=3655665796 [TCP segment of a reassembled PDU]"
"357","116.058209737","172.16.10.9","172.16.20.9","TCP","10066","0.046871796","5004  >  39686 [PSH, ACK] Seq=892276 Ack=137 Win=43520 Len=10000 TSval=2165684494 TSecr=3655665835 [TCP segment of a reassembled PDU]"
"359","116.068075055","172.16.10.9","172.16.20.9","TCP","1498","0.009816605","5004  >  39686 [PSH, ACK] Seq=902276 Ack=137 Win=43520 Len=1432 TSval=2165684494 TSecr=3655665882 [TCP segment of a reassembled PDU]"
"361","116.216473756","172.16.10.9","172.16.20.9","TCP","1378","0.148350432","5004  >  39686 [PSH, ACK] Seq=903708 Ack=137 Win=43520 Len=1312 TSval=2165684652 TSecr=3655665892 [TCP segment of a reassembled PDU]"
"362","116.216542551","172.16.10.9","172.16.20.9","TCP","2962","0.000068795","5004  >  39686 [PSH, ACK] Seq=905020 Ack=137 Win=43520 Len=2896 TSval=2165684652 TSecr=3655665892 [TCP segment of a reassembled PDU]"
"364","116.219786927","172.16.10.9","172.16.20.9","TCP","280","0.002891478","5004  >  39686 [PSH, ACK] Seq=907916 Ack=137 Win=43520 Len=214 TSval=2165684653 TSecr=3655666041 [TCP segment of a reassembled PDU]"
"366","116.282807789","172.16.10.9","172.16.20.9","TCP","10066","0.062964313","5004  >  39686 [PSH, ACK] Seq=908130 Ack=137 Win=43520 Len=10000 TSval=2165684719 TSecr=3655666044 [TCP segment of a reassembled PDU]"
"368","116.292656239","172.16.10.9","172.16.20.9","TCP","2962","0.009502168","5004  >  39686 [PSH, ACK] Seq=918130 Ack=137 Win=43520 Len=2896 TSval=2165684719 TSecr=3655666044 [TCP segment of a reassembled PDU]"
"370","116.295252470","172.16.10.9","172.16.20.9","TCP","881","0.002573782","5004  >  39686 [PSH, ACK] Seq=921026 Ack=137 Win=43520 Len=815 TSval=2165684719 TSecr=3655666107 [TCP segment of a reassembled PDU]"
"372","116.453878232","172.16.10.9","172.16.20.9","TCP","1661","0.158066453","5004  >  39686 [PSH, ACK] Seq=921841 Ack=137 Win=43520 Len=1595 TSval=2165684890 TSecr=3655666120 [TCP segment of a reassembled PDU]"
"374","116.461636151","172.16.10.9","172.16.20.9","TCP","10066","0.007371093","5004  >  39686 [PSH, ACK] Seq=923436 Ack=137 Win=43520 Len=10000 TSval=2165684897 TSecr=3655666278 [TCP segment of a reassembled PDU]"
"376","116.470600884","172.16.10.9","172.16.20.9","TCP","2962","0.008201275","5004  >  39686 [PSH, ACK] Seq=933436 Ack=137 Win=43520 Len=2896 TSval=2165684898 TSecr=3655666278 [TCP segment of a reassembled PDU]"
"378","116.474532103","172.16.10.9","172.16.20.9","TCP","1451","0.003911248","5004  >  39686 [PSH, ACK] Seq=936332 Ack=137 Win=43520 Len=1385 TSval=2165684898 TSecr=3655666286 [TCP segment of a reassembled PDU]"
"380","116.507653707","172.16.10.9","172.16.20.9","TCP","1228","0.032772081","5004  >  39686 [PSH, ACK] Seq=937717 Ack=137 Win=43520 Len=1162 TSval=2165684943 TSecr=3655666299 [TCP segment of a reassembled PDU]"
