"No.","Time","Source","Destination","Protocol","Length","Time delta from previous captured frame","Info"
"11","0.020689325","172.16.20.1","172.16.20.9","TCP","2962","0.000000881","5004  >  54680 [PSH, ACK] Seq=1 Ack=1 Win=85 Len=2896 TSval=2122170931 TSecr=3181267799"
"15","0.028018589","172.16.20.1","172.16.20.9","TCP","2962","0.000000580","5004  >  54680 [PSH, ACK] Seq=2897 Ack=1 Win=85 Len=2896 TSval=2122170937 TSecr=3181267805"
"61","0.133356441","172.16.20.1","172.16.20.9","TCP","2962","0.010008584","5004  >  54680 [PSH, ACK] Seq=5793 Ack=1 Win=85 Len=2896 TSval=2122171035 TSecr=3181267903"
"65","0.138651451","172.16.20.1","172.16.20.9","TCP","2962","0.002267844","5004  >  54680 [PSH, ACK] Seq=8689 Ack=1 Win=85 Len=2896 TSval=2122171043 TSecr=3181267911"
"112","0.227884440","172.16.20.1","172.16.20.9","TCP","2962","0.003347343","5004  >  54680 [PSH, ACK] Seq=11585 Ack=1 Win=85 Len=2896 TSval=2122171147 TSecr=3181268015"
"116","0.232962464","172.16.20.1","172.16.20.9","TCP","2962","0.001883174","5004  >  54680 [PSH, ACK] Seq=14481 Ack=1 Win=85 Len=2896 TSval=2122171152 TSecr=3181268020"
"163","0.331958684","172.16.20.1","172.16.20.9","TCP","2962","0.000053489","5004  >  54680 [PSH, ACK] Seq=17377 Ack=1 Win=85 Len=2896 TSval=2122171242 TSecr=3181268110"
"167","0.338155870","172.16.20.1","172.16.20.9","TCP","2962","0.001563873","5004  >  54680 [PSH, ACK] Seq=20273 Ack=1 Win=85 Len=2896 TSval=2122171249 TSecr=3181268115"
"213","0.407708502","172.16.20.1","172.16.20.9","TCP","2962","0.000860625","5004  >  54680 [PSH, ACK] Seq=23169 Ack=1 Win=85 Len=2896 TSval=2122171346 TSecr=3181268214"
"218","0.419616601","172.16.20.1","172.16.20.9","TCP","2962","0.001511698","5004  >  54680 [PSH, ACK] Seq=26065 Ack=1 Win=85 Len=2896 TSval=2122171352 TSecr=3181268220"
"264","0.491548529","172.16.20.1","172.16.20.9","TCP","2962","0.001393359","5004  >  54680 [PSH, ACK] Seq=28961 Ack=1 Win=85 Len=2896 TSval=2122171422 TSecr=3181268290"
"269","0.501513451","172.16.20.1","172.16.20.9","TCP","2962","0.001506671","5004  >  54680 [PSH, ACK] Seq=31857 Ack=1 Win=85 Len=2896 TSval=2122171433 TSecr=3181268301"
"314","0.577327081","172.16.20.1","172.16.20.9","TCP","2962","0.001771852","5004  >  54680 [PSH, ACK] Seq=34753 Ack=1 Win=85 Len=2896 TSval=2122171506 TSecr=3181268373"
"320","0.586112166","172.16.20.1","172.16.20.9","TCP","2962","0.000916625","5004  >  54680 [PSH, ACK] Seq=37649 Ack=1 Win=85 Len=2896 TSval=2122171515 TSecr=3181268383"
"365","0.656145572","172.16.20.1","172.16.20.9","TCP","2962","0.001674075","5004  >  54680 [PSH, ACK] Seq=40545 Ack=1 Win=85 Len=2896 TSval=2122171591 TSecr=3181268459"
"371","0.666807622","172.16.20.1","172.16.20.9","TCP","2962","0.000000414","5004  >  54680 [PSH, ACK] Seq=43441 Ack=1 Win=85 Len=2896 TSval=2122171600 TSecr=3181268468"
"416","0.759826497","172.16.20.1","172.16.20.9","TCP","2962","0.007970938","5004  >  54680 [PSH, ACK] Seq=46337 Ack=1 Win=85 Len=2896 TSval=2122171673 TSecr=3181268541"
"421","0.765854778","172.16.20.1","172.16.20.9","TCP","2962","0.001500553","5004  >  54680 [PSH, ACK] Seq=49233 Ack=1 Win=85 Len=2896 TSval=2122171681 TSecr=3181268549"
"467","0.836427845","172.16.20.1","172.16.20.9","TCP","2962","0.001479350","5004  >  54680 [PSH, ACK] Seq=52129 Ack=1 Win=85 Len=2896 TSval=2122171774 TSecr=3181268642"
"472","0.843779282","172.16.20.1","172.16.20.9","TCP","2962","0.000858735","5004  >  54680 [PSH, ACK] Seq=55025 Ack=1 Win=85 Len=2896 TSval=2122171780 TSecr=3181268648"
"518","0.917120483","172.16.20.1","172.16.20.9","TCP","2962","0.000982067","5004  >  54680 [PSH, ACK] Seq=57921 Ack=1 Win=85 Len=2896 TSval=2122171850 TSecr=3181268718"
"523","0.924498547","172.16.20.1","172.16.20.9","TCP","2962","0.001257823","5004  >  54680 [PSH, ACK] Seq=60817 Ack=1 Win=85 Len=2896 TSval=2122171858 TSecr=3181268726"
"569","0.999808716","172.16.20.1","172.16.20.9","TCP","2962","0.001744019","5004  >  54680 [PSH, ACK] Seq=63713 Ack=1 Win=85 Len=2896 TSval=2122171931 TSecr=3181268799"
"574","1.006959184","172.16.20.1","172.16.20.9","TCP","2962","0.001026870","5004  >  54680 [PSH, ACK] Seq=66609 Ack=1 Win=85 Len=2896 TSval=2122171938 TSecr=3181268806"
"620","1.101086105","172.16.20.1","172.16.20.9","TCP","2962","0.008200396","5004  >  54680 [PSH, ACK] Seq=69505 Ack=1 Win=85 Len=2896 TSval=2122172014 TSecr=3181268882"
"625","1.108074124","172.16.20.1","172.16.20.9","TCP","2962","0.000000220","5004  >  54680 [PSH, ACK] Seq=72401 Ack=1 Win=85 Len=2896 TSval=2122172021 TSecr=3181268889"
"670","1.185125888","172.16.20.1","172.16.20.9","TCP","2962","0.001415448","5004  >  54680 [PSH, ACK] Seq=75297 Ack=1 Win=85 Len=2896 TSval=2122172115 TSecr=3181268983"
"675","1.192961636","172.16.20.1","172.16.20.9","TCP","2962","0.001182009","5004  >  54680 [PSH, ACK] Seq=78193 Ack=1 Win=85 Len=2896 TSval=2122172122 TSecr=3181268990"
"721","1.266107605","172.16.20.1","172.16.20.9","TCP","2962","0.000000277","5004  >  54680 [PSH, ACK] Seq=81089 Ack=1 Win=85 Len=2896 TSval=2122172199 TSecr=3181269067"
"726","1.274204473","172.16.20.1","172.16.20.9","TCP","2962","0.001414324","5004  >  54680 [PSH, ACK] Seq=83985 Ack=1 Win=85 Len=2896 TSval=2122172207 TSecr=3181269075"
"771","1.358575338","172.16.20.1","172.16.20.9","TCP","2962","0.002368513","5004  >  54680 [PSH, ACK] Seq=86881 Ack=1 Win=85 Len=2896 TSval=2122172280 TSecr=3181269148"
"777","1.366544278","172.16.20.1","172.16.20.9","TCP","2962","0.001531052","5004  >  54680 [PSH, ACK] Seq=89777 Ack=1 Win=85 Len=2896 TSval=2122172288 TSecr=3181269156"
"822","1.439241710","172.16.20.1","172.16.20.9","TCP","2962","0.001514716","5004  >  54680 [PSH, ACK] Seq=92673 Ack=1 Win=85 Len=2896 TSval=2122172373 TSecr=3181269240"
"828","1.453461855","172.16.20.1","172.16.20.9","TCP","2962","0.001658947","5004  >  54680 [PSH, ACK] Seq=95569 Ack=1 Win=85 Len=2896 TSval=2122172380 TSecr=3181269248"
"873","1.537769082","172.16.20.1","172.16.20.9","TCP","2962","0.001666582","5004  >  54680 [PSH, ACK] Seq=98465 Ack=1 Win=85 Len=2896 TSval=2122172453 TSecr=3181269321"
"879","1.546459018","172.16.20.1","172.16.20.9","TCP","2962","0.000294024","5004  >  54680 [PSH, ACK] Seq=101361 Ack=1 Win=85 Len=2896 TSval=2122172467 TSecr=3181269335"
"924","1.627606864","172.16.20.1","172.16.20.9","TCP","2962","0.000000638","5004  >  54680 [PSH, ACK] Seq=104257 Ack=1 Win=85 Len=2896 TSval=2122172552 TSecr=3181269420"
"929","1.634535229","172.16.20.1","172.16.20.9","TCP","2962","0.000542156","5004  >  54680 [PSH, ACK] Seq=107153 Ack=1 Win=85 Len=2896 TSval=2122172560 TSecr=3181269428"
"974","1.724401522","172.16.20.1","172.16.20.9","TCP","2962","0.000000288","5004  >  54680 [PSH, ACK] Seq=110049 Ack=1 Win=85 Len=2896 TSval=2122172642 TSecr=3181269509"
"980","1.735422605","172.16.20.1","172.16.20.9","TCP","2962","0.003534452","5004  >  54680 [PSH, ACK] Seq=112945 Ack=1 Win=85 Len=2896 TSval=2122172648 TSecr=3181269516"
"1025","1.813389153","172.16.20.1","172.16.20.9","TCP","2962","0.001704002","5004  >  54680 [PSH, ACK] Seq=115841 Ack=1 Win=85 Len=2896 TSval=2122172739 TSecr=3181269606"
"1031","1.822866126","172.16.20.1","172.16.20.9","TCP","2962","0.001994935","5004  >  54680 [PSH, ACK] Seq=118737 Ack=1 Win=85 Len=2896 TSval=2122172749 TSecr=3181269617"
"1076","1.893456669","172.16.20.1","172.16.20.9","TCP","2962","0.001058265","5004  >  54680 [PSH, ACK] Seq=121633 Ack=1 Win=85 Len=2896 TSval=2122172827 TSecr=3181269695"
"1082","1.902723631","172.16.20.1","172.16.20.9","TCP","2962","0.001414240","5004  >  54680 [PSH, ACK] Seq=124529 Ack=1 Win=85 Len=2896 TSval=2122172837 TSecr=3181269705"
"1127","1.977681909","172.16.20.1","172.16.20.9","TCP","2962","0.002301478","5004  >  54680 [PSH, ACK] Seq=127425 Ack=1 Win=85 Len=2896 TSval=2122172907 TSecr=3181269775"
"1132","1.985198607","172.16.20.1","172.16.20.9","TCP","2962","0.001311262","5004  >  54680 [PSH, ACK] Seq=130321 Ack=1 Win=85 Len=2896 TSval=2122172917 TSecr=3181269785"
"1178","2.062155680","172.16.20.1","172.16.20.9","TCP","2962","0.001934459","5004  >  54680 [PSH, ACK] Seq=133217 Ack=1 Win=85 Len=2896 TSval=2122172992 TSecr=3181269860"
"1183","2.120104019","172.16.20.1","172.16.20.9","TCP","2962","0.001628737","5004  >  54680 [PSH, ACK] Seq=136113 Ack=1 Win=85 Len=2896 TSval=2122172999 TSecr=3181269867"
"1229","2.245411716","172.16.20.1","172.16.20.9","TCP","2962","0.011171915","5004  >  54680 [PSH, ACK] Seq=139009 Ack=1 Win=85 Len=2896 TSval=2122173076 TSecr=3181269944"
"1234","2.251690239","172.16.20.1","172.16.20.9","TCP","2962","0.001384938","5004  >  54680 [PSH, ACK] Seq=141905 Ack=1 Win=85 Len=2896 TSval=2122173134 TSecr=3181270002"
"1280","2.325079297","172.16.20.1","172.16.20.9","TCP","2962","0.001161906","5004  >  54680 [PSH, ACK] Seq=144801 Ack=1 Win=85 Len=2896 TSval=2122173260 TSecr=3181270128"
"1285","2.332672928","172.16.20.1","172.16.20.9","TCP","2962","0.001680682","5004  >  54680 [PSH, ACK] Seq=147697 Ack=1 Win=85 Len=2896 TSval=2122173266 TSecr=3181270134"
"1331","2.406860097","172.16.20.1","172.16.20.9","TCP","2962","0.000987249","5004  >  54680 [PSH, ACK] Seq=150593 Ack=1 Win=85 Len=2896 TSval=2122173339 TSecr=3181270207"
"1336","2.415808717","172.16.20.1","172.16.20.9","TCP","2962","0.002905327","5004  >  54680 [PSH, ACK] Seq=153489 Ack=1 Win=85 Len=2896 TSval=2122173346 TSecr=3181270214"
"1382","2.497870644","172.16.20.1","172.16.20.9","TCP","2962","0.000000224","5004  >  54680 [PSH, ACK] Seq=156385 Ack=1 Win=85 Len=2896 TSval=2122173421 TSecr=3181270289"
"1387","2.507161650","172.16.20.1","172.16.20.9","TCP","2962","0.001296010","5004  >  54680 [PSH, ACK] Seq=159281 Ack=1 Win=85 Len=2896 TSval=2122173430 TSecr=3181270298"
"1432","2.578715984","172.16.20.1","172.16.20.9","TCP","2962","0.002031439","5004  >  54680 [PSH, ACK] Seq=162177 Ack=1 Win=85 Len=2896 TSval=2122173512 TSecr=3181270380"
"1438","2.586938524","172.16.20.1","172.16.20.9","TCP","2962","0.001053620","5004  >  54680 [PSH, ACK] Seq=165073 Ack=1 Win=85 Len=2896 TSval=2122173521 TSecr=3181270389"
"1483","2.658439497","172.16.20.1","172.16.20.9","TCP","2962","0.000800780","5004  >  54680 [PSH, ACK] Seq=167969 Ack=1 Win=85 Len=2896 TSval=2122173593 TSecr=3181270461"
"1489","2.667576491","172.16.20.1","172.16.20.9","TCP","2962","0.001316462","5004  >  54680 [PSH, ACK] Seq=170865 Ack=1 Win=85 Len=2896 TSval=2122173601 TSecr=3181270469"
"1534","2.756906023","172.16.20.1","172.16.20.9","TCP","2962","0.002411732","5004  >  54680 [PSH, ACK] Seq=173761 Ack=1 Win=85 Len=2896 TSval=2122173672 TSecr=3181270540"
"1540","2.766951518","172.16.20.1","172.16.20.9","TCP","2962","0.003291711","5004  >  54680 [PSH, ACK] Seq=176657 Ack=1 Win=85 Len=2896 TSval=2122173681 TSecr=3181270549"
"1585","2.854606609","172.16.20.1","172.16.20.9","TCP","2962","0.001489598","5004  >  54680 [PSH, ACK] Seq=179553 Ack=1 Win=85 Len=2896 TSval=2122173771 TSecr=3181270639"
"1591","2.863477534","172.16.20.1","172.16.20.9","TCP","2962","0.000000443","5004  >  54680 [PSH, ACK] Seq=182449 Ack=1 Win=85 Len=2896 TSval=2122173781 TSecr=3181270649"
"1636","2.944522026","172.16.20.1","172.16.20.9","TCP","2962","0.002202458","5004  >  54680 [PSH, ACK] Seq=185345 Ack=1 Win=85 Len=2896 TSval=2122173869 TSecr=3181270736"
"1642","2.952798050","172.16.20.1","172.16.20.9","TCP","2962","0.001461625","5004  >  54680 [PSH, ACK] Seq=188241 Ack=1 Win=85 Len=2896 TSval=2122173877 TSecr=3181270745"
"1687","3.023846869","172.16.20.1","172.16.20.9","TCP","2962","0.000795649","5004  >  54680 [PSH, ACK] Seq=191137 Ack=1 Win=85 Len=2896 TSval=2122173958 TSecr=3181270826"
"1693","3.033469713","172.16.20.1","172.16.20.9","TCP","2962","0.001952841","5004  >  54680 [PSH, ACK] Seq=194033 Ack=1 Win=85 Len=2896 TSval=2122173967 TSecr=3181270835"
"1738","3.112065778","172.16.20.1","172.16.20.9","TCP","2962","0.001402314","5004  >  54680 [PSH, ACK] Seq=196929 Ack=1 Win=85 Len=2896 TSval=2122174038 TSecr=3181270906"
"1744","3.121236826","172.16.20.1","172.16.20.9","TCP","2962","0.001452984","5004  >  54680 [PSH, ACK] Seq=199825 Ack=1 Win=85 Len=2896 TSval=2122174048 TSecr=3181270915"
"1789","3.203943835","172.16.20.1","172.16.20.9","TCP","2962","0.000000216","5004  >  54680 [PSH, ACK] Seq=202721 Ack=1 Win=85 Len=2896 TSval=2122174126 TSecr=3181270994"
"1795","3.217710051","172.16.20.1","172.16.20.9","TCP","2962","0.001680204","5004  >  54680 [PSH, ACK] Seq=205617 Ack=1 Win=85 Len=2896 TSval=2122174135 TSecr=3181271003"
"1838","3.299536058","172.16.20.1","172.16.20.9","TCP","2962","0.001387200","5004  >  54680 [PSH, ACK] Seq=208513 Ack=1 Win=85 Len=2896 TSval=2122174218 TSecr=3181271086"
"1846","3.312571127","172.16.20.1","172.16.20.9","TCP","2962","0.002352989","5004  >  54680 [PSH, ACK] Seq=211409 Ack=1 Win=85 Len=2896 TSval=2122174232 TSecr=3181271099"
"1889","3.381020764","172.16.20.1","172.16.20.9","TCP","2962","0.001024304","5004  >  54680 [PSH, ACK] Seq=214305 Ack=1 Win=85 Len=2896 TSval=2122174313 TSecr=3181271181"
"1897","3.393594808","172.16.20.1","172.16.20.9","TCP","2962","0.001896127","5004  >  54680 [PSH, ACK] Seq=217201 Ack=1 Win=85 Len=2896 TSval=2122174326 TSecr=3181271194"
"1940","3.492155367","172.16.20.1","172.16.20.9","TCP","2962","0.001829621","5004  >  54680 [PSH, ACK] Seq=220097 Ack=1 Win=85 Len=2896 TSval=2122174395 TSecr=3181271263"
"1948","3.503881468","172.16.20.1","172.16.20.9","TCP","2962","0.000956142","5004  >  54680 [PSH, ACK] Seq=222993 Ack=1 Win=85 Len=2896 TSval=2122174407 TSecr=3181271275"
"1991","3.573045347","172.16.20.1","172.16.20.9","TCP","2962","0.000644969","5004  >  54680 [PSH, ACK] Seq=225889 Ack=1 Win=85 Len=2896 TSval=2122174506 TSecr=3181271374"
"1999","3.585520012","172.16.20.1","172.16.20.9","TCP","2962","0.001982118","5004  >  54680 [PSH, ACK] Seq=228785 Ack=1 Win=85 Len=2896 TSval=2122174518 TSecr=3181271386"
"2042","3.653109931","172.16.20.1","172.16.20.9","TCP","2962","0.002413812","5004  >  54680 [PSH, ACK] Seq=231681 Ack=1 Win=85 Len=2896 TSval=2122174587 TSecr=3181271455"
"2050","3.671180618","172.16.20.1","172.16.20.9","TCP","2962","0.001900071","5004  >  54680 [PSH, ACK] Seq=234577 Ack=1 Win=85 Len=2896 TSval=2122174599 TSecr=3181271467"
"2093","3.764637479","172.16.20.1","172.16.20.9","TCP","2962","0.001415191","5004  >  54680 [PSH, ACK] Seq=237473 Ack=1 Win=85 Len=2896 TSval=2122174667 TSecr=3181271535"
"2101","3.795579495","172.16.20.1","172.16.20.9","TCP","2962","0.003733396","5004  >  54680 [PSH, ACK] Seq=240369 Ack=1 Win=85 Len=2896 TSval=2122174685 TSecr=3181271553"
"2144","3.887712787","172.16.20.1","172.16.20.9","TCP","2962","0.000611130","5004  >  54680 [PSH, ACK] Seq=243265 Ack=1 Win=85 Len=2896 TSval=2122174779 TSecr=3181271646"
"2152","3.899897056","172.16.20.1","172.16.20.9","TCP","2962","0.001392155","5004  >  54680 [PSH, ACK] Seq=246161 Ack=1 Win=85 Len=2896 TSval=2122174810 TSecr=3181271677"
"2195","3.975769417","172.16.20.1","172.16.20.9","TCP","2962","0.000000448","5004  >  54680 [PSH, ACK] Seq=249057 Ack=1 Win=85 Len=2896 TSval=2122174902 TSecr=3181271769"
"2203","3.987868446","172.16.20.1","172.16.20.9","TCP","2962","0.001306904","5004  >  54680 [PSH, ACK] Seq=251953 Ack=1 Win=85 Len=2896 TSval=2122174914 TSecr=3181271782"
"2246","4.058011727","172.16.20.1","172.16.20.9","TCP","2962","0.000000577","5004  >  54680 [PSH, ACK] Seq=254849 Ack=1 Win=85 Len=2896 TSval=2122174990 TSecr=3181271858"
"2254","4.072873597","172.16.20.1","172.16.20.9","TCP","2962","0.001080015","5004  >  54680 [PSH, ACK] Seq=257745 Ack=1 Win=85 Len=2896 TSval=2122175002 TSecr=3181271870"
"2297","4.140837713","172.16.20.1","172.16.20.9","TCP","2962","0.001647370","5004  >  54680 [PSH, ACK] Seq=260641 Ack=1 Win=85 Len=2896 TSval=2122175073 TSecr=3181271941"
"2305","4.152925709","172.16.20.1","172.16.20.9","TCP","2962","0.001588868","5004  >  54680 [PSH, ACK] Seq=263537 Ack=1 Win=85 Len=2896 TSval=2122175087 TSecr=3181271955"
"2348","4.235081289","172.16.20.1","172.16.20.9","TCP","2962","0.003529744","5004  >  54680 [PSH, ACK] Seq=266433 Ack=1 Win=85 Len=2896 TSval=2122175155 TSecr=3181272023"
"2356","4.252433378","172.16.20.1","172.16.20.9","TCP","2962","0.001498594","5004  >  54680 [PSH, ACK] Seq=269329 Ack=1 Win=85 Len=2896 TSval=2122175167 TSecr=3181272035"
"2399","4.351951451","172.16.20.1","172.16.20.9","TCP","2962","0.003339718","5004  >  54680 [PSH, ACK] Seq=272225 Ack=1 Win=85 Len=2896 TSval=2122175249 TSecr=3181272117"
"2405","4.363762610","172.16.20.1","172.16.20.9","TCP","2962","0.005556099","5004  >  54680 [PSH, ACK] Seq=275121 Ack=1 Win=85 Len=2896 TSval=2122175266 TSecr=3181272134"
"2448","4.451028172","172.16.20.1","172.16.20.9","TCP","2962","0.001707931","5004  >  54680 [PSH, ACK] Seq=278017 Ack=1 Win=85 Len=2896 TSval=2122175366 TSecr=3181272234"
"2455","4.465023910","172.16.20.1","172.16.20.9","TCP","2962","0.003540887","5004  >  54680 [PSH, ACK] Seq=280913 Ack=1 Win=85 Len=2896 TSval=2122175378 TSecr=3181272246"
"2499","4.546481024","172.16.20.1","172.16.20.9","TCP","2962","0.001880004","5004  >  54680 [PSH, ACK] Seq=283809 Ack=1 Win=85 Len=2896 TSval=2122175465 TSecr=3181272333"
"2506","4.557091754","172.16.20.1","172.16.20.9","TCP","2962","0.002124618","5004  >  54680 [PSH, ACK] Seq=286705 Ack=1 Win=85 Len=2896 TSval=2122175479 TSecr=3181272347"
"2550","4.623033631","172.16.20.1","172.16.20.9","TCP","2962","0.001424366","5004  >  54680 [PSH, ACK] Seq=289601 Ack=1 Win=85 Len=2896 TSval=2122175560 TSecr=3181272428"
"2557","4.633809936","172.16.20.1","172.16.20.9","TCP","2962","0.001783307","5004  >  54680 [PSH, ACK] Seq=292497 Ack=1 Win=85 Len=2896 TSval=2122175571 TSecr=3181272439"
"2601","4.715497681","172.16.20.1","172.16.20.9","TCP","2962","0.002289911","5004  >  54680 [PSH, ACK] Seq=295393 Ack=1 Win=85 Len=2896 TSval=2122175637 TSecr=3181272505"
"2608","4.725436746","172.16.20.1","172.16.20.9","TCP","2962","0.002326680","5004  >  54680 [PSH, ACK] Seq=298289 Ack=1 Win=85 Len=2896 TSval=2122175648 TSecr=3181272516"
"2652","4.812299915","172.16.20.1","172.16.20.9","TCP","2962","0.001707401","5004  >  54680 [PSH, ACK] Seq=301185 Ack=1 Win=85 Len=2896 TSval=2122175729 TSecr=3181272597"
"2659","4.822493101","172.16.20.1","172.16.20.9","TCP","2962","0.001330501","5004  >  54680 [PSH, ACK] Seq=304081 Ack=1 Win=85 Len=2896 TSval=2122175739 TSecr=3181272607"
"2703","4.907546987","172.16.20.1","172.16.20.9","TCP","2962","0.001253948","5004  >  54680 [PSH, ACK] Seq=306977 Ack=1 Win=85 Len=2896 TSval=2122175826 TSecr=3181272694"
"2710","4.923425232","172.16.20.1","172.16.20.9","TCP","2962","0.003329746","5004  >  54680 [PSH, ACK] Seq=309873 Ack=1 Win=85 Len=2896 TSval=2122175836 TSecr=3181272704"
"2753","5.006455889","172.16.20.1","172.16.20.9","TCP","2962","0.000373459","5004  >  54680 [PSH, ACK] Seq=312769 Ack=1 Win=85 Len=2896 TSval=2122175921 TSecr=3181272789"
"2761","5.018394161","172.16.20.1","172.16.20.9","TCP","2962","0.000002938","5004  >  54680 [PSH, ACK] Seq=315665 Ack=1 Win=85 Len=2896 TSval=2122175937 TSecr=3181272805"
"2804","5.112620243","172.16.20.1","172.16.20.9","TCP","2962","0.001467193","5004  >  54680 [PSH, ACK] Seq=318561 Ack=1 Win=85 Len=2896 TSval=2122176020 TSecr=3181272888"
"2811","5.127728326","172.16.20.1","172.16.20.9","TCP","2962","0.006028226","5004  >  54680 [PSH, ACK] Seq=321457 Ack=1 Win=85 Len=2896 TSval=2122176032 TSecr=3181272900"
"2855","5.223006210","172.16.20.1","172.16.20.9","TCP","2962","0.000000272","5004  >  54680 [PSH, ACK] Seq=324353 Ack=1 Win=85 Len=2896 TSval=2122176126 TSecr=3181272994"
"2862","5.267635660","172.16.20.1","172.16.20.9","TCP","2962","0.000000236","5004  >  54680 [PSH, ACK] Seq=327249 Ack=1 Win=85 Len=2896 TSval=2122176141 TSecr=3181273009"
"2905","5.359117197","172.16.20.1","172.16.20.9","TCP","2962","0.000000392","5004  >  54680 [PSH, ACK] Seq=330145 Ack=1 Win=85 Len=2896 TSval=2122176237 TSecr=3181273105"
"2912","5.369724824","172.16.20.1","172.16.20.9","TCP","2962","0.000000845","5004  >  54680 [PSH, ACK] Seq=333041 Ack=1 Win=85 Len=2896 TSval=2122176282 TSecr=3181273149"
"2956","5.441376642","172.16.20.1","172.16.20.9","TCP","2962","0.001953338","5004  >  54680 [PSH, ACK] Seq=335937 Ack=1 Win=85 Len=2896 TSval=2122176373 TSecr=3181273241"
"2963","5.451338587","172.16.20.1","172.16.20.9","TCP","2962","0.001488311","5004  >  54680 [PSH, ACK] Seq=338833 Ack=1 Win=85 Len=2896 TSval=2122176384 TSecr=3181273252"
"3007","5.525049186","172.16.20.1","172.16.20.9","TCP","2962","0.001624789","5004  >  54680 [PSH, ACK] Seq=341729 Ack=1 Win=85 Len=2896 TSval=2122176455 TSecr=3181273323"
"3012","5.532645783","172.16.20.1","172.16.20.9","TCP","2962","0.001647129","5004  >  54680 [PSH, ACK] Seq=344625 Ack=1 Win=85 Len=2896 TSval=2122176465 TSecr=3181273333"
"3058","5.612253639","172.16.20.1","172.16.20.9","TCP","2962","0.001523180","5004  >  54680 [PSH, ACK] Seq=347521 Ack=1 Win=85 Len=2896 TSval=2122176539 TSecr=3181273407"
"3063","5.619763892","172.16.20.1","172.16.20.9","TCP","2962","0.001894865","5004  >  54680 [PSH, ACK] Seq=350417 Ack=1 Win=85 Len=2896 TSval=2122176547 TSecr=3181273415"
"3109","5.694139039","172.16.20.1","172.16.20.9","TCP","2962","0.000325623","5004  >  54680 [PSH, ACK] Seq=353313 Ack=1 Win=85 Len=2896 TSval=2122176626 TSecr=3181273494"
"3114","5.701791195","172.16.20.1","172.16.20.9","TCP","2962","0.001769879","5004  >  54680 [PSH, ACK] Seq=356209 Ack=1 Win=85 Len=2896 TSval=2122176634 TSecr=3181273502"
"3159","5.771100962","172.16.20.1","172.16.20.9","TCP","2962","0.001279046","5004  >  54680 [PSH, ACK] Seq=359105 Ack=1 Win=85 Len=2896 TSval=2122176708 TSecr=3181273576"
"3165","5.779853828","172.16.20.1","172.16.20.9","TCP","2962","0.001489090","5004  >  54680 [PSH, ACK] Seq=362001 Ack=1 Win=85 Len=2896 TSval=2122176716 TSecr=3181273584"
"3210","5.860547998","172.16.20.1","172.16.20.9","TCP","2962","0.001529928","5004  >  54680 [PSH, ACK] Seq=364897 Ack=1 Win=85 Len=2896 TSval=2122176785 TSecr=3181273653"
"3216","5.869438995","172.16.20.1","172.16.20.9","TCP","2962","0.000649233","5004  >  54680 [PSH, ACK] Seq=367793 Ack=1 Win=85 Len=2896 TSval=2122176794 TSecr=3181273662"
"3261","5.959857250","172.16.20.1","172.16.20.9","TCP","2962","0.005067616","5004  >  54680 [PSH, ACK] Seq=370689 Ack=1 Win=85 Len=2896 TSval=2122176875 TSecr=3181273742"
"3267","5.967917657","172.16.20.1","172.16.20.9","TCP","2962","0.002119725","5004  >  54680 [PSH, ACK] Seq=373585 Ack=1 Win=85 Len=2896 TSval=2122176883 TSecr=3181273751"
"3312","6.044913573","172.16.20.1","172.16.20.9","TCP","2962","0.001450325","5004  >  54680 [PSH, ACK] Seq=376481 Ack=1 Win=85 Len=2896 TSval=2122176974 TSecr=3181273842"
"3318","6.054132796","172.16.20.1","172.16.20.9","TCP","2962","0.001787723","5004  >  54680 [PSH, ACK] Seq=379377 Ack=1 Win=85 Len=2896 TSval=2122176982 TSecr=3181273850"
"3363","6.122518662","172.16.20.1","172.16.20.9","TCP","2962","0.001123213","5004  >  54680 [PSH, ACK] Seq=382273 Ack=1 Win=85 Len=2896 TSval=2122177059 TSecr=3181273927"
"3369","6.131553519","172.16.20.1","172.16.20.9","TCP","2962","0.001448817","5004  >  54680 [PSH, ACK] Seq=385169 Ack=1 Win=85 Len=2896 TSval=2122177068 TSecr=3181273936"
"3414","6.219163485","172.16.20.1","172.16.20.9","TCP","2962","0.000000267","5004  >  54680 [PSH, ACK] Seq=388065 Ack=1 Win=85 Len=2896 TSval=2122177136 TSecr=3181274004"
"3420","6.228529303","172.16.20.1","172.16.20.9","TCP","2962","0.001327630","5004  >  54680 [PSH, ACK] Seq=390961 Ack=1 Win=85 Len=2896 TSval=2122177145 TSecr=3181274013"
"3463","6.293661011","172.16.20.1","172.16.20.9","TCP","2962","0.001976065","5004  >  54680 [PSH, ACK] Seq=393857 Ack=1 Win=85 Len=2896 TSval=2122177233 TSecr=3181274101"
"3471","6.306094059","172.16.20.1","172.16.20.9","TCP","2962","0.001009437","5004  >  54680 [PSH, ACK] Seq=396753 Ack=1 Win=85 Len=2896 TSval=2122177242 TSecr=3181274110"
"3514","6.375464311","172.16.20.1","172.16.20.9","TCP","2962","0.001923306","5004  >  54680 [PSH, ACK] Seq=399649 Ack=1 Win=85 Len=2896 TSval=2122177308 TSecr=3181274175"
"3521","6.385661980","172.16.20.1","172.16.20.9","TCP","2962","0.001588235","5004  >  54680 [PSH, ACK] Seq=402545 Ack=1 Win=85 Len=2896 TSval=2122177320 TSecr=3181274188"
"3565","6.461977339","172.16.20.1","172.16.20.9","TCP","2962","0.000594279","5004  >  54680 [PSH, ACK] Seq=405441 Ack=1 Win=85 Len=2896 TSval=2122177390 TSecr=3181274258"
"3572","6.472251890","172.16.20.1","172.16.20.9","TCP","2962","0.001293455","5004  >  54680 [PSH, ACK] Seq=408337 Ack=1 Win=85 Len=2896 TSval=2122177400 TSecr=3181274267"
"3615","6.551272447","172.16.20.1","172.16.20.9","TCP","2962","0.000000320","5004  >  54680 [PSH, ACK] Seq=411233 Ack=1 Win=85 Len=2896 TSval=2122177476 TSecr=3181274344"
"3623","6.563349259","172.16.20.1","172.16.20.9","TCP","2962","0.000655003","5004  >  54680 [PSH, ACK] Seq=414129 Ack=1 Win=85 Len=2896 TSval=2122177486 TSecr=3181274354"
"3665","6.634055557","172.16.20.1","172.16.20.9","TCP","2962","0.000994990","5004  >  54680 [PSH, ACK] Seq=417025 Ack=1 Win=85 Len=2896 TSval=2122177565 TSecr=3181274433"
"3674","6.647783396","172.16.20.1","172.16.20.9","TCP","2962","0.001997943","5004  >  54680 [PSH, ACK] Seq=419921 Ack=1 Win=85 Len=2896 TSval=2122177577 TSecr=3181274445"
"3716","6.742177013","172.16.20.1","172.16.20.9","TCP","2962","0.001751793","5004  >  54680 [PSH, ACK] Seq=422817 Ack=1 Win=85 Len=2896 TSval=2122177648 TSecr=3181274516"
"3725","6.756290853","172.16.20.1","172.16.20.9","TCP","2962","0.001568348","5004  >  54680 [PSH, ACK] Seq=425713 Ack=1 Win=85 Len=2896 TSval=2122177662 TSecr=3181274530"
"3767","6.827527607","172.16.20.1","172.16.20.9","TCP","2962","0.001833568","5004  >  54680 [PSH, ACK] Seq=428609 Ack=1 Win=85 Len=2896 TSval=2122177756 TSecr=3181274624"
"3776","6.840781649","172.16.20.1","172.16.20.9","TCP","2962","0.001343239","5004  >  54680 [PSH, ACK] Seq=431505 Ack=1 Win=85 Len=2896 TSval=2122177770 TSecr=3181274638"
"3818","6.904205403","172.16.20.1","172.16.20.9","TCP","2962","0.000000258","5004  >  54680 [PSH, ACK] Seq=434401 Ack=1 Win=85 Len=2896 TSval=2122177841 TSecr=3181274709"
"3827","6.917614398","172.16.20.1","172.16.20.9","TCP","2962","0.001293127","5004  >  54680 [PSH, ACK] Seq=437297 Ack=1 Win=85 Len=2896 TSval=2122177855 TSecr=3181274723"
"3868","6.992678587","172.16.20.1","172.16.20.9","TCP","2962","0.001495671","5004  >  54680 [PSH, ACK] Seq=440193 Ack=1 Win=85 Len=2896 TSval=2122177918 TSecr=3181274786"
"3878","7.010405093","172.16.20.1","172.16.20.9","TCP","2962","0.004310872","5004  >  54680 [PSH, ACK] Seq=443089 Ack=1 Win=85 Len=2896 TSval=2122177931 TSecr=3181274799"
"3919","7.084656661","172.16.20.1","172.16.20.9","TCP","2962","0.001982927","5004  >  54680 [PSH, ACK] Seq=445985 Ack=1 Win=85 Len=2896 TSval=2122178007 TSecr=3181274874"
"3929","7.098847167","172.16.20.1","172.16.20.9","TCP","2962","0.001570963","5004  >  54680 [PSH, ACK] Seq=448881 Ack=1 Win=85 Len=2896 TSval=2122178025 TSecr=3181274892"
"3970","7.167930454","172.16.20.1","172.16.20.9","TCP","2962","0.002778011","5004  >  54680 [PSH, ACK] Seq=451777 Ack=1 Win=85 Len=2896 TSval=2122178099 TSecr=3181274966"
"3980","7.188960070","172.16.20.1","172.16.20.9","TCP","2962","0.000000599","5004  >  54680 [PSH, ACK] Seq=454673 Ack=1 Win=85 Len=2896 TSval=2122178113 TSecr=3181274981"
"4021","7.272031982","172.16.20.1","172.16.20.9","TCP","2962","0.001352148","5004  >  54680 [PSH, ACK] Seq=457569 Ack=1 Win=85 Len=2896 TSval=2122178182 TSecr=3181275050"
"4030","7.286045474","172.16.20.1","172.16.20.9","TCP","2962","0.002144210","5004  >  54680 [PSH, ACK] Seq=460465 Ack=1 Win=85 Len=2896 TSval=2122178203 TSecr=3181275071"
"4072","7.350497852","172.16.20.1","172.16.20.9","TCP","2962","0.001092162","5004  >  54680 [PSH, ACK] Seq=463361 Ack=1 Win=85 Len=2896 TSval=2122178286 TSecr=3181275154"
"4081","7.365056164","172.16.20.1","172.16.20.9","TCP","2962","0.001654268","5004  >  54680 [PSH, ACK] Seq=466257 Ack=1 Win=85 Len=2896 TSval=2122178300 TSecr=3181275168"
"4123","7.442551338","172.16.20.1","172.16.20.9","TCP","2962","0.003499583","5004  >  54680 [PSH, ACK] Seq=469153 Ack=1 Win=85 Len=2896 TSval=2122178364 TSecr=3181275232"
"4132","7.461002878","172.16.20.1","172.16.20.9","TCP","2962","0.000000585","5004  >  54680 [PSH, ACK] Seq=472049 Ack=1 Win=85 Len=2896 TSval=2122178379 TSecr=3181275247"
"4174","7.543665045","172.16.20.1","172.16.20.9","TCP","2962","0.004410479","5004  >  54680 [PSH, ACK] Seq=474945 Ack=1 Win=85 Len=2896 TSval=2122178463 TSecr=3181275331"
"4182","7.554340442","172.16.20.1","172.16.20.9","TCP","2962","0.000903078","5004  >  54680 [PSH, ACK] Seq=477841 Ack=1 Win=85 Len=2896 TSval=2122178475 TSecr=3181275343"
"4224","7.634633874","172.16.20.1","172.16.20.9","TCP","2962","0.005941883","5004  >  54680 [PSH, ACK] Seq=480737 Ack=1 Win=85 Len=2896 TSval=2122178558 TSecr=3181275425"
"4233","7.646778808","172.16.20.1","172.16.20.9","TCP","2962","0.001378978","5004  >  54680 [PSH, ACK] Seq=483633 Ack=1 Win=85 Len=2896 TSval=2122178569 TSecr=3181275436"
"4275","7.723367318","172.16.20.1","172.16.20.9","TCP","2962","0.002198728","5004  >  54680 [PSH, ACK] Seq=486529 Ack=1 Win=85 Len=2896 TSval=2122178649 TSecr=3181275517"
"4284","7.736219804","172.16.20.1","172.16.20.9","TCP","2962","0.001260684","5004  >  54680 [PSH, ACK] Seq=489425 Ack=1 Win=85 Len=2896 TSval=2122178661 TSecr=3181275529"
"4326","7.803545123","172.16.20.1","172.16.20.9","TCP","2962","0.001418359","5004  >  54680 [PSH, ACK] Seq=492321 Ack=1 Win=85 Len=2896 TSval=2122178737 TSecr=3181275605"
"4335","7.817250786","172.16.20.1","172.16.20.9","TCP","2962","0.001622013","5004  >  54680 [PSH, ACK] Seq=495217 Ack=1 Win=85 Len=2896 TSval=2122178750 TSecr=3181275618"
"4377","7.887626489","172.16.20.1","172.16.20.9","TCP","2962","0.002042627","5004  >  54680 [PSH, ACK] Seq=498113 Ack=1 Win=85 Len=2896 TSval=2122178818 TSecr=3181275686"
"4386","7.907310381","172.16.20.1","172.16.20.9","TCP","2962","0.000000571","5004  >  54680 [PSH, ACK] Seq=501009 Ack=1 Win=85 Len=2896 TSval=2122178831 TSecr=3181275699"
"4428","7.990299261","172.16.20.1","172.16.20.9","TCP","2962","0.000371642","5004  >  54680 [PSH, ACK] Seq=503905 Ack=1 Win=85 Len=2896 TSval=2122178901 TSecr=3181275769"
"4436","8.004806539","172.16.20.1","172.16.20.9","TCP","2962","0.001717098","5004  >  54680 [PSH, ACK] Seq=506801 Ack=1 Win=85 Len=2896 TSval=2122178921 TSecr=3181275789"
"4478","8.068561688","172.16.20.1","172.16.20.9","TCP","2962","0.001041610","5004  >  54680 [PSH, ACK] Seq=509697 Ack=1 Win=85 Len=2896 TSval=2122179004 TSecr=3181275872"
"4487","8.085578314","172.16.20.1","172.16.20.9","TCP","2962","0.002485996","5004  >  54680 [PSH, ACK] Seq=512593 Ack=1 Win=85 Len=2896 TSval=2122179019 TSecr=3181275887"
"4529","8.150003004","172.16.20.1","172.16.20.9","TCP","2962","0.001238205","5004  >  54680 [PSH, ACK] Seq=515489 Ack=1 Win=85 Len=2896 TSval=2122179085 TSecr=3181275952"
"4538","8.163530013","172.16.20.1","172.16.20.9","TCP","2962","0.001486781","5004  >  54680 [PSH, ACK] Seq=518385 Ack=1 Win=85 Len=2896 TSval=2122179100 TSecr=3181275968"
"4580","8.240422508","172.16.20.1","172.16.20.9","TCP","2962","0.001655428","5004  >  54680 [PSH, ACK] Seq=521281 Ack=1 Win=85 Len=2896 TSval=2122179164 TSecr=3181276032"
"4589","8.258140964","172.16.20.1","172.16.20.9","TCP","2962","0.002155874","5004  >  54680 [PSH, ACK] Seq=524177 Ack=1 Win=85 Len=2896 TSval=2122179177 TSecr=3181276045"
"4631","8.324556764","172.16.20.1","172.16.20.9","TCP","2962","0.000000280","5004  >  54680 [PSH, ACK] Seq=527073 Ack=1 Win=85 Len=2896 TSval=2122179255 TSecr=3181276123"
"4640","8.338403208","172.16.20.1","172.16.20.9","TCP","2962","0.001294635","5004  >  54680 [PSH, ACK] Seq=529969 Ack=1 Win=85 Len=2896 TSval=2122179272 TSecr=3181276140"
"4681","8.408419264","172.16.20.1","172.16.20.9","TCP","2962","0.002217058","5004  >  54680 [PSH, ACK] Seq=532865 Ack=1 Win=85 Len=2896 TSval=2122179339 TSecr=3181276206"
"4691","8.426037928","172.16.20.1","172.16.20.9","TCP","2962","0.003819412","5004  >  54680 [PSH, ACK] Seq=535761 Ack=1 Win=85 Len=2896 TSval=2122179352 TSecr=3181276220"
"4732","8.494070999","172.16.20.1","172.16.20.9","TCP","2962","0.000000310","5004  >  54680 [PSH, ACK] Seq=538657 Ack=1 Win=85 Len=2896 TSval=2122179422 TSecr=3181276290"
"4742","8.513740487","172.16.20.1","172.16.20.9","TCP","2962","0.000000260","5004  >  54680 [PSH, ACK] Seq=541553 Ack=1 Win=85 Len=2896 TSval=2122179440 TSecr=3181276308"
"4783","8.585604682","172.16.20.1","172.16.20.9","TCP","2962","0.000000356","5004  >  54680 [PSH, ACK] Seq=544449 Ack=1 Win=85 Len=2896 TSval=2122179508 TSecr=3181276376"
"4793","8.605355052","172.16.20.1","172.16.20.9","TCP","2962","0.001606773","5004  >  54680 [PSH, ACK] Seq=547345 Ack=1 Win=85 Len=2896 TSval=2122179528 TSecr=3181276396"
"4831","8.675098741","172.16.20.1","172.16.20.9","TCP","2962","0.003276892","5004  >  54680 [PSH, ACK] Seq=550241 Ack=1 Win=85 Len=2896 TSval=2122179600 TSecr=3181276467"
"4844","8.701987612","172.16.20.1","172.16.20.9","TCP","2962","0.001510964","5004  >  54680 [PSH, ACK] Seq=553137 Ack=1 Win=85 Len=2896 TSval=2122179619 TSecr=3181276487"
"4881","8.787741441","172.16.20.1","172.16.20.9","TCP","2962","0.001319115","5004  >  54680 [PSH, ACK] Seq=556033 Ack=1 Win=85 Len=2896 TSval=2122179689 TSecr=3181276557"
"4895","8.808740983","172.16.20.1","172.16.20.9","TCP","2962","0.000849338","5004  >  54680 [PSH, ACK] Seq=558929 Ack=1 Win=85 Len=2896 TSval=2122179716 TSecr=3181276584"
"4932","8.865937352","172.16.20.1","172.16.20.9","TCP","2962","0.001430603","5004  >  54680 [PSH, ACK] Seq=561825 Ack=1 Win=85 Len=2896 TSval=2122179802 TSecr=3181276670"
"4946","8.887085904","172.16.20.1","172.16.20.9","TCP","2962","0.001605652","5004  >  54680 [PSH, ACK] Seq=564721 Ack=1 Win=85 Len=2896 TSval=2122179823 TSecr=3181276691"
"4983","8.947489151","172.16.20.1","172.16.20.9","TCP","2962","0.002337403","5004  >  54680 [PSH, ACK] Seq=567617 Ack=1 Win=85 Len=2896 TSval=2122179880 TSecr=3181276748"
"4997","8.972296248","172.16.20.1","172.16.20.9","TCP","2962","0.005616341","5004  >  54680 [PSH, ACK] Seq=570513 Ack=1 Win=85 Len=2896 TSval=2122179901 TSecr=3181276769"
"5034","9.038486898","172.16.20.1","172.16.20.9","TCP","2962","0.001521793","5004  >  54680 [PSH, ACK] Seq=573409 Ack=1 Win=85 Len=2896 TSval=2122179961 TSecr=3181276829"
"5047","9.062190608","172.16.20.1","172.16.20.9","TCP","2962","0.000415033","5004  >  54680 [PSH, ACK] Seq=576305 Ack=1 Win=85 Len=2896 TSval=2122179987 TSecr=3181276854"
"5085","9.156022565","172.16.20.1","172.16.20.9","TCP","2962","0.001396832","5004  >  54680 [PSH, ACK] Seq=579201 Ack=1 Win=85 Len=2896 TSval=2122180052 TSecr=3181276920"
"5098","9.178156975","172.16.20.1","172.16.20.9","TCP","2962","0.001360356","5004  >  54680 [PSH, ACK] Seq=582097 Ack=1 Win=85 Len=2896 TSval=2122180076 TSecr=3181276944"
"5136","9.246605113","172.16.20.1","172.16.20.9","TCP","2962","0.000476695","5004  >  54680 [PSH, ACK] Seq=584993 Ack=1 Win=85 Len=2896 TSval=2122180170 TSecr=3181277038"
"5149","9.279364539","172.16.20.1","172.16.20.9","TCP","2962","0.014384274","5004  >  54680 [PSH, ACK] Seq=587889 Ack=1 Win=85 Len=2896 TSval=2122180192 TSecr=3181277060"
"5186","9.377994534","172.16.20.1","172.16.20.9","TCP","2962","0.002305435","5004  >  54680 [PSH, ACK] Seq=590785 Ack=1 Win=85 Len=2896 TSval=2122180260 TSecr=3181277128"
"5200","9.399427057","172.16.20.1","172.16.20.9","TCP","2962","0.001888693","5004  >  54680 [PSH, ACK] Seq=593681 Ack=1 Win=85 Len=2896 TSval=2122180293 TSecr=3181277161"
"5237","9.461595416","172.16.20.1","172.16.20.9","TCP","2962","0.001356838","5004  >  54680 [PSH, ACK] Seq=596577 Ack=1 Win=85 Len=2896 TSval=2122180392 TSecr=3181277260"
"5251","9.483124383","172.16.20.1","172.16.20.9","TCP","2962","0.000000222","5004  >  54680 [PSH, ACK] Seq=599473 Ack=1 Win=85 Len=2896 TSval=2122180413 TSecr=3181277281"
"5288","9.563451270","172.16.20.1","172.16.20.9","TCP","2962","0.001816069","5004  >  54680 [PSH, ACK] Seq=602369 Ack=1 Win=85 Len=2896 TSval=2122180476 TSecr=3181277343"
"5301","9.582978681","172.16.20.1","172.16.20.9","TCP","2962","0.001963488","5004  >  54680 [PSH, ACK] Seq=605265 Ack=1 Win=85 Len=2896 TSval=2122180497 TSecr=3181277365"
"5339","9.644777356","172.16.20.1","172.16.20.9","TCP","2962","0.001429462","5004  >  54680 [PSH, ACK] Seq=608161 Ack=1 Win=85 Len=2896 TSval=2122180577 TSecr=3181277445"
"5352","9.666922567","172.16.20.1","172.16.20.9","TCP","2962","0.000000641","5004  >  54680 [PSH, ACK] Seq=611057 Ack=1 Win=85 Len=2896 TSval=2122180597 TSecr=3181277465"
"5390","9.730369019","172.16.20.1","172.16.20.9","TCP","2962","0.001072697","5004  >  54680 [PSH, ACK] Seq=613953 Ack=1 Win=85 Len=2896 TSval=2122180659 TSecr=3181277527"
"5402","9.748028345","172.16.20.1","172.16.20.9","TCP","2962","0.000000283","5004  >  54680 [PSH, ACK] Seq=616849 Ack=1 Win=85 Len=2896 TSval=2122180681 TSecr=3181277549"
"5441","9.808139710","172.16.20.1","172.16.20.9","TCP","2962","0.001529203","5004  >  54680 [PSH, ACK] Seq=619745 Ack=1 Win=85 Len=2896 TSval=2122180744 TSecr=3181277612"
"5452","9.826493929","172.16.20.1","172.16.20.9","TCP","2962","0.000000612","5004  >  54680 [PSH, ACK] Seq=622641 Ack=1 Win=85 Len=2896 TSval=2122180762 TSecr=3181277630"
"5492","9.894561995","172.16.20.1","172.16.20.9","TCP","2962","0.001265362","5004  >  54680 [PSH, ACK] Seq=625537 Ack=1 Win=85 Len=2896 TSval=2122180822 TSecr=3181277690"
"5502","9.917965202","172.16.20.1","172.16.20.9","TCP","2962","0.003355977","5004  >  54680 [PSH, ACK] Seq=628433 Ack=1 Win=85 Len=2896 TSval=2122180841 TSecr=3181277708"
"5543","9.992186633","172.16.20.1","172.16.20.9","TCP","2962","0.001739767","5004  >  54680 [PSH, ACK] Seq=631329 Ack=1 Win=85 Len=2896 TSval=2122180909 TSecr=3181277777"
"5553","10.010988038","172.16.20.1","172.16.20.9","TCP","2962","0.005563188","5004  >  54680 [PSH, ACK] Seq=634225 Ack=1 Win=85 Len=2896 TSval=2122180932 TSecr=3181277800"
"5594","10.088457516","172.16.20.1","172.16.20.9","TCP","2962","0.001238972","5004  >  54680 [PSH, ACK] Seq=637121 Ack=1 Win=85 Len=2896 TSval=2122181006 TSecr=3181277874"
"5604","10.113842088","172.16.20.1","172.16.20.9","TCP","2962","0.001535694","5004  >  54680 [PSH, ACK] Seq=640017 Ack=1 Win=85 Len=2896 TSval=2122181025 TSecr=3181277893"
"5645","10.191616976","172.16.20.1","172.16.20.9","TCP","2962","0.000619635","5004  >  54680 [PSH, ACK] Seq=642913 Ack=1 Win=85 Len=2896 TSval=2122181102 TSecr=3181277970"
"5655","10.214806143","172.16.20.1","172.16.20.9","TCP","2962","0.003717954","5004  >  54680 [PSH, ACK] Seq=645809 Ack=1 Win=85 Len=2896 TSval=2122181128 TSecr=3181277996"
"5696","10.283509084","172.16.20.1","172.16.20.9","TCP","2962","0.001574665","5004  >  54680 [PSH, ACK] Seq=648705 Ack=1 Win=85 Len=2896 TSval=2122181205 TSecr=3181278073"
"5706","10.300325782","172.16.20.1","172.16.20.9","TCP","2962","0.002043048","5004  >  54680 [PSH, ACK] Seq=651601 Ack=1 Win=85 Len=2896 TSval=2122181229 TSecr=3181278097"
"5747","10.366277696","172.16.20.1","172.16.20.9","TCP","2962","0.001566675","5004  >  54680 [PSH, ACK] Seq=654497 Ack=1 Win=85 Len=2896 TSval=2122181298 TSecr=3181278165"
"5757","10.381670220","172.16.20.1","172.16.20.9","TCP","2962","0.001164497","5004  >  54680 [PSH, ACK] Seq=657393 Ack=1 Win=85 Len=2896 TSval=2122181314 TSecr=3181278182"
"5798","10.447192977","172.16.20.1","172.16.20.9","TCP","2962","0.001368608","5004  >  54680 [PSH, ACK] Seq=660289 Ack=1 Win=85 Len=2896 TSval=2122181380 TSecr=3181278248"
"5808","10.462409453","172.16.20.1","172.16.20.9","TCP","2962","0.000295291","5004  >  54680 [PSH, ACK] Seq=663185 Ack=1 Win=85 Len=2896 TSval=2122181396 TSecr=3181278264"
"5849","10.546903413","172.16.20.1","172.16.20.9","TCP","2962","0.001766442","5004  >  54680 [PSH, ACK] Seq=666081 Ack=1 Win=85 Len=2896 TSval=2122181461 TSecr=3181278329"
"5858","10.560745178","172.16.20.1","172.16.20.9","TCP","2962","0.002100834","5004  >  54680 [PSH, ACK] Seq=668977 Ack=1 Win=85 Len=2896 TSval=2122181476 TSecr=3181278344"
"5900","10.637356882","172.16.20.1","172.16.20.9","TCP","2962","0.001716433","5004  >  54680 [PSH, ACK] Seq=671873 Ack=1 Win=85 Len=2896 TSval=2122181561 TSecr=3181278429"
