"No.","Time","Source","Destination","Protocol","Length","Time delta from previous captured frame","Info"
"1","0.000000000","172.16.20.1","172.16.20.9","TCP","10066","0.000000000","5004  >  36330 [PSH, ACK] Seq=1 Ack=1 Win=85 Len=10000 TSval=2121619322 TSecr=3180715968"
"3","0.010358223","172.16.20.1","172.16.20.9","TCP","10066","0.010224729","5004  >  36330 [PSH, ACK] Seq=10001 Ack=1 Win=85 Len=10000 TSval=2121619323 TSecr=3180716190"
"5","0.019445962","172.16.20.1","172.16.20.9","TCP","2101","0.009064129","5004  >  36330 [PSH, ACK] Seq=20001 Ack=1 Win=85 Len=2035 TSval=2121619333 TSecr=3180716201"
"7","0.064254259","172.16.20.1","172.16.20.9","TCP","6151","0.044776953","5004  >  36330 [PSH, ACK] Seq=22036 Ack=1 Win=85 Len=6085 TSval=2121619387 TSecr=3180716210"
"9","0.236804621","172.16.20.1","172.16.20.9","TCP","10066","0.172531823","5004  >  36330 [PSH, ACK] Seq=28121 Ack=1 Win=85 Len=10000 TSval=2121619559 TSecr=3180716255"
"11","0.246250320","172.16.20.1","172.16.20.9","TCP","10066","0.009429120","5004  >  36330 [PSH, ACK] Seq=38121 Ack=1 Win=85 Len=10000 TSval=2121619560 TSecr=3180716427"
"13","0.256660358","172.16.20.1","172.16.20.9","TCP","11650","0.010385430","5004  >  36330 [PSH, ACK] Seq=48121 Ack=1 Win=85 Len=11584 TSval=2121619560 TSecr=3180716427"
"15","0.269131612","172.16.20.1","172.16.20.9","TCP","7306","0.012440098","5004  >  36330 [PSH, ACK] Seq=59705 Ack=1 Win=85 Len=7240 TSval=2121619569 TSecr=3180716437"
"17","0.276213808","172.16.20.1","172.16.20.9","TCP","14546","0.007058034","5004  >  36330 [PSH, ACK] Seq=66945 Ack=1 Win=85 Len=14480 TSval=2121619569 TSecr=3180716437"
"19","0.291369097","172.16.20.1","172.16.20.9","TCP","14546","0.015092926","5004  >  36330 [PSH, ACK] Seq=81425 Ack=1 Win=85 Len=14480 TSval=2121619579 TSecr=3180716447"
"21","0.306220430","172.16.20.1","172.16.20.9","TCP","11650","0.014828365","5004  >  36330 [PSH, ACK] Seq=95905 Ack=1 Win=85 Len=11584 TSval=2121619599 TSecr=3180716467"
"23","0.319328811","172.16.20.1","172.16.20.9","TCP","1514","0.013083601","5004  >  36330 [ACK] Seq=107489 Ack=1 Win=85 Len=1448 TSval=2121619629 TSecr=3180716497"
"25","0.320093261","172.16.20.1","172.16.20.9","TCP","1514","0.000739859","5004  >  36330 [ACK] Seq=108937 Ack=1 Win=85 Len=1448 TSval=2121619629 TSecr=3180716497"
"27","0.321550941","172.16.20.1","172.16.20.9","TCP","8754","0.001440739","5004  >  36330 [PSH, ACK] Seq=110385 Ack=1 Win=85 Len=8688 TSval=2121619629 TSecr=3180716497"
"29","0.330690991","172.16.20.1","172.16.20.9","TCP","8754","0.009119544","5004  >  36330 [PSH, ACK] Seq=119073 Ack=1 Win=85 Len=8688 TSval=2121619629 TSecr=3180716497"
"31","0.339757215","172.16.20.1","172.16.20.9","TCP","529","0.009043762","5004  >  36330 [PSH, ACK] Seq=127761 Ack=1 Win=85 Len=463 TSval=2121619653 TSecr=3180716521"
"33","0.496374581","172.16.20.1","172.16.20.9","TCP","5858","0.156594824","5004  >  36330 [PSH, ACK] Seq=128224 Ack=1 Win=85 Len=5792 TSval=2121619819 TSecr=3180716530"
"35","0.503633756","172.16.20.1","172.16.20.9","TCP","4274","0.007241549","5004  >  36330 [PSH, ACK] Seq=134016 Ack=1 Win=85 Len=4208 TSval=2121619819 TSecr=3180716530"
"37","0.511454571","172.16.20.1","172.16.20.9","TCP","2578","0.007795402","5004  >  36330 [PSH, ACK] Seq=138224 Ack=1 Win=85 Len=2512 TSval=2121619826 TSecr=3180716694"
"39","0.551156526","172.16.20.1","172.16.20.9","TCP","5247","0.039667700","5004  >  36330 [PSH, ACK] Seq=140736 Ack=1 Win=85 Len=5181 TSval=2121619874 TSecr=3180716702"
"41","0.559731435","172.16.20.1","172.16.20.9","TCP","1123","0.008443698","5004  >  36330 [PSH, ACK] Seq=145917 Ack=1 Win=85 Len=1057 TSval=2121619874 TSecr=3180716742"
"43","0.758537165","172.16.20.1","172.16.20.9","TCP","8754","0.198782862","5004  >  36330 [PSH, ACK] Seq=146974 Ack=1 Win=85 Len=8688 TSval=2121620081 TSecr=3180716750"
"45","0.766293720","172.16.20.1","172.16.20.9","TCP","1378","0.007740337","5004  >  36330 [PSH, ACK] Seq=155662 Ack=1 Win=85 Len=1312 TSval=2121620081 TSecr=3180716750"
"47","0.767810743","172.16.20.1","172.16.20.9","TCP","7306","0.001496924","5004  >  36330 [PSH, ACK] Seq=156974 Ack=1 Win=85 Len=7240 TSval=2121620088 TSecr=3180716949"
"49","0.775565354","172.16.20.1","172.16.20.9","TCP","939","0.007735846","5004  >  36330 [PSH, ACK] Seq=164214 Ack=1 Win=85 Len=873 TSval=2121620089 TSecr=3180716957"
"51","1.003457976","172.16.20.1","172.16.20.9","TCP","8368","0.227869575","5004  >  36330 [PSH, ACK] Seq=165087 Ack=1 Win=85 Len=8302 TSval=2121620326 TSecr=3180716966"
"53","1.021762552","172.16.20.1","172.16.20.9","TCP","5858","0.018285713","5004  >  36330 [PSH, ACK] Seq=173389 Ack=1 Win=85 Len=5792 TSval=2121620344 TSecr=3180717194"
"55","1.032401387","172.16.20.1","172.16.20.9","TCP","4274","0.010624620","5004  >  36330 [PSH, ACK] Seq=179181 Ack=1 Win=85 Len=4208 TSval=2121620344 TSecr=3180717194"
"57","1.035315736","172.16.20.1","172.16.20.9","TCP","419","0.002890554","5004  >  36330 [PSH, ACK] Seq=183389 Ack=1 Win=85 Len=353 TSval=2121620355 TSecr=3180717223"
"59","1.080800134","172.16.20.1","172.16.20.9","TCP","3883","0.045455452","5004  >  36330 [PSH, ACK] Seq=183742 Ack=1 Win=85 Len=3817 TSval=2121620403 TSecr=3180717226"
"61","1.083508487","172.16.20.1","172.16.20.9","TCP","1143","0.002692788","5004  >  36330 [PSH, ACK] Seq=187559 Ack=1 Win=85 Len=1077 TSval=2121620404 TSecr=3180717271"
"63","1.232997595","172.16.20.1","172.16.20.9","TCP","8754","0.149468521","5004  >  36330 [PSH, ACK] Seq=188636 Ack=1 Win=85 Len=8688 TSval=2121620555 TSecr=3180717274"
"65","1.240557633","172.16.20.1","172.16.20.9","TCP","1378","0.007342258","5004  >  36330 [PSH, ACK] Seq=197324 Ack=1 Win=85 Len=1312 TSval=2121620555 TSecr=3180717274"
"67","1.242212583","172.16.20.1","172.16.20.9","TCP","1514","0.001620871","5004  >  36330 [ACK] Seq=198636 Ack=1 Win=85 Len=1448 TSval=2121620556 TSecr=3180717424"
"69","1.244352830","172.16.20.1","172.16.20.9","TCP","1015","0.002115147","5004  >  36330 [PSH, ACK] Seq=200084 Ack=1 Win=85 Len=949 TSval=2121620563 TSecr=3180717431"
"71","1.278259631","172.16.20.1","172.16.20.9","TCP","6454","0.033891359","5004  >  36330 [PSH, ACK] Seq=201033 Ack=1 Win=85 Len=6388 TSval=2121620601 TSecr=3180717435"
"73","1.490246112","172.16.20.1","172.16.20.9","TCP","4888","0.211971390","5004  >  36330 [PSH, ACK] Seq=207421 Ack=1 Win=85 Len=4822 TSval=2121620813 TSecr=3180717469"
"75","1.497803908","172.16.20.1","172.16.20.9","TCP","7040","0.007541980","5004  >  36330 [PSH, ACK] Seq=212243 Ack=1 Win=85 Len=6974 TSval=2121620813 TSecr=3180717681"
"77","1.560535995","172.16.20.1","172.16.20.9","TCP","5373","0.062705512","5004  >  36330 [PSH, ACK] Seq=219217 Ack=1 Win=85 Len=5307 TSval=2121620883 TSecr=3180717688"
"79","1.564958534","172.16.20.1","172.16.20.9","TCP","769","0.004407605","5004  >  36330 [PSH, ACK] Seq=224524 Ack=1 Win=85 Len=703 TSval=2121620886 TSecr=3180717751"
"81","1.745714051","172.16.20.1","172.16.20.9","TCP","10066","0.180721283","5004  >  36330 [PSH, ACK] Seq=225227 Ack=1 Win=85 Len=10000 TSval=2121621068 TSecr=3180717755"
"83","1.754853428","172.16.20.1","172.16.20.9","TCP","2626","0.009123216","5004  >  36330 [PSH, ACK] Seq=235227 Ack=1 Win=85 Len=2560 TSval=2121621068 TSecr=3180717936"
"85","1.791212987","172.16.20.1","172.16.20.9","TCP","5433","0.036338436","5004  >  36330 [PSH, ACK] Seq=237787 Ack=1 Win=85 Len=5367 TSval=2121621114 TSecr=3180717945"
"87","1.796042947","172.16.20.1","172.16.20.9","TCP","1211","0.004812008","5004  >  36330 [PSH, ACK] Seq=243154 Ack=1 Win=85 Len=1145 TSval=2121621114 TSecr=3180717982"
"89","2.001009835","172.16.20.1","172.16.20.9","TCP","7306","0.204943827","5004  >  36330 [PSH, ACK] Seq=244299 Ack=1 Win=85 Len=7240 TSval=2121621323 TSecr=3180717987"
"91","2.007078720","172.16.20.1","172.16.20.9","TCP","869","0.006051864","5004  >  36330 [PSH, ACK] Seq=251539 Ack=1 Win=85 Len=803 TSval=2121621323 TSecr=3180717987"
"93","2.065250085","172.16.20.1","172.16.20.9","TCP","10066","0.058147369","5004  >  36330 [PSH, ACK] Seq=252342 Ack=1 Win=85 Len=10000 TSval=2121621388 TSecr=3180718198"
"95","2.074383476","172.16.20.1","172.16.20.9","TCP","7622","0.009117450","5004  >  36330 [PSH, ACK] Seq=262342 Ack=1 Win=85 Len=7556 TSval=2121621388 TSecr=3180718256"
"97","2.241733330","172.16.20.1","172.16.20.9","TCP","10066","0.167323151","5004  >  36330 [PSH, ACK] Seq=269898 Ack=1 Win=85 Len=10000 TSval=2121621564 TSecr=3180718265"
"99","2.250750103","172.16.20.1","172.16.20.9","TCP","7582","0.008998877","5004  >  36330 [PSH, ACK] Seq=279898 Ack=1 Win=85 Len=7516 TSval=2121621565 TSecr=3180718432"
"101","2.291877790","172.16.20.1","172.16.20.9","TCP","1282","0.041082412","5004  >  36330 [PSH, ACK] Seq=287414 Ack=1 Win=85 Len=1216 TSval=2121621614 TSecr=3180718441"
"103","2.496976447","172.16.20.1","172.16.20.9","TCP","5988","0.205083766","5004  >  36330 [PSH, ACK] Seq=288630 Ack=1 Win=85 Len=5922 TSval=2121621819 TSecr=3180718482"
"105","2.503356862","172.16.20.1","172.16.20.9","TCP","7774","0.006365063","5004  >  36330 [PSH, ACK] Seq=294552 Ack=1 Win=85 Len=7708 TSval=2121621820 TSecr=3180718687"
"107","2.565565045","172.16.20.1","172.16.20.9","TCP","866","0.062164688","5004  >  36330 [PSH, ACK] Seq=302260 Ack=1 Win=85 Len=800 TSval=2121621888 TSecr=3180718694"
"111","2.628711491","172.16.20.1","172.16.20.9","TCP","7681","0.059974194","5004  >  36330 [PSH, ACK] Seq=303060 Ack=1 Win=85 Len=7615 TSval=2121621951 TSecr=3180718756"
"113","2.735062159","172.16.20.1","172.16.20.9","TCP","8754","0.106329988","5004  >  36330 [PSH, ACK] Seq=310675 Ack=1 Win=85 Len=8688 TSval=2121622058 TSecr=3180718819"
"115","2.743047143","172.16.20.1","172.16.20.9","TCP","1378","0.007967514","5004  >  36330 [PSH, ACK] Seq=319363 Ack=1 Win=85 Len=1312 TSval=2121622058 TSecr=3180718819"
"117","2.744325185","172.16.20.1","172.16.20.9","TCP","4410","0.001252024","5004  >  36330 [PSH, ACK] Seq=320675 Ack=1 Win=85 Len=4344 TSval=2121622058 TSecr=3180718926"
"119","2.751062639","172.16.20.1","172.16.20.9","TCP","1314","0.006718880","5004  >  36330 [PSH, ACK] Seq=325019 Ack=1 Win=85 Len=1248 TSval=2121622066 TSecr=3180718934"
"121","2.779147238","172.16.20.1","172.16.20.9","TCP","1404","0.028053653","5004  >  36330 [PSH, ACK] Seq=326267 Ack=1 Win=85 Len=1338 TSval=2121622102 TSecr=3180718942"
"123","2.821962183","172.16.20.1","172.16.20.9","TCP","8926","0.042800382","5004  >  36330 [PSH, ACK] Seq=327605 Ack=1 Win=85 Len=8860 TSval=2121622144 TSecr=3180718970"
"125","2.991328828","172.16.20.1","172.16.20.9","TCP","7667","0.169350485","5004  >  36330 [PSH, ACK] Seq=336465 Ack=1 Win=85 Len=7601 TSval=2121622314 TSecr=3180719012"
"127","3.002951588","172.16.20.1","172.16.20.9","TCP","3684","0.011604805","5004  >  36330 [PSH, ACK] Seq=344066 Ack=1 Win=85 Len=3618 TSval=2121622314 TSecr=3180719182"
"129","3.120371189","172.16.20.1","172.16.20.9","TCP","10066","0.117393890","5004  >  36330 [PSH, ACK] Seq=347684 Ack=1 Win=85 Len=10000 TSval=2121622443 TSecr=3180719193"
"131","3.129968922","172.16.20.1","172.16.20.9","TCP","10066","0.009581136","5004  >  36330 [PSH, ACK] Seq=357684 Ack=1 Win=85 Len=10000 TSval=2121622443 TSecr=3180719311"
"133","3.140119356","172.16.20.1","172.16.20.9","TCP","2897","0.010126847","5004  >  36330 [PSH, ACK] Seq=367684 Ack=1 Win=85 Len=2831 TSval=2121622453 TSecr=3180719320"
"135","3.163010943","172.16.20.1","172.16.20.9","TCP","1077","0.022865957","5004  >  36330 [PSH, ACK] Seq=370515 Ack=1 Win=85 Len=1011 TSval=2121622485 TSecr=3180719331"
"137","3.252795162","172.16.20.1","172.16.20.9","TCP","10066","0.089768239","5004  >  36330 [PSH, ACK] Seq=371526 Ack=1 Win=85 Len=10000 TSval=2121622575 TSecr=3180719354"
"139","3.261785240","172.16.20.1","172.16.20.9","TCP","7317","0.008972157","5004  >  36330 [PSH, ACK] Seq=381526 Ack=1 Win=85 Len=7251 TSval=2121622575 TSecr=3180719443"
"141","3.322329428","172.16.20.1","172.16.20.9","TCP","9592","0.060519868","5004  >  36330 [PSH, ACK] Seq=388777 Ack=1 Win=85 Len=9526 TSval=2121622645 TSecr=3180719452"
"143","3.496318060","172.16.20.1","172.16.20.9","TCP","10066","0.173973081","5004  >  36330 [PSH, ACK] Seq=398303 Ack=1 Win=85 Len=10000 TSval=2121622819 TSecr=3180719513"
"145","3.506269383","172.16.20.1","172.16.20.9","TCP","9059","0.009925867","5004  >  36330 [PSH, ACK] Seq=408303 Ack=1 Win=85 Len=8993 TSval=2121622819 TSecr=3180719687"
"147","3.563471617","172.16.20.1","172.16.20.9","TCP","10066","0.057178292","5004  >  36330 [PSH, ACK] Seq=417296 Ack=1 Win=85 Len=10000 TSval=2121622886 TSecr=3180719697"
"149","3.574872255","172.16.20.1","172.16.20.9","TCP","1074","0.011386028","5004  >  36330 [PSH, ACK] Seq=427296 Ack=1 Win=85 Len=1008 TSval=2121622886 TSecr=3180719754"
"151","3.744433377","172.16.20.1","172.16.20.9","TCP","10066","0.169527693","5004  >  36330 [PSH, ACK] Seq=428304 Ack=1 Win=85 Len=10000 TSval=2121623067 TSecr=3180719765"
"153","3.757059699","172.16.20.1","172.16.20.9","TCP","10066","0.012388234","5004  >  36330 [PSH, ACK] Seq=438304 Ack=1 Win=85 Len=10000 TSval=2121623067 TSecr=3180719935"
"155","3.767632236","172.16.20.1","172.16.20.9","TCP","1663","0.010540372","5004  >  36330 [PSH, ACK] Seq=448304 Ack=1 Win=85 Len=1597 TSval=2121623080 TSecr=3180719948"
"157","3.809067474","172.16.20.1","172.16.20.9","TCP","7306","0.041409570","5004  >  36330 [PSH, ACK] Seq=449901 Ack=1 Win=85 Len=7240 TSval=2121623131 TSecr=3180719958"
"159","3.815543152","172.16.20.1","172.16.20.9","TCP","1105","0.006262191","5004  >  36330 [PSH, ACK] Seq=457141 Ack=1 Win=85 Len=1039 TSval=2121623131 TSecr=3180719958"
"161","3.816544490","172.16.20.1","172.16.20.9","TCP","1514","0.000769721","5004  >  36330 [ACK] Seq=458180 Ack=1 Win=85 Len=1448 TSval=2121623132 TSecr=3180720000"
"162","3.818576327","172.16.20.1","172.16.20.9","TCP","351","0.002031837","5004  >  36330 [PSH, ACK] Seq=459628 Ack=1 Win=85 Len=285 TSval=2121623138 TSecr=3180720006"
"164","3.989172669","172.16.20.1","172.16.20.9","TCP","7567","0.170573325","5004  >  36330 [PSH, ACK] Seq=459913 Ack=1 Win=85 Len=7501 TSval=2121623312 TSecr=3180720009"
"166","3.998299872","172.16.20.1","172.16.20.9","TCP","4410","0.007798977","5004  >  36330 [PSH, ACK] Seq=467414 Ack=1 Win=85 Len=4344 TSval=2121623312 TSecr=3180720009"
"168","4.002882177","172.16.20.1","172.16.20.9","TCP","1232","0.004552911","5004  >  36330 [PSH, ACK] Seq=471758 Ack=1 Win=85 Len=1166 TSval=2121623313 TSecr=3180720181"
"170","4.050869028","172.16.20.1","172.16.20.9","TCP","7306","0.047444545","5004  >  36330 [PSH, ACK] Seq=472924 Ack=1 Win=85 Len=7240 TSval=2121623373 TSecr=3180720194"
"172","4.057110508","172.16.20.1","172.16.20.9","TCP","2826","0.005822563","5004  >  36330 [PSH, ACK] Seq=480164 Ack=1 Win=85 Len=2760 TSval=2121623373 TSecr=3180720194"
"174","4.060340419","172.16.20.1","172.16.20.9","TCP","1514","0.003208489","5004  >  36330 [ACK] Seq=482924 Ack=1 Win=85 Len=1448 TSval=2121623374 TSecr=3180720242"
"175","4.062218912","172.16.20.1","172.16.20.9","TCP","238","0.001878493","5004  >  36330 [PSH, ACK] Seq=484372 Ack=1 Win=85 Len=172 TSval=2121623380 TSecr=3180720248"
"177","4.243729567","172.16.20.1","172.16.20.9","TCP","7306","0.181497745","5004  >  36330 [PSH, ACK] Seq=484544 Ack=1 Win=85 Len=7240 TSval=2121623566 TSecr=3180720253"
"179","4.250457606","172.16.20.1","172.16.20.9","TCP","2826","0.006679589","5004  >  36330 [PSH, ACK] Seq=491784 Ack=1 Win=85 Len=2760 TSval=2121623566 TSecr=3180720253"
"181","4.253317544","172.16.20.1","172.16.20.9","TCP","8754","0.002794154","5004  >  36330 [PSH, ACK] Seq=494544 Ack=1 Win=85 Len=8688 TSval=2121623566 TSecr=3180720434"
"183","4.261827797","172.16.20.1","172.16.20.9","TCP","8754","0.008455008","5004  >  36330 [PSH, ACK] Seq=503232 Ack=1 Win=85 Len=8688 TSval=2121623566 TSecr=3180720434"
"185","4.271377075","172.16.20.1","172.16.20.9","TCP","5858","0.009524222","5004  >  36330 [PSH, ACK] Seq=511920 Ack=1 Win=85 Len=5792 TSval=2121623576 TSecr=3180720444"
"187","4.277084341","172.16.20.1","172.16.20.9","TCP","10202","0.005682999","5004  >  36330 [PSH, ACK] Seq=517712 Ack=1 Win=85 Len=10136 TSval=2121623576 TSecr=3180720444"
"189","4.288033584","172.16.20.1","172.16.20.9","TCP","5858","0.010898383","5004  >  36330 [PSH, ACK] Seq=527848 Ack=1 Win=85 Len=5792 TSval=2121623594 TSecr=3180720462"
"191","4.293781445","172.16.20.1","172.16.20.9","TCP","4142","0.005723851","5004  >  36330 [PSH, ACK] Seq=533640 Ack=1 Win=85 Len=4076 TSval=2121623600 TSecr=3180720462"
"193","4.301544530","172.16.20.1","172.16.20.9","TCP","4410","0.007743215","5004  >  36330 [PSH, ACK] Seq=537716 Ack=1 Win=85 Len=4344 TSval=2121623612 TSecr=3180720479"
"195","4.304776688","172.16.20.1","172.16.20.9","TCP","559","0.003197595","5004  >  36330 [PSH, ACK] Seq=542060 Ack=1 Win=85 Len=493 TSval=2121623624 TSecr=3180720492"
"197","4.506661278","172.16.20.1","172.16.20.9","TCP","4410","0.201677353","5004  >  36330 [PSH, ACK] Seq=542553 Ack=1 Win=85 Len=4344 TSval=2121623829 TSecr=3180720495"
"199","4.509781119","172.16.20.1","172.16.20.9","TCP","4410","0.002686192","5004  >  36330 [PSH, ACK] Seq=546897 Ack=1 Win=85 Len=4344 TSval=2121623829 TSecr=3180720495"
"201","4.515321442","172.16.20.1","172.16.20.9","TCP","4410","0.004902958","5004  >  36330 [PSH, ACK] Seq=551241 Ack=1 Win=85 Len=4344 TSval=2121623829 TSecr=3180720495"
"203","4.520997927","172.16.20.1","172.16.20.9","TCP","197","0.005653512","5004  >  36330 [PSH, ACK] Seq=555585 Ack=1 Win=85 Len=131 TSval=2121623833 TSecr=3180720700"
"205","4.556992348","172.16.20.1","172.16.20.9","TCP","3051","0.035971530","5004  >  36330 [PSH, ACK] Seq=555716 Ack=1 Win=85 Len=2985 TSval=2121623879 TSecr=3180720711"
"207","4.734000567","172.16.20.1","172.16.20.9","TCP","1258","0.176789409","5004  >  36330 [PSH, ACK] Seq=558701 Ack=1 Win=85 Len=1192 TSval=2121624056 TSecr=3180720748"
"208","4.734137116","172.16.20.1","172.16.20.9","TCP","1514","0.000136549","5004  >  36330 [ACK] Seq=559893 Ack=1 Win=85 Len=1448 TSval=2121624057 TSecr=3180720748"
"210","4.735371840","172.16.20.1","172.16.20.9","TCP","722","0.000300597","5004  >  36330 [PSH, ACK] Seq=561341 Ack=1 Win=85 Len=656 TSval=2121624058 TSecr=3180720926"
"212","4.776885225","172.16.20.1","172.16.20.9","TCP","8754","0.041457251","5004  >  36330 [PSH, ACK] Seq=561997 Ack=1 Win=85 Len=8688 TSval=2121624099 TSecr=3180720926"
"214","4.785960868","172.16.20.1","172.16.20.9","TCP","1378","0.008482142","5004  >  36330 [PSH, ACK] Seq=570685 Ack=1 Win=85 Len=1312 TSval=2121624099 TSecr=3180720926"
"215","4.786001339","172.16.20.1","172.16.20.9","TCP","2962","0.000040471","5004  >  36330 [PSH, ACK] Seq=571997 Ack=1 Win=85 Len=2896 TSval=2121624100 TSecr=3180720926"
"218","4.788984223","172.16.20.1","172.16.20.9","TCP","351","0.002572909","5004  >  36330 [PSH, ACK] Seq=574893 Ack=1 Win=85 Len=285 TSval=2121624109 TSecr=3180720977"
"220","5.009366766","172.16.20.1","172.16.20.9","TCP","8754","0.220326918","5004  >  36330 [PSH, ACK] Seq=575178 Ack=1 Win=85 Len=8688 TSval=2121624332 TSecr=3180720980"
"222","5.016984851","172.16.20.1","172.16.20.9","TCP","1378","0.007597416","5004  >  36330 [PSH, ACK] Seq=583866 Ack=1 Win=85 Len=1312 TSval=2121624332 TSecr=3180720980"
"224","5.019396023","172.16.20.1","172.16.20.9","TCP","8754","0.002216786","5004  >  36330 [PSH, ACK] Seq=585178 Ack=1 Win=85 Len=8688 TSval=2121624339 TSecr=3180721200"
"226","5.027372144","172.16.20.1","172.16.20.9","TCP","368","0.007950828","5004  >  36330 [PSH, ACK] Seq=593866 Ack=1 Win=85 Len=302 TSval=2121624342 TSecr=3180721210"
"228","5.061003763","172.16.20.1","172.16.20.9","TCP","8754","0.033610046","5004  >  36330 [PSH, ACK] Seq=594168 Ack=1 Win=85 Len=8688 TSval=2121624383 TSecr=3180721218"
"230","5.074283390","172.16.20.1","172.16.20.9","TCP","1378","0.013263806","5004  >  36330 [PSH, ACK] Seq=602856 Ack=1 Win=85 Len=1312 TSval=2121624383 TSecr=3180721218"
"232","5.074284914","172.16.20.1","172.16.20.9","TCP","8754","-0.000023264","5004  >  36330 [PSH, ACK] Seq=604168 Ack=1 Win=85 Len=8688 TSval=2121624384 TSecr=3180721251"
"234","5.084503598","172.16.20.1","172.16.20.9","TCP","1691","0.010103353","5004  >  36330 [PSH, ACK] Seq=612856 Ack=1 Win=85 Len=1625 TSval=2121624397 TSecr=3180721265"
"236","5.233817773","172.16.20.1","172.16.20.9","TCP","5858","0.149290825","5004  >  36330 [PSH, ACK] Seq=614481 Ack=1 Win=85 Len=5792 TSval=2121624556 TSecr=3180721275"
"238","5.241512013","172.16.20.1","172.16.20.9","TCP","1721","0.007679583","5004  >  36330 [PSH, ACK] Seq=620273 Ack=1 Win=85 Len=1655 TSval=2121624556 TSecr=3180721275"
"240","5.242176119","172.16.20.1","172.16.20.9","TCP","1514","0.000092604","5004  >  36330 [ACK] Seq=621928 Ack=1 Win=85 Len=1448 TSval=2121624557 TSecr=3180721424"
"242","5.243366945","172.16.20.1","172.16.20.9","TCP","1239","0.001185156","5004  >  36330 [PSH, ACK] Seq=623376 Ack=1 Win=85 Len=1173 TSval=2121624565 TSecr=3180721433"
"244","5.297058848","172.16.20.1","172.16.20.9","TCP","7306","0.053682537","5004  >  36330 [PSH, ACK] Seq=624549 Ack=1 Win=85 Len=7240 TSval=2121624620 TSecr=3180721434"
"246","5.311906379","172.16.20.1","172.16.20.9","TCP","2826","0.014831303","5004  >  36330 [PSH, ACK] Seq=631789 Ack=1 Win=85 Len=2760 TSval=2121624620 TSecr=3180721434"
"248","5.313542163","172.16.20.1","172.16.20.9","TCP","8754","0.001610854","5004  >  36330 [PSH, ACK] Seq=634549 Ack=1 Win=85 Len=8688 TSval=2121624620 TSecr=3180721488"
"250","5.347944008","172.16.20.1","172.16.20.9","TCP","8754","0.034383777","5004  >  36330 [PSH, ACK] Seq=643237 Ack=1 Win=85 Len=8688 TSval=2121624620 TSecr=3180721488"
"252","5.355585226","172.16.20.1","172.16.20.9","TCP","5858","0.002589241","5004  >  36330 [PSH, ACK] Seq=651925 Ack=1 Win=85 Len=5792 TSval=2121624636 TSecr=3180721504"
"254","5.361861677","172.16.20.1","172.16.20.9","TCP","8754","0.006241551","5004  >  36330 [PSH, ACK] Seq=657717 Ack=1 Win=85 Len=8688 TSval=2121624636 TSecr=3180721504"
"256","5.374118314","172.16.20.1","172.16.20.9","TCP","2962","0.011579601","5004  >  36330 [PSH, ACK] Seq=666405 Ack=1 Win=85 Len=2896 TSval=2121624684 TSecr=3180721546"
"258","5.375836927","172.16.20.1","172.16.20.9","TCP","2962","0.001666887","5004  >  36330 [PSH, ACK] Seq=669301 Ack=1 Win=85 Len=2896 TSval=2121624684 TSecr=3180721546"
"260","5.382744260","172.16.20.1","172.16.20.9","TCP","2962","0.006884897","5004  >  36330 [PSH, ACK] Seq=672197 Ack=1 Win=85 Len=2896 TSval=2121624697 TSecr=3180721565"
"262","5.384479357","172.16.20.1","172.16.20.9","TCP","2962","0.001717860","5004  >  36330 [PSH, ACK] Seq=675093 Ack=1 Win=85 Len=2896 TSval=2121624698 TSecr=3180721566"
"264","5.388702130","172.16.20.1","172.16.20.9","TCP","2962","0.004039066","5004  >  36330 [PSH, ACK] Seq=677989 Ack=1 Win=85 Len=2896 TSval=2121624705 TSecr=3180721573"
"266","5.390373073","172.16.20.1","172.16.20.9","TCP","2962","0.001638867","5004  >  36330 [PSH, ACK] Seq=680885 Ack=1 Win=85 Len=2896 TSval=2121624707 TSecr=3180721573"
"268","5.393854680","172.16.20.1","172.16.20.9","TCP","2962","0.003452948","5004  >  36330 [PSH, ACK] Seq=683781 Ack=1 Win=85 Len=2896 TSval=2121624711 TSecr=3180721579"
"270","5.396324797","172.16.20.1","172.16.20.9","TCP","2962","0.002437531","5004  >  36330 [PSH, ACK] Seq=686677 Ack=1 Win=85 Len=2896 TSval=2121624713 TSecr=3180721581"
"272","5.400269229","172.16.20.1","172.16.20.9","TCP","2962","0.003919239","5004  >  36330 [PSH, ACK] Seq=689573 Ack=1 Win=85 Len=2896 TSval=2121624716 TSecr=3180721584"
"274","5.402335971","172.16.20.1","172.16.20.9","TCP","2962","0.002038654","5004  >  36330 [PSH, ACK] Seq=692469 Ack=1 Win=85 Len=2896 TSval=2121624719 TSecr=3180721587"
"276","5.405922202","172.16.20.1","172.16.20.9","TCP","4410","0.003561310","5004  >  36330 [PSH, ACK] Seq=695365 Ack=1 Win=85 Len=4344 TSval=2121624719 TSecr=3180721587"
"278","5.411439801","172.16.20.1","172.16.20.9","TCP","4410","0.004881606","5004  >  36330 [PSH, ACK] Seq=699709 Ack=1 Win=85 Len=4344 TSval=2121624723 TSecr=3180721591"
"280","5.414501630","172.16.20.1","172.16.20.9","TCP","4410","0.003032935","5004  >  36330 [PSH, ACK] Seq=704053 Ack=1 Win=85 Len=4344 TSval=2121624729 TSecr=3180721593"
"282","5.419161321","172.16.20.1","172.16.20.9","TCP","4343","0.004633096","5004  >  36330 [PSH, ACK] Seq=708397 Ack=1 Win=85 Len=4277 TSval=2121624734 TSecr=3180721602"
"284","5.498369196","172.16.20.1","172.16.20.9","TCP","1487","0.079181098","5004  >  36330 [PSH, ACK] Seq=712674 Ack=1 Win=85 Len=1421 TSval=2121624821 TSecr=3180721610"
"285","5.498491798","172.16.20.1","172.16.20.9","TCP","1514","0.000122602","5004  >  36330 [ACK] Seq=714095 Ack=1 Win=85 Len=1448 TSval=2121624821 TSecr=3180721610"
"287","5.500001069","172.16.20.1","172.16.20.9","TCP","1023","0.001498537","5004  >  36330 [PSH, ACK] Seq=715543 Ack=1 Win=85 Len=957 TSval=2121624821 TSecr=3180721689"
"289","5.552635609","172.16.20.1","172.16.20.9","TCP","552","0.052154880","5004  >  36330 [PSH, ACK] Seq=716500 Ack=1 Win=85 Len=486 TSval=2121624875 TSecr=3180721691"
"291","5.738316787","172.16.20.1","172.16.20.9","TCP","975","0.184741882","5004  >  36330 [PSH, ACK] Seq=716986 Ack=1 Win=85 Len=909 TSval=2121625061 TSecr=3180721744"
"292","5.738476733","172.16.20.1","172.16.20.9","TCP","1514","0.000159946","5004  >  36330 [ACK] Seq=717895 Ack=1 Win=85 Len=1448 TSval=2121625061 TSecr=3180721744"
"294","5.739491556","172.16.20.1","172.16.20.9","TCP","502","0.000873682","5004  >  36330 [PSH, ACK] Seq=719343 Ack=1 Win=85 Len=436 TSval=2121625061 TSecr=3180721929"
"296","5.780312740","172.16.20.1","172.16.20.9","TCP","1883","0.040699202","5004  >  36330 [PSH, ACK] Seq=719779 Ack=1 Win=85 Len=1817 TSval=2121625103 TSecr=3180721930"
"298","5.993599506","172.16.20.1","172.16.20.9","TCP","2592","0.213003011","5004  >  36330 [PSH, ACK] Seq=721596 Ack=1 Win=85 Len=2526 TSval=2121625316 TSecr=3180721971"
"300","5.994871286","172.16.20.1","172.16.20.9","TCP","2779","0.001255319","5004  >  36330 [PSH, ACK] Seq=724122 Ack=1 Win=85 Len=2713 TSval=2121625317 TSecr=3180722184"
"302","6.036433079","172.16.20.1","172.16.20.9","TCP","593","0.041551782","5004  >  36330 [PSH, ACK] Seq=726835 Ack=1 Win=85 Len=527 TSval=2121625359 TSecr=3180722185"
"304","6.252318039","172.16.20.1","172.16.20.9","TCP","979","0.215865825","5004  >  36330 [PSH, ACK] Seq=727362 Ack=1 Win=85 Len=913 TSval=2121625575 TSecr=3180722227"
"306","6.252448566","172.16.20.1","172.16.20.9","TCP","3770","0.000115095","5004  >  36330 [PSH, ACK] Seq=728275 Ack=1 Win=85 Len=3704 TSval=2121625575 TSecr=3180722443"
"308","6.296846512","172.16.20.1","172.16.20.9","TCP","1545","0.044389967","5004  >  36330 [PSH, ACK] Seq=731979 Ack=1 Win=85 Len=1479 TSval=2121625619 TSecr=3180722443"
"310","6.297023992","172.16.20.1","172.16.20.9","TCP","3996","0.000163383","5004  >  36330 [PSH, ACK] Seq=733458 Ack=1 Win=85 Len=3930 TSval=2121625619 TSecr=3180722487"
"312","6.496043765","172.16.20.1","172.16.20.9","TCP","5118","0.199008159","5004  >  36330 [PSH, ACK] Seq=737388 Ack=1 Win=85 Len=5052 TSval=2121625819 TSecr=3180722488"
"314","6.502833881","172.16.20.1","172.16.20.9","TCP","4520","0.006766594","5004  >  36330 [PSH, ACK] Seq=742440 Ack=1 Win=85 Len=4454 TSval=2121625819 TSecr=3180722687"
"316","6.537253538","172.16.20.1","172.16.20.9","TCP","2870","0.034389989","5004  >  36330 [PSH, ACK] Seq=746894 Ack=1 Win=85 Len=2804 TSval=2121625860 TSecr=3180722693"
"318","6.538781713","172.16.20.1","172.16.20.9","TCP","1728","0.001513053","5004  >  36330 [PSH, ACK] Seq=749698 Ack=1 Win=85 Len=1662 TSval=2121625860 TSecr=3180722728"
"320","6.762509389","172.16.20.1","172.16.20.9","TCP","7306","0.223715666","5004  >  36330 [PSH, ACK] Seq=751360 Ack=1 Win=85 Len=7240 TSval=2121626085 TSecr=3180722729"
"322","6.774759186","172.16.20.1","172.16.20.9","TCP","2826","0.012128085","5004  >  36330 [PSH, ACK] Seq=758600 Ack=1 Win=85 Len=2760 TSval=2121626085 TSecr=3180722729"
"324","6.776345087","172.16.20.1","172.16.20.9","TCP","972","0.001550764","5004  >  36330 [PSH, ACK] Seq=761360 Ack=1 Win=85 Len=906 TSval=2121626097 TSecr=3180722965"
"326","6.809710544","172.16.20.1","172.16.20.9","TCP","10034","0.033346329","5004  >  36330 [PSH, ACK] Seq=762266 Ack=1 Win=85 Len=9968 TSval=2121626132 TSecr=3180722967"
"328","6.996345833","172.16.20.1","172.16.20.9","TCP","5068","0.186620041","5004  >  36330 [PSH, ACK] Seq=772234 Ack=1 Win=85 Len=5002 TSval=2121626319 TSecr=3180723000"
"330","7.000204995","172.16.20.1","172.16.20.9","TCP","2889","0.003844642","5004  >  36330 [PSH, ACK] Seq=777236 Ack=1 Win=85 Len=2823 TSval=2121626319 TSecr=3180723187"
"332","7.062491635","172.16.20.1","172.16.20.9","TCP","10066","0.062260585","5004  >  36330 [PSH, ACK] Seq=780059 Ack=1 Win=85 Len=10000 TSval=2121626385 TSecr=3180723191"
"334","7.071485395","172.16.20.1","172.16.20.9","TCP","4685","0.008976682","5004  >  36330 [PSH, ACK] Seq=790059 Ack=1 Win=85 Len=4619 TSval=2121626385 TSecr=3180723253"
"336","7.248929910","172.16.20.1","172.16.20.9","TCP","8963","0.177421500","5004  >  36330 [PSH, ACK] Seq=794678 Ack=1 Win=85 Len=8897 TSval=2121626571 TSecr=3180723262"
"338","7.257029143","172.16.20.1","172.16.20.9","TCP","2738","0.008070262","5004  >  36330 [PSH, ACK] Seq=803575 Ack=1 Win=85 Len=2672 TSval=2121626572 TSecr=3180723439"
"340","7.293017198","172.16.20.1","172.16.20.9","TCP","2416","0.035963266","5004  >  36330 [PSH, ACK] Seq=806247 Ack=1 Win=85 Len=2350 TSval=2121626615 TSecr=3180723448"
"342","7.294209605","172.16.20.1","172.16.20.9","TCP","2019","0.001176915","5004  >  36330 [PSH, ACK] Seq=808597 Ack=1 Win=85 Len=1953 TSval=2121626616 TSecr=3180723484"
"344","7.337816921","172.16.20.1","172.16.20.9","TCP","7211","0.043598294","5004  >  36330 [PSH, ACK] Seq=810550 Ack=1 Win=85 Len=7145 TSval=2121626660 TSecr=3180723485"
"346","7.503249222","172.16.20.1","172.16.20.9","TCP","7450","0.165409112","5004  >  36330 [PSH, ACK] Seq=817695 Ack=1 Win=85 Len=7384 TSval=2121626826 TSecr=3180723528"
"348","7.552206699","172.16.20.1","172.16.20.9","TCP","6476","0.048927892","5004  >  36330 [PSH, ACK] Seq=825079 Ack=1 Win=85 Len=6410 TSval=2121626875 TSecr=3180723694"
"350","7.558422189","172.16.20.1","172.16.20.9","TCP","5685","0.006200935","5004  >  36330 [PSH, ACK] Seq=831489 Ack=1 Win=85 Len=5619 TSval=2121626875 TSecr=3180723743"
"352","7.755783910","172.16.20.1","172.16.20.9","TCP","10066","0.197339434","5004  >  36330 [PSH, ACK] Seq=837108 Ack=1 Win=85 Len=10000 TSval=2121627078 TSecr=3180723749"
"354","7.764850601","172.16.20.1","172.16.20.9","TCP","1120","0.008834753","5004  >  36330 [PSH, ACK] Seq=847108 Ack=1 Win=85 Len=1054 TSval=2121627079 TSecr=3180723946"
"356","7.814131790","172.16.20.1","172.16.20.9","TCP","5147","0.049232456","5004  >  36330 [PSH, ACK] Seq=848162 Ack=1 Win=85 Len=5081 TSval=2121627137 TSecr=3180723955"
"358","7.823111502","172.16.20.1","172.16.20.9","TCP","4410","0.008635410","5004  >  36330 [PSH, ACK] Seq=853243 Ack=1 Win=85 Len=4344 TSval=2121627137 TSecr=3180723955"
"360","7.826945882","172.16.20.1","172.16.20.9","TCP","1146","0.003809638","5004  >  36330 [PSH, ACK] Seq=857587 Ack=1 Win=85 Len=1080 TSval=2121627137 TSecr=3180724005"
"362","7.994449392","172.16.20.1","172.16.20.9","TCP","5413","0.167423544","5004  >  36330 [PSH, ACK] Seq=858667 Ack=1 Win=85 Len=5347 TSval=2121627317 TSecr=3180724017"
"364","8.007116494","172.16.20.1","172.16.20.9","TCP","6865","0.012359729","5004  >  36330 [PSH, ACK] Seq=864014 Ack=1 Win=85 Len=6799 TSval=2121627317 TSecr=3180724185"
"366","8.057453451","172.16.20.1","172.16.20.9","TCP","7306","0.049904914","5004  >  36330 [PSH, ACK] Seq=870813 Ack=1 Win=85 Len=7240 TSval=2121627380 TSecr=3180724198"
"368","8.063508853","172.16.20.1","172.16.20.9","TCP","2826","0.006035552","5004  >  36330 [PSH, ACK] Seq=878053 Ack=1 Win=85 Len=2760 TSval=2121627380 TSecr=3180724198"
"370","8.067073986","172.16.20.1","172.16.20.9","TCP","8754","0.003547529","5004  >  36330 [PSH, ACK] Seq=880813 Ack=1 Win=85 Len=8688 TSval=2121627380 TSecr=3180724248"
"372","8.076503437","172.16.20.1","172.16.20.9","TCP","8754","0.009380641","5004  >  36330 [PSH, ACK] Seq=889501 Ack=1 Win=85 Len=8688 TSval=2121627380 TSecr=3180724248"
"374","8.088117076","172.16.20.1","172.16.20.9","TCP","1514","0.011588681","5004  >  36330 [ACK] Seq=898189 Ack=1 Win=85 Len=1448 TSval=2121627390 TSecr=3180724254"
"375","8.088118758","172.16.20.1","172.16.20.9","TCP","11650","0.000001682","5004  >  36330 [PSH, ACK] Seq=899637 Ack=1 Win=85 Len=11584 TSval=2121627390 TSecr=3180724258"
"377","8.103203711","172.16.20.1","172.16.20.9","TCP","11650","0.015026735","5004  >  36330 [PSH, ACK] Seq=911221 Ack=1 Win=85 Len=11584 TSval=2121627390 TSecr=3180724258"
"379","8.114006814","172.16.20.1","172.16.20.9","TCP","5858","0.010779607","5004  >  36330 [PSH, ACK] Seq=922805 Ack=1 Win=85 Len=5792 TSval=2121627411 TSecr=3180724279"
"381","8.120825253","172.16.20.1","172.16.20.9","TCP","5858","0.006803791","5004  >  36330 [PSH, ACK] Seq=928597 Ack=1 Win=85 Len=5792 TSval=2121627426 TSecr=3180724294"
"383","8.125947573","172.16.20.1","172.16.20.9","TCP","1514","0.005097589","5004  >  36330 [ACK] Seq=934389 Ack=1 Win=85 Len=1448 TSval=2121627443 TSecr=3180724311"
"384","8.127710149","172.16.20.1","172.16.20.9","TCP","4410","0.001762576","5004  >  36330 [PSH, ACK] Seq=935837 Ack=1 Win=85 Len=4344 TSval=2121627443 TSecr=3180724311"
"386","8.133528750","172.16.20.1","172.16.20.9","TCP","4410","0.005804839","5004  >  36330 [PSH, ACK] Seq=940181 Ack=1 Win=85 Len=4344 TSval=2121627443 TSecr=3180724311"
"388","8.138906390","172.16.20.1","172.16.20.9","TCP","1578","0.005360385","5004  >  36330 [PSH, ACK] Seq=944525 Ack=1 Win=85 Len=1512 TSval=2121627450 TSecr=3180724318"
"390","8.232993679","172.16.20.1","172.16.20.9","TCP","5858","0.094068808","5004  >  36330 [PSH, ACK] Seq=946037 Ack=1 Win=85 Len=5792 TSval=2121627555 TSecr=3180724329"
"392","8.238008651","172.16.20.1","172.16.20.9","TCP","4274","0.004962927","5004  >  36330 [PSH, ACK] Seq=951829 Ack=1 Win=85 Len=4208 TSval=2121627555 TSecr=3180724329"
"394","8.243034087","172.16.20.1","172.16.20.9","TCP","5858","0.004993156","5004  >  36330 [PSH, ACK] Seq=956037 Ack=1 Win=85 Len=5792 TSval=2121627556 TSecr=3180724424"
"396","8.248204654","172.16.20.1","172.16.20.9","TCP","2962","0.005112189","5004  >  36330 [PSH, ACK] Seq=961829 Ack=1 Win=85 Len=2896 TSval=2121627561 TSecr=3180724429"
"398","8.252958807","172.16.20.1","172.16.20.9","TCP","6330","0.004730489","5004  >  36330 [PSH, ACK] Seq=964725 Ack=1 Win=85 Len=6264 TSval=2121627561 TSecr=3180724429"
"400","8.373188400","172.16.20.1","172.16.20.9","TCP","5858","0.120177355","5004  >  36330 [PSH, ACK] Seq=970989 Ack=1 Win=85 Len=5792 TSval=2121627696 TSecr=3180724443"
"402","8.378549867","172.16.20.1","172.16.20.9","TCP","4274","0.005341096","5004  >  36330 [PSH, ACK] Seq=976781 Ack=1 Win=85 Len=4208 TSval=2121627696 TSecr=3180724443"
"404","8.383678203","172.16.20.1","172.16.20.9","TCP","7306","0.004967422","5004  >  36330 [PSH, ACK] Seq=980989 Ack=1 Win=85 Len=7240 TSval=2121627696 TSecr=3180724564"
"406","8.391392089","172.16.20.1","172.16.20.9","TCP","1514","0.007163362","5004  >  36330 [ACK] Seq=988229 Ack=1 Win=85 Len=1448 TSval=2121627706 TSecr=3180724569"
"407","8.391394030","172.16.20.1","172.16.20.9","TCP","7306","0.000001941","5004  >  36330 [PSH, ACK] Seq=989677 Ack=1 Win=85 Len=7240 TSval=2121627706 TSecr=3180724569"
"409","8.400411211","172.16.20.1","172.16.20.9","TCP","7306","0.008944605","5004  >  36330 [PSH, ACK] Seq=996917 Ack=1 Win=85 Len=7240 TSval=2121627706 TSecr=3180724569"
"411","8.406558491","172.16.20.1","172.16.20.9","TCP","7306","0.005919838","5004  >  36330 [PSH, ACK] Seq=1004157 Ack=1 Win=85 Len=7240 TSval=2121627714 TSecr=3180724575"
"413","8.414707617","172.16.20.1","172.16.20.9","TCP","2902","0.008125947","5004  >  36330 [PSH, ACK] Seq=1011397 Ack=1 Win=85 Len=2836 TSval=2121627729 TSecr=3180724597"
"415","8.417605908","172.16.20.1","172.16.20.9","TCP","7306","0.002877933","5004  >  36330 [PSH, ACK] Seq=1014233 Ack=1 Win=85 Len=7240 TSval=2121627740 TSecr=3180724605"
"417","8.424926164","172.16.20.1","172.16.20.9","TCP","2826","0.006793046","5004  >  36330 [PSH, ACK] Seq=1021473 Ack=1 Win=85 Len=2760 TSval=2121627740 TSecr=3180724605"
"419","8.427830675","172.16.20.1","172.16.20.9","TCP","5858","0.002883928","5004  >  36330 [PSH, ACK] Seq=1024233 Ack=1 Win=85 Len=5792 TSval=2121627740 TSecr=3180724605"
"421","8.433626263","172.16.20.1","172.16.20.9","TCP","1113","0.005443402","5004  >  36330 [PSH, ACK] Seq=1030025 Ack=1 Win=85 Len=1047 TSval=2121627748 TSecr=3180724615"
"423","8.486277290","172.16.20.1","172.16.20.9","TCP","7306","0.051917765","5004  >  36330 [PSH, ACK] Seq=1031072 Ack=1 Win=85 Len=7240 TSval=2121627809 TSecr=3180724625"
"425","8.493223017","172.16.20.1","172.16.20.9","TCP","2826","0.006885841","5004  >  36330 [PSH, ACK] Seq=1038312 Ack=1 Win=85 Len=2760 TSval=2121627809 TSecr=3180724625"
"427","8.498748297","172.16.20.1","172.16.20.9","TCP","8754","0.005493650","5004  >  36330 [PSH, ACK] Seq=1041072 Ack=1 Win=85 Len=8688 TSval=2121627816 TSecr=3180724684"
"429","8.514690434","172.16.20.1","172.16.20.9","TCP","8754","0.015879505","5004  >  36330 [PSH, ACK] Seq=1049760 Ack=1 Win=85 Len=8688 TSval=2121627816 TSecr=3180724684"
"431","8.522229849","172.16.20.1","172.16.20.9","TCP","8754","0.007503961","5004  >  36330 [PSH, ACK] Seq=1058448 Ack=1 Win=85 Len=8688 TSval=2121627821 TSecr=3180724684"
"433","8.532429078","172.16.20.1","172.16.20.9","TCP","7306","0.010175981","5004  >  36330 [PSH, ACK] Seq=1067136 Ack=1 Win=85 Len=7240 TSval=2121627837 TSecr=3180724705"
"435","8.540390224","172.16.20.1","172.16.20.9","TCP","1514","0.007937884","5004  >  36330 [ACK] Seq=1074376 Ack=1 Win=85 Len=1448 TSval=2121627855 TSecr=3180724723"
"436","8.540392148","172.16.20.1","172.16.20.9","TCP","5858","0.000001924","5004  >  36330 [PSH, ACK] Seq=1075824 Ack=1 Win=85 Len=5792 TSval=2121627855 TSecr=3180724723"
"438","8.546745180","172.16.20.1","172.16.20.9","TCP","5858","0.006098856","5004  >  36330 [PSH, ACK] Seq=1081616 Ack=1 Win=85 Len=5792 TSval=2121627855 TSecr=3180724723"
"440","8.565581916","172.16.20.1","172.16.20.9","TCP","5858","0.018811439","5004  >  36330 [PSH, ACK] Seq=1087408 Ack=1 Win=85 Len=5792 TSval=2121627863 TSecr=3180724731"
"442","8.572999590","172.16.20.1","172.16.20.9","TCP","5858","0.007392382","5004  >  36330 [PSH, ACK] Seq=1093200 Ack=1 Win=85 Len=5792 TSval=2121627869 TSecr=3180724737"
"444","8.577658241","172.16.20.1","172.16.20.9","TCP","5858","0.004633815","5004  >  36330 [PSH, ACK] Seq=1098992 Ack=1 Win=85 Len=5792 TSval=2121627888 TSecr=3180724756"
"446","8.585725193","172.16.20.1","172.16.20.9","TCP","4410","0.008035930","5004  >  36330 [PSH, ACK] Seq=1104784 Ack=1 Win=85 Len=4344 TSval=2121627896 TSecr=3180724764"
"448","8.588890194","172.16.20.1","172.16.20.9","TCP","1514","0.003060100","5004  >  36330 [ACK] Seq=1109128 Ack=1 Win=85 Len=1448 TSval=2121627908 TSecr=3180724776"
"449","8.590989818","172.16.20.1","172.16.20.9","TCP","2432","0.002099624","5004  >  36330 [PSH, ACK] Seq=1110576 Ack=1 Win=85 Len=2366 TSval=2121627908 TSecr=3180724776"
"451","8.593509173","172.16.20.1","172.16.20.9","TCP","4410","0.002508721","5004  >  36330 [PSH, ACK] Seq=1112942 Ack=1 Win=85 Len=4344 TSval=2121627908 TSecr=3180724776"
"453","8.597418243","172.16.20.1","172.16.20.9","TCP","4410","0.003723554","5004  >  36330 [PSH, ACK] Seq=1117286 Ack=1 Win=85 Len=4344 TSval=2121627912 TSecr=3180724776"
"455","8.602379568","172.16.20.1","172.16.20.9","TCP","4410","0.004948421","5004  >  36330 [PSH, ACK] Seq=1121630 Ack=1 Win=85 Len=4344 TSval=2121627916 TSecr=3180724781"
"457","8.607171656","172.16.20.1","172.16.20.9","TCP","5858","0.004773366","5004  >  36330 [PSH, ACK] Seq=1125974 Ack=1 Win=85 Len=5792 TSval=2121627916 TSecr=3180724781"
"459","8.612649743","172.16.20.1","172.16.20.9","TCP","5858","0.005078831","5004  >  36330 [PSH, ACK] Seq=1131766 Ack=1 Win=85 Len=5792 TSval=2121627920 TSecr=3180724788"
"461","8.618638828","172.16.20.1","172.16.20.9","TCP","5858","0.005977920","5004  >  36330 [PSH, ACK] Seq=1137558 Ack=1 Win=85 Len=5792 TSval=2121627930 TSecr=3180724793"
